,Doc,Topic,Doc_ID,ticker,sim_sect
464,"Live Nation Entertainment, Inc. is a live entertainment company that is engaged in the business of the promotion of live events. The Company’s segments include Concerts, Ticketing and Sponsorship & Advertising. The Concerts segment involves the promotion of live music events globally and its owned & operated venues and rented third-party venues. The Ticketing segment involves the management of global ticketing operations, including providing ticketing software and services to clients, and consumers with a marketplace, online and mobile, for tickets and event information through its Website, www.ticketmaster.com. The Sponsorship & Advertising segment manages the development of strategic sponsorship programs in addition to the sale of international, national and local sponsorships and placement of advertising, such as signage, promotional programs and rich media offerings.",-1,464,LYV.N,0.23060122
269,"Arista Networks, Inc. is a supplier of cloud networking solutions that use software to address the needs of Internet companies, cloud service providers and data centers for enterprise support. The Company develops, markets and sells cloud networking solutions, which consist of Extensible Operating System (EOS), a set of network applications and its Ethernet switching and routing platforms. The Company software supports VMware NSX, OpenConfig/YANG and Microsoft System Center for orchestration and provisioning, enabling workload mobility and automatic provisioning of physical switches. Its EOS software enables user, through application programming interfaces (APIs), to write their own scripts to customize and optimize their networks.",-1,269,ANET.N,0.23041792
38,"VeriSign, Inc. is a global provider of domain name registry services and Internet infrastructure. The Company enables the security, stability, and resiliency of key Internet infrastructure and services, including providing root zone maintainer services, operating two global Internet root servers, and providing registration services and authoritative resolution for the .com and .net top-level domains (TLDs), which supports the majority of global electronic-commerce. It operates the authoritative directory and the back-end systems for all .com, .net, .cc, .tv, .gov, .jobs, .edu and .name domain names, among others. The Company's services allow individuals and organizations to establish their online identities, while providing the secure, always-on access they need to communicate and transact reliably with online audiences. It also provides internationalized domain name (IDN) services that enable Internet users to access domain names in characters representing their local language.",-1,38,VRSN.OQ,0.22865754
81,"JPMorgan Chase & Co. is a financial holding company. The Company is engaged in investment banking, financial services and asset management. It operates in four segments, as well as a Corporate segment. Its segments are Consumer & Community Banking, Corporate & Investment Bank, Commercial Banking and Asset Management. The Consumer & Community Banking segment offers services to consumers and businesses through bank branches, automatic teller machines, online, mobile and telephone banking. The Corporate & Investment Bank segment, comprising Banking and Markets and Investor Services, offers investment banking, market-making, prime brokerage, and treasury and securities products and services to corporations, investors, financial institutions, and government and municipal entities. The Commercial Banking segment provides financial solutions, including lending, treasury services, investment banking and asset management. The Asset Management segment comprises investment and wealth management.",-1,81,JPM.N,0.22714648
5171,"Harman International Industries Inc is also known as HARMAN International (HARMAN) is United States-based company. The Company provides designs and engineers connected products and solutions for automakers, consumers, and enterprises worldwide, including connected car systems, audio and visual products, enterprise automation solutions; and services supporting the Internet of Things. Its brands includes, AKG, Harman Kardon, Infinity, JBL, Lexicon, Mark Levinson, and Revel. HARMAN provides audio and connected car systems services. It offers software services of mobile devices and systems which are connected, integrated and secure across all platforms, from work and home to car and mobile. HARMAN is wholly owned subsidiary of Samsung Electronics Co, LTD.",-1,5171,HAR.N^C17,0.22712949
5236,"PetSmart, Inc. is a United States-based company, which is a pet retailer of services and solutions for the needs of pets. The Company provides a range of pet food and pet products. The Company offers dog training, pet grooming, pet boarding, PetSmart Doggie Day Camp day care services and pet adoption services in-store. The Company’s portfolio of digital resources for pet parents, including PetSmart.com, PetFoodDirect.com, Pet360.com and petMD.com, offers online pet supplies and pet care information in the United States. PetSmart, PetSmart Charities and PetSmart Charities of Canada work with nearly 4,000 animal welfare organizations to bring adoptable pets into stores. It operates approximately 1,650 pet stores in the United States, Canada and Puerto Rico, as well as more than 200 in-store PetSmart PetsHotel dog and cat boarding facilities.",-1,5236,PETM.OQ^C15,0.22641551
51,"Paycom Software, Inc. is a provider of a cloud-based human capital management (HCM) software solution delivered as Software-as-a-Service (SaaS). The Company provides functionality and data analytics that businesses need to manage the complete employment life cycle from recruitment to retirement. The Company's applications streamline client processes and provide clients and their employees with the ability to directly access and manage administrative processes, including applications that identify candidates, on-board employees, manage time and labor, administer payroll deductions and benefits, manage performance, terminate employees and administer post-termination health benefits, such as COBRA. The Company's solution allows clients to analyze employee information to make business decisions. The Company's HCM solution offers a range of applications, including talent acquisition, time and labor management, payroll, talent management and human resources (HR) management applications.",-1,51,PAYC.N,0.21974193
304,"Wynn Resorts, Limited (Wynn Resorts) is a developer, owner and operator of destination casino resorts that integrate accommodations and a range of amenities, including dining outlets, retail offerings, entertainment theaters and meeting complexes. The Company's segments include Macau Operations and Las Vegas Operations. The Company's Macau Operations include Wynn Macau and Wynn Palace. It also includes Encore, an expansion at Wynn Macau. The Company's Las Vegas Operations include Wynn Las Vegas and Encore, an expansion at Wynn Las Vegas. Wynn Las Vegas is located at the intersection of the Las Vegas Strip and Sands Avenue. As of December 31, 2016, it occupied approximately 215 acres of land fronting the Las Vegas Strip. As of December 31, 2016, the Company owned approximately 18 acres across Sands Avenue. The Company is constructing Wynn Boston Harbor, an integrated casino resort in Everett, Massachusetts.",-1,304,WYNN.OQ,0.21742445
23,"Paychex, Inc. is a provider of integrated human capital management (HCM) solutions for payroll, human resource (HR), retirement and insurance services for small- to medium-sized businesses in the United States. It combines its software-as-a-service (SaaS) technology and mobility platform with personal service and allows business owners to focus on the growth and management of their business. The Company, through its HCM software-as-a-service platform, Paychex Flex, provides an integrated product suite that covers the employee life cycle from recruiting and hiring to retirement. Its Paychex Flex uses a device-independent design throughout its HCM suite, which allows functionality of all application components, regardless of device or screen size.",-1,23,PAYX.OQ,0.21414107
264,"Ulta Beauty, Inc. is a holding company for the Ulta Beauty group of companies. The Company is a beauty retailer. The Company offers cosmetics, fragrance, skin, hair care products and salon services. The Company offers approximately 20,000 products from over 500 beauty brands across all categories, including the Company’s own private label. The Company also offers a full-service salon in every store featuring hair, skin and brow services. The Company operates approximately 970 retail stores across over 48 states and the District of Columbia and also distributes its products through its Website, which includes a collection of tips, tutorials and social content. The Company offers makeup products, such as foundation, face powder, concealer, color correcting, face primer, blush, bronzer, contouring, highlighter, setting spray, shampoos, conditioners, hair styling products, hair styling tools and perfumes. The Company also offers makeup brushes and tools, and makeup bags and cases.",-1,264,ULTA.OQ,0.20580386
465,"Juniper Networks, Inc. designs, develops and sells products and services for high-performance networks to enable customers to build networks for their businesses. The Company sells its products in over 150 countries in three geographic regions: Americas; Europe, the Middle East and Africa (EMEA), and Asia Pacific (APAC). The Company sells its high-performance network products and service offerings across routing, switching and security technologies. Its products and services address network requirements for its customers, including Cloud, Service Provider, and Enterprise. The Company offers its customers various services including maintenance and support, professional services, and education and training programs. The Company's Junos Platform enables its customers to expand network software into the application space and deploy software clients to control delivery. The Junos Platform includes a range of products, such as Junos Operating System (OS) Evolved.",-1,465,JNPR.N,0.2030872
5188,"Jefferies Financial Group Inc. is engaged in investment banking and capital markets, asset management and direct investing. The Company's segments include Investment Banking and Capital Markets, and Asset Management. The Investment Banking and Capital Markets segment includes investment banking, capital markets and other related services. Investment banking provides underwriting and financial advisory services to clients across various industry sectors in the Americas, Europe and Asia Pacific. Capital markets businesses operate across the spectrum of equities and fixed income products. The Asset Management segment includes managing, investing in and providing services to a diverse group of alternative asset management platforms across a spectrum of investment strategies and asset classes. Asset Management offers institutional clients a range of investment strategies through its affiliated managers. Merchant Banking consists of Its various merchant banking businesses and investments.",-1,5188,JEF.N,0.20006329
5246,"QLogic Corp. is a United States-based company that designs and supplies server and storage networking connectivity products that provide and manage computer data communication. The Company's products facilitate the transfer of data and enable resource sharing between servers, networks and storage. Its products are used in enterprise, managed service provider, consumer Web, and cloud service provider data centers. . Its products are based primarily on Fiber Channel and Ethernet technologies and are used in connection with storage networks, data networks and converged networks. Storage networks are used to provide access to storage across enterprise environments. Fibre Channel is a technology for enterprise storage networking. Data networks are used to provide workstation-to-server, server-to-server, and server-to-storage connectivity using Ethernet. Converged networks address the data center by consolidating and unifying storage and data networks, using high-speed Ethernet.",-1,5246,QLGC.OQ^H16,0.19772747
79,"Keysight Technologies, Inc. (Keysight) is a technology company that provides electronic measurement instruments, design and test software and systems related services. The Company’s operating segments include Communications Solutions Group (CSG) and Electronics Industrial Solutions Group (EISG). CSG segment serves customers spanning the worldwide, including commercial communications and aerospace, defense, and government end markets. CSG’s solutions consist of electronic design and test software, electronic measurement instruments, systems and related services. EISG provides test and measurement solutions and related services across a set of electronic industrial end markets, focusing on applications in the automotive and energy industries and measurement solutions for consumer electronics, education, general electronics design and manufacturing, and semiconductor design and manufacturing.",-1,79,KEYS.N,0.19467975
364,"Etsy, Inc. (Etsy) operates two-sided online marketplaces that connect people and buyers, and sellers around the world. Its primary marketplace, Etsy.com, is the global destination for creative goods. For sellers, the Company offers a range of tools and services that address key business needs. For the Etsy marketplace, primary optional services include on-site advertising services, which allow Etsy sellers to pay for placement of their listings in search results, and Etsy Shipping Labels. For the Reverb marketplace, optional services include Bump, an on-site advertising product that enables Reverb sellers to determine their ad rates as a percentage of their item's final sale price, and Reverb Shipping Labels.",-1,364,ETSY.OQ,0.15562645
276,"Netflix, Inc. is a provider of subscription streaming entertainment service. The Company has paid streaming memberships in over 190 countries and it allows members to watch a variety of television (TV) series, documentaries and feature films across a variety of genres and languages. Members can watch as much as they want, anytime, anywhere, on any Internet-connected screen. Members can play, pause and resume watching, without commercials. It offers a variety of streaming membership plans, the price of which varies by country and the features of the plan. Members can watch content from Netflix through any Internet-connected device, including televisions (TVs), digital video players, television set-top boxes and mobile devices. The Company acquires, licenses and produces content, including original programing.",-1,276,NFLX.OQ,0.14088213
238,"Apple Inc. designs, manufactures and markets smartphones, personal computers, tablets, wearables and accessories, and sells a variety of related services. The Company’s products include iPhone, Mac, iPad, and Wearables, Home and Accessories. iPhone is the Company’s line of smartphones based on its iOS operating system. Mac is the Company’s line of personal computers based on its macOS operating system. iPad is the Company’s line of multi-purpose tablets based on its iPadOS operating system. Wearables, Home and Accessories includes AirPods, Apple TV, Apple Watch, Beats products, HomePod, iPod touch and other Apple-branded and third-party accessories. AirPods are the Company’s wireless headphones that interact with Siri. Apple Watch is the Company’s line of smart watches. Its services include Advertising, AppleCare, Cloud Services, Digital Content and Payment Services. Its customers are primarily in the consumer, small and mid-sized business, education, enterprise and government markets.",-1,238,AAPL.OQ,0.11748711
5228,"Novellus Systems, Inc. is a United States-based company. The Company is an industrial machinery and equipment wholesaler.",0,5228,NVLS.OQ^F12,0.3334013
5075,"Altaba Inc. is a United States-based independent, non-diversified, closed-end management investment company. The funds assets primarily consist of a mix of cash and cash equivalents. Prior to June 16, 2017, Altaba was known as Yahoo! Inc. Altaba was created from Yahoo! Inc. after the sale of it's operating businesses, at which time Yahoo! Inc. reorganized as an investment company, was renamed Altaba Inc., and began trading under the Nasdaq ticker symbol AABA.",0,5075,AABA.OQ^J19,0.30187976
37,"Stryker Corporation is a medical technology company. The Company offers a range of medical technologies, including orthopedic, medical and surgical, and neurotechnology and spine products. Its segments include Orthopaedics, MedSurg, Neurotechnology and Spine. The Orthopaedics segment includes reconstructive (hip and knee) and trauma implant systems and other related products. The MedSurg segment includes surgical equipment and surgical navigation systems; endoscopic and communications systems; patient handling, emergency medical equipment, intensive care disposable products; reprocessed and remanufactured medical devices, and other related products. The Neurotechnology and Spine segment includes neurovascular products, spinal implant systems and other related products. Its products include implants, which are used in joint replacement and trauma surgeries, and other products. It offers musculoskeletal care and sensor technology for total joint replacement.",1,37,SYK.N,0.70576435
28,"Bio-Rad Laboratories, Inc. manufactures and supplies the life science research, healthcare, analytical chemistry and other markets with a range of products and systems used to separate chemical and biological materials and to identify, analyze and purify their components. The Company operates through two segments: Life Science and Clinical Diagnostics. Life Science segment markets and develops, manufactures and markets approximately 6,000 reagents, apparatus and laboratory instruments. Its products are used in research techniques, biopharmaceutical production processes and food testing regimes. Clinical Diagnostics segment designs, manufactures, sells and supports test systems, informatics systems, test kits and specialized quality controls that serve clinical laboratories in the global diagnostics market.",1,28,BIO.N,0.69428796
130,"Laboratory Corporation of America Holdings is a life sciences company that provides clinical laboratory and end-to-end drug development services. The Company’s business segments include Labcorp Diagnostics (Dx) and Labcorp Drug Development (DD). Through its Dx and DD segments, the Company provides diagnostic, drug development and technology enabled solutions. The Company also supports clinical trial activity in approximately 100 countries through its industry central laboratory, preclinical, and clinical development businesses. Dx segment operates through a network of patient service centers, branches, rapid response laboratories, primary laboratories, and specialty laboratories. DD segment, which operates on a global scale. The Company serves a range of customers, including doctors, hospitals, pharmaceutical companies, researchers, governmental agencies, physicians and other healthcare providers.",1,130,LH.N,0.62092626
32,"Ventas, Inc. is a real estate investment trust (REIT) operating at the intersection of healthcare and real estate. The Company owns or has investment in approximately 1,200 properties. It operates through three segments: triple-net leased properties, senior living operations and office operations. In triple-net leased properties segment, it invests in and owns senior housing and healthcare properties across the United States and the United Kingdom and lease those properties to healthcare operating companies under triple-net or absolute-net leases. In senior living operations segment, it invests in senior housing communities throughout the United States and Canada and engages independent operators, such as Atria and Sunrise, to manage those communities. In office operations segment, its primarily acquire, owns, develops, leases and manages medical office buildings and life science, research and innovation centers throughout the United States.",1,32,VTR.N,0.6206431
5196,"Life Technologies Corporation (Life Technologies) is a global life sciences company. The Company's systems, consumables and services enable scientific researchers and commercial markets to accelerate scientific exploration, to discoveries and developments that improve the quality of life. The Company's products are also used in forensics, food and water safety, animal health testing and other industrial applications. The Company established Global Instrument Center of Excellence in Singapore. It acquired Pinpoint Genomics, Inc. Also, the Company acquired Compendia Bioscience, a cancer bioinformatics company used by the pharmaceutical industry to identify gene targets for drug discovery and development. Further, the Company acquired Advanced Microscopy Group (AMG). The Company acquired KDR Biotech Co., Ltd. Furthermore, the Company acquired Life Science Korea (LSK). Also, Thermo Fisher Scientific Inc completed the acquisition of Life Technologies Corp.",1,5196,LIFE.OQ^B14,0.601891
205,"Fortive Corporation is a diversified industrial growth company. The Company designs, develops, manufactures and markets professional and engineered products, software and services for a range of end markets. It operates through three segments: Intelligent Operating Solutions, Precision Technologies and Advanced Healthcare Solutions. Intelligent Operating Solutions segment offers various Products and services under a range of brands, including Accruent, Fluke, Fluke networks, Gordian, Industrial Scientific, Intelex, and Pruftechnik. Precision Technologies segment provides electrical test and measurement instruments and services, energetic material devices, and a range of sensor and control system solutions. Advanced Healthcare Solutions segment provides hardware and software portfolio offerings, which include instrument and device reprocessing, instrument tracking, cell therapy equipment design and manufacturing, biomedical test tools, radiation safety monitoring, and asset management.",1,205,FTV.N,0.5810162
177,"Baxter International Inc., through its subsidiaries, provides a portfolio of essential healthcare products. The Company’s products include renal care, medication delivery, pharmaceuticals, clinical nutrition, advanced surgery and acute therapies. Its renal care offering includes peritoneal dialysis (PD), hemodialysis (HD) and additional dialysis therapies and services. Its medication delivery offerings include intravenous (IV) therapies, infusion pumps, administration sets and drug reconstitution devices. Its pharmaceuticals offerings include premixed and oncology drug platforms, inhaled anesthesia and critical care products and pharmacy compounding services. Its clinical nutrition offerings include parenteral nutrition (PN) therapies and related products. Its advanced surgery offerings include biological products and medical devices used in surgical procedures for hemostasis, tissue sealing and adhesion prevention. It also offers polysaccharide hemostatic system (PerClot) products.",1,177,BAX.N,0.5609948
274,"McKesson Corporation is focused distributing pharmaceuticals and providing health information technology, medical supplies, and care management tools. The Company’s segments include U.S. Pharmaceutical, International, Medical-Surgical Solutions, and Prescription Technology Solutions (RxTS). The U.S. Pharmaceutical segment provides distribution and logistics services for branded, generic, specialty, biosimilar, and over-the-counter pharmaceutical drugs and other healthcare-related products. The International segment provides distribution and services to wholesale, institutional, and retail customers in 13 European countries and Canada. Medical-Surgical Solutions segment provides medical-surgical supply distribution, logistics, and other services to healthcare providers. RxTS segment combines its technologies, including CoverMyMeds, RelayHealth, RxCrossroads, and McKesson Prescription Automation, to serve its biopharma and life sciences partners and patients.",1,274,MCK.N,0.5601039
159,"Thermo Fisher Scientific Inc. develops, manufactures and sells a range of products. The Company operates through four segments: Life Sciences Solutions, Analytical Instruments, Specialty Diagnostics, and Laboratory Products and Services. It offers its products and services through various brands, including Thermo Scientific, Applied Biosystems, Invitrogen, Fisher Scientific and Unity Lab Services. Life Sciences Solutions segment provides a portfolio of reagents, instruments and consumables used in biological and medical research, discovery and production of new drugs and vaccines. Analytical Instruments segment provides a broad offering of instruments, consumables, software and services that are used for a range of applications in the laboratory. Specialty Diagnostics segment offers a wide range of diagnostic test kits, reagents, culture media, instruments and associated products. Its Laboratory Products and Services segment offers products and solutions needed for the laboratory.",1,159,TMO.N,0.5595888
