,Doc,Topic,Doc_ID,ticker,sim_sect
0,"Pool Corporation is a distributor of swimming pool supplies, equipment and related leisure products. The Company is a distributor of irrigation and landscape products in the United States. The Company operates sales centers in North America, Europe and Australia through its distribution networks, which includes SCP Distributors (SCP), Superior Pool Products (Superior), Horizon Distributors (Horizon), and National Pool Tile (NPT). The Company's NPT network primarily serves the swimming pool market but does provide some overlap with the irrigation and landscape industries as it offers its brand of pool tile, composite pool finish products and hardscapes. It also offers virtual tools for homeowners to select and design their pool and outdoor environments, working with their chosen contractors to install these products.",-1,0,POOL.OQ,0.7401492
3,"CenterPoint Energy, Inc is a public utility holding company. The Company, through its subsidiaries, owns and operates electric transmission, distribution and generation facilities and natural gas distribution facilities and provides energy performance contracting and sustainable infrastructure services. The Company provides electric transmission service to transmission service customers in the Electric Reliability Council of Texas (ERCOT) region and distribution service to retail electric providers (REPs) serving the Texas Gulf Coast area that includes the city of Houston. It owns and operates natural gas distribution facilities in states and owns and operates pipeline connections through interconnects with various interstate and intrastate pipeline companies and provide temporary delivery of liquefied natural gas (LNG) and compressed natural gas (CNG) throughout the states.",-1,3,CNP.N,0.69341314
4,"Amcor plc is a packaging company. The Company’s segments include Flexibles and Rigid Plastics. The Company offers a range of packaging related products and services, including packaging for beverages, food, healthcare, and personal and home care, tobacco and industrial applications. The Flexibles consists of operations that manufacture flexible and film packaging in the food and beverage, medical and pharmaceutical, fresh produce, snack food, personal care and other industries. The Rigid Plastics consists of operations that manufacture rigid plastic containers for a range of predominantly beverage and food products, including carbonated soft drinks, water, juices, sports drinks, milk-based beverages, spirits and beer, sauces, dressings, spreads and personal care item and plastic caps for a variety of applications.",-1,4,AMCR.N,0.5575219
5155,"Fluor Corporation is a holding company, which provides engineering, procurement, construction, fabrication and modularization, operations, maintenance and asset integrity, as well as project management services. The Company's segments include Energy Solutions, Urban Solutions, Mission Solutions and Other. The Energy Solutions segment is focused on energy transition, chemicals, liquefied natural gas (LNG), and traditional oil and gas opportunities. This segment also provides engineering, procurement and construction (EPC) services for the oil, gas and petrochemical industries. The Urban Solutions segment is focused on mining, metals, advanced technologies, manufacturing, infrastructure and professional staffing services. The Mission Solutions segment is focused on federal agencies across the United States Government and international opportunities. These includes the Department of Energy (DOE), the Department of Defense, the Federal Emergency Management Agency and intelligence agencies.",-1,5155,FLR.N,0.5385518
19,"Carrier Global Corp is a provider of heating, ventilation, and air conditioning (HVAC), refrigeration, fire and security solutions. It operates through three segments: HVAC; Refrigeration; and Fire & Security. The HVAC segment provides products, controls, services and solutions to meet the heating and cooling needs of residential and commercial customers. The Refrigeration segment is comprised of transport refrigeration and commercial refrigeration products and solutions. Its transport refrigeration products and services include refrigeration and monitoring systems for trucks, trailers, shipping containers, intermodal and rail. Its commercial refrigeration equipment solutions preserve freshness of retail food and beverage. Its fire and security products include a range of residential and building systems, including fire, flame, gas, smoke and carbon monoxide detection; fire extinguishers; fire suppression systems, intruder alarms; access control systems and video management systems.",-1,19,CARR.N,0.51803774
190,"American Water Works Company, Inc. is a water and wastewater utility company. The Company's businesses include Market-Based Businesses and Regulated Businesses. Its Market-Based Businesses include the operating segments, Homeowner Services Group and Military Services Group. The Homeowner Services Group provides various warranty protection programs and other home services to residential customers. The Military Services Group enters into long-term contracts with the United States Government to provide water and wastewater services on various military installations. The Company also has contracts with municipal customers to operate and manage water and wastewater facilities and provides other related services through its Contract Services Group. The Regulated Businesses includes the ownership of utilities that provide water and wastewater services to residential, commercial, industrial, public authority, fire service and sale for resale customers.",-1,190,AWK.N,0.5025967
5259,"Spectra Energy LLC is a United States-based natural gas distribution company. The Company owns and operates a diversified portfolio of complementary natural gas-related energy assets. It also owns and operates and diversified portfolio of complementary natural gas-related energy assets. It operates in three key areas of the natural gas industry: gathering and processing, transmission and storage, and distribution. It also provide transmission and storage of natural gas to customers in various regions of the northeastern and southeastern U.S., the Maritime provinces in Canada, the Pacific Northwest in the U.S. and Canada, and in the province of Ontario, Canada. It also provides natural gas sales and distribution services to retail customers in Ontario, and natural gas gathering and processing services to customers in western Canada.",-1,5259,SE.N^B17,0.49684322
353,"Church & Dwight Co., Inc. develops, manufactures and markets a range of consumer household and personal care products and specialty products focused on animal and food production, chemicals and cleaners. Its consumer products are focused principally on the Company’s 13 power brands. It operates through three segments: Consumer Domestic, Consumer International and the Specialty Products Division (SPD). Consumer Domestic segment is engaged in providing household and personal care products. Its household products include laundry, deodorizing, and cleaning products, and personal care products include condoms, pregnancy kits, oral care products, skin care products, hair care products and gummy dietary supplements. Consumer International segment manufactures and sells personal care products to the Consumer Domestic segment. The SPD segment focuses on sales to businesses and participates in three product areas, animal and food production, specialty chemicals and specialty cleaners.",-1,353,CHD.N,0.49403793
168,"A. O. Smith Corporation is a provider of water heating and water treatment solutions. The Company operates through two segments: North America and Rest of World. The Rest of World segment is primarily comprised of China, Europe, and India. Both segments manufacture and market a range of residential and commercial gas and electric water heaters, boilers, tanks, and water treatment products. Both segments primarily manufacture and market in their respective regions of the world. The North America segment also manufactures expansion tanks, commercial solar water heating systems, swimming pool and spa heaters, related products, and parts. The Company's Lochinvar brand is a residential and commercial boiler brands in the United States. It sells its Aquasana branded products directly to consumers through e-commerce as well as on-line retailers. The Company’s water softener branded products and problem well water solutions include Hague, WaterBoss, Water-Right, WaterCare, and Evolve.",-1,168,AOS.N,0.4889933
485,"Xylem Inc. is a water technology company. The Company designs, manufactures and services engineered solutions across a range of critical applications. It is an equipment and service provider for water and wastewater applications with a portfolio of products and services addressing the cycle of water, from collection, distribution and use to the return of water to the environment. The Company operates through three segments: Water Infrastructure, Applied Water, and Measurement & Control Solutions. The Water Infrastructure segment focuses on the transportation and treatment of water, offering a range of products including water, wastewater and storm water pumps, treatment equipment, and controls and systems. The Applied Water segment serves the uses of water and focuses on the residential, commercial and industrial markets. The Measurement & Control Solutions segment develops advanced technology solutions that enables the use and conservation of critical water and energy resources.",-1,485,XYL.N,0.48298478
285,"United Rentals, Inc. is a holding company that is engaged in the equipment rental business. The Company rents equipment to a varied customer base that includes construction and industrial companies, manufacturers, utilities, municipalities, homeowners, and government entities in the United States, Canada, and Europe. The Company’s segments include general rentals and trench, power and fluid solutions. The general rentals segment includes the rental of general construction and industrial equipment, and material handling equipment, aerial work platforms, such as boom lifts and scissor lifts, and general tools and light equipment, such as pressure washers, water pumps, and power tools. The trench, power and fluid solutions segment includes the rental of specialty construction products such as trench safety equipment, including trench shields, aluminum hydraulic shoring systems, slide rails, crossing plates, construction lasers, and line testing equipment for underground work.",-1,285,URI.N,0.47257936
5156,"Flowserve Corporation is a manufacturer and aftermarket service provider of flow control systems. The Company operates through two segments: Flowserve Pump Division (FPD) and Flow Control Division (FCD). The FPD segment designs, manufactures, pre-tests, distributes and services specialty and engineered custom and pre-configured pumps and pump systems, mechanical seals, auxiliary systems, replacement parts and upgrades and related aftermarket services. The FCD segment designs, manufactures, distributes and services a portfolio of flow control solutions, including engineered and industrial valve and automation systems, isolation and control valves, actuation, controls and related equipment. Its product portfolio of pumps, valves, seals, automation and aftermarket services supports global infrastructure industries, including oil and gas, chemical, power generation, including nuclear, fossil and renewable, and water management, as well as certain industrial markets.",-1,5156,FLS.N,0.4698069
229,"Sempra Energy is an energy infrastructure company. The Company invests in, develops and operates energy infrastructure, and provides electric and gas services to customers through regulated public utilities. The Company’s segments are San Diego Gas & Electric Company (SDG&E), Southern California Gas Company (SoCalGas), Sempra Texas Utilities, Sempra Mexico, and Sempra Liquefied Natural Gas (LNG). SDG&E provides electric services and natural gas services. SoCalGas owns and operates a natural gas distribution, transmission and storage system that supplies natural gas. Sempra Mexico segment includes energy infrastructure business. Sempra LNG develops, builds, operates and invests in natural gas liquefaction export facilities, including natural gas pipelines and infrastructure, and buys, sells and transports natural gas through its marketing operations, all within North America. Sempra Texas Utilities includes its investment in Oncor Holdings.",-1,229,SRE.N,0.46968615
273,"Republic Services, Inc. is a provider environmental services in the United States. The Company's segments include Group 1, Group 2, and Corporate entities and other. Its Group 1 and Group 2 segments provide integrated waste management services. Group 1 consists of geographic areas located in the western United States. Group 2 consists of geographic areas located in the southeastern and mid-western United States, and the eastern seaboard of the United States. Its segments provide integrated environmental services, including collection, transfer, recycling, and disposal services. It operates facilities in approximately 41 states through 345 collection operations, 220 transfer stations, 186 active landfills, 76 recycling processing centers, six treatment, recovery and disposal facilities, nine salt water disposal wells, and seven deep injection wells. It also operates around 75 landfill gas and renewable energy projects and had post-closure responsibility for 128 closed landfills.",-1,273,RSG.N,0.4647141
247,"Dover Corporation is a diversified global manufacturer and solutions provider. The Company is focused on delivering equipment and components, consumable supplies, aftermarket parts, software and digital solutions, and support services. Its operating segments include Engineered Products, Fueling Solutions, Imaging & Identification, Pumps & Process Solutions, and Refrigeration & Food Equipment. The Engineered Products segment offers a range of products including, software and services. The Fueling Solutions segment is providing components, equipment, and software and service solutions. The Imaging & Identification segment supplies precision marking and coding, product traceability, and digital textile printing equipment. Pumps & Process Solutions segment manufactures specialty pumps, fluid handling components, plastics, and polymer processing equipment, single-use pumps, and flows meters and connectors. Refrigeration & Food Equipment segment provides energy-efficient equipment & systems.",-1,247,DOV.N,0.46421212
325,"Johnson Controls International PLC is a global diversified technology and multi industrial company. The Company is focused on developing energy solutions, integrated infrastructure and transportation systems. Its segments include Building Solutions North America, Building Solutions EMEA/LA, Building Solutions Asia Pacific and Global Products. It designs, manufactures and installs building products and systems around the world, including heating, ventilation and air conditioning (HVAC) equipment, HVAC controls, energy-management systems, security systems, fire detection systems and fire suppression solutions. It provides energy efficiency solutions and technical services, including inspection, scheduled maintenance and replacement of mechanical and control systems. It provides security solutions with Qolsys, DSC, Bentel, Visonic, PowerG and Tyco products. It also designs and manufactures custom air handlers and modular data centers for hyperscale cloud and colocation providers.",-1,325,JCI.N,0.46362162
91,"Quanta Services, Inc. is a provider of specialty contracting services, delivering infrastructure solutions for the electric and gas utility, communications, pipeline and energy industries in the United States, Canada, Australia and select other international markets. The Company's segments include Electric Power Infrastructure Solutions and Underground Utility and Infrastructure Solution. The Electric Power Infrastructure Solutions segment provides network solutions to customers in the electric power and other industries. Its services include design, new construction, upgrade and maintenance of electric power transmission and distribution infrastructure and substation facilities. The Underground Utility and Infrastructure Solutions segment provides infrastructure solutions, including design, engineering, new construction, upgrade, repair, and maintenance services, to customers involved in the transportation, distribution, storage and processing of natural gas, oil and other products.",-1,91,PWR.N,0.45639622
128,"IDEX Corporation (IDEX) operates an applied solutions business that sells pumps, flow meters and other fluidics systems, and components and engineered products. It segments includes Fluid & Metering Technologies (FMT), Health & Science Technologies (HST) and Fire & Safety/Diversified Products (FSDP). Its FMT segment provides flow monitoring and other services for the food, chemical, water and wastewater, agricultural and energy industries. The HST segment designs and distributes precision fluidics, rotary lobe pumps, roll compaction and drying systems. Its FSDP segment produces firefighting pumps and controls, rescue tools, lifting bags and other components and systems; engineered stainless steel banding and clamping devices, and precision equipment. Its Fire & Safety platform provides Hurst Jaws of Life, which manufactures the rescue tools. It also designs and manufactures pumps for a variety of markets, including mining, marine, power, water, wastewater and other general industries.",-1,128,IEX.N,0.45575386
109,"Ingersoll Rand Inc. is a diversified, global provider of mission-critical flow creation products and industrial solutions. The Company manufactures compressor, pump, vacuum and blower products. Its segments include Industrial Technologies and Services (IT&S) and Precision and Science Technologies. The Company's IT&S segment designs, manufactures, markets and services a broad range of air and gas compression, vacuum and blower products, fluid transfer equipment, loading systems, power tools and lifting equipment. The Company's Precision and Science Technologies segment designs, manufactures and markets specialized positive displacement pumps, fluid management equipment, liquid and precision syringe pumps and compressors, and aftermarket parts.",-1,109,IR.N,0.45328152
412,"The Progressive Corporation is an insurance holding company. The Company's insurance subsidiaries provide personal and commercial automobile and property insurance, other specialty property-casualty insurance and related services. The Company operates through the Personal Lines, Commercial Lines and Property segments. The Company's Personal Lines segment writes insurance for personal autos and recreational vehicles. The Commercial Lines business writes primary liability, physical damage, and business-related general liability and property insurance. It provides property insurance for homes, condos, manufactured homes, and renters, as well as personal umbrella insurance and primary and excess flood insurance. The Company's service business includes commercial auto insurance procedures/plans (CAIP) and commission-based businesses.",-1,412,PGR.N,0.45319307
101,"Pentair plc is a diversified industrial manufacturing company. The Company is engaged in Water Quality Systems business and Flow and Filtration Solutions business. The Water Quality Systems business designs, manufactures, markets and services water system products and solutions to meet filtration and fluid management challenges in food and beverage, water, swimming pools and aquaculture applications. The Flow and Filtration Solutions business is involved in the entire water, water treatment and wastewater system from filtration, desalination, water supply to water disposal, process and control.",-1,101,PNR.N,0.45300138
4637,"ChampionX Corporation provides chemistry solutions and engineered equipment and technologies that help companies drill for and produce oil and gas. The Company operates through four segments: Production Chemical Technologies, Production & Automation Technologies, Drilling Technologies, and Reservoir Chemical Technologies. The Production Chemical Technologies segment offers products and services includes corrosion inhibitors, scale inhibitors, emulsion breakers, and biocides. The Production & Automation Technologies segment designs, manufactures, markets and services a range of artificial lift equipment, digital automation solutions, as well as other production equipment. The Drilling Technologies segment designs, manufactures and markets polycrystalline diamond cutters and bearings under the US Synthetic brand. The Reservoir Chemical Technologies segment manufactures fracturing fluid packages, drilling additives, cement additives and products.",-1,4637,CHX.OQ,0.45120454
5229,"nVent Electric plc is a global provider of electrical connection and protection solutions. The Company designs, manufactures, markets, installs and services products and solutions that connect and protect equipment, buildings and critical processes. The Company’s portfolio of brands include CADDY, ERICO, HOFFMAN, RAYCHEM, SCHROFF and TRACER. The Company operates through three segments: Enclosures, Electrical & Fastening Solutions, and Thermal Management. The Enclosures segment provides solutions to connect and protect critical control systems, electronics, data and electrical equipment. The Electrical & Fastening Solutions segment provides solutions that connect and protect electrical and mechanical systems and civil structures. The Thermal Management segment provides electric thermal solutions that connect and protect critical buildings, infrastructure, industrial processes and people.",-1,5229,NVT.N,0.44543448
5270,"ETC Sunoco Holdings LLC is a United States-based petroleum oil company. The Company is engaged in operating as a petroleum refiner and marketer and chemicals manufacturer with interests in logistics and coke making. It distributes fuel to over 5,000 gas station locations in more than 30 states. It markets gasoline and middle distillates, and offers a broad range of convenience store merchandise.",-1,5270,SUN.N^J12,0.44361538
171,"Huntington Ingalls Industries, Inc. is a military shipbuilding company and a provider of professional services to partners in government and industry. The Company's business consists of the design, construction, repair and maintenance of nuclear-powered ships and non-nuclear ships for the United States Navy and coastal defense surface ships for the United States Coast Guard, as well as the refueling and overhaul and inactivation of nuclear-powered ships for the United States Navy. It operates through three segments: Ingalls Shipbuilding (Ingalls), Newport News Shipbuilding (Newport News) and Technical Solutions. Its Ingalls segment includes its non-nuclear ship design, construction, repair and maintenance businesses. Its Newport News includes all of its nuclear ship design, construction, overhaul, refueling, and repair and maintenance businesses. Its Technical Solutions segment provides a range of professional services to the governmental and energy markets.",-1,171,HII.N,0.44162643
112,"Fortune Brands Home & Security, Inc. is a home and security products company. The Company operates in three segments: Cabinets, Plumbing and Outdoors & Security. Cabinets segment manufactures semi-custom and custom cabinetry, as well as vanities, for the kitchen, bath and other parts of the home under the Diamond, Aristokraft, Mid-Continent, Kitchen Craft, Homecrest, Omega, StarMark, Schrock, Decora and Mantra brands. Plumbing segment manufactures or assembles and sells faucets, accessories, kitchen sinks and waste disposals under the Moen, Riobel, Victoria+Albert, Perrin & Rowe and Shaws brands. Outdoors & Security segment manufactures and sells fiberglass and steel entry door systems under the Therma-Tru brand name, composite decking and railing under the Fiberon brand name, and urethane millwork under the Fypon brand name. It also manufactures, sources and distributes locks, safety and security devices, and electronic security products under the Master Lock and American Lock brands.",-1,112,FBHS.N,0.43654293
141,"Ameriprise Financial, Inc. is a holding company. The Company offers a range of financial planning and advice products and services designed to achieve individual and institutional clients’ financial objectives. It operates through segments, including Advice & Wealth Management, Asset Management and Retirement & Protection Solutions. It offers products and services under brands, including Ameriprise Financial, Columbia Threadneedle Investments and RiverSource. Ameriprise Financial brand includes its advisor network and certain of its retail products and services. Its Columbia Threadneedle Investments brand represents the combined capabilities, resources and reach of Columbia Management Investment Advisers, LLC (Columbia Management) and Threadneedle. It uses the RiverSource brand for its annuity and protection products issued by RiverSource Life Insurance Company (RiverSource Life) and RiverSource Life Insurance Co. of New York (RiverSource Life of NY).",-1,141,AMP.N,0.43595022
