,Doc,Topic,Doc_ID,ticker,sim_sect
457,"Halliburton Company provides services and products to the upstream oil and natural gas industry throughout the lifecycle of the reservoir, from locating hydrocarbons and managing geological data, to drilling and formation evaluation, well construction and completion, and optimizing production throughout the life of the field. It operates through two segments: the Completion and Production segment, and the Drilling and Evaluation segment. The Completion and Production segment delivers cementing, stimulation, intervention, pressure control, specialty chemicals, artificial lift and completion services. The Drilling and Evaluation segment provides field and reservoir modeling, drilling, evaluation and wellbore placement solutions that enable customers to model, measure, drill and optimize their well construction activities. It serves national and independent oil and natural gas companies. As of December 31, 2016, it had conducted business in approximately 70 countries around the world.",10,457,HAL.N,0.19226587
5158,"TechnipFMC Plc is a global energy service company. The Company is a technology provider to the traditional and energies industry. Its solutions range from products and services to fully integrated solutions based on technologies. The Company operates across two business segments: Subsea and Surface Technologies. The Subsea segment provides integrated design, engineering, procurement, manufacturing, fabrication and installation, and life of field services for subsea systems, subsea field infrastructure, and subsea pipe systems used in oil and gas production and transportation. The Surface Technologies segment designs, manufactures, and services products and systems used by companies involved in land and shallow water exploration and production of crude oil and natural gas. Its products and systems include wellhead systems, hydraulic fracturing systems, production, separation, and flow processing systems, and measurement products and integrated systems.",10,5158,FTI.N,0.1887721
5159,"FMC Technologies Inc is a United States-based oil and gas field machinery and equipment manufacturing company. The Company provides technology solutions for the energy industry. It also designs, manufactures and services a range of systems and products, including subsea production and processing systems, surface wellhead production systems, high pressure fluid control equipment, measurement solutions and marine loading systems. It's segments include Subsea Technologies, Surface Technologies and Energy Infrastructure.",10,5159,FTI.N^A17,0.17693551
5221,"Nabors Industries Ltd. owns and operates a land-based drilling rig fleet. The Company is a provider of offshore platform drilling rigs in the United States and multiple international markets. The Company conducts its Drilling & Rig Services business through four segments: U.S. Drilling, Canada Drilling, International Drilling and Rig Services. The Company provides wellbore placement services, drilling software and performance tools, drilling equipment and various technologies throughout the oil and gas markets. The Company's Drilling & Rig Services business comprises land-based and offshore drilling rig operations and other rig services, consisting of equipment manufacturing, rig instrumentation and optimization software. The Company is a provider of directional drilling and measurement while drilling (MWD) systems and services. The Company also provides drilling technology and equipment, and well-site services.",10,5221,NBR.N,0.17457175
5252,"Transocean Ltd. is an international provider of offshore contract drilling services for oil and gas wells. The Company's primary business is to contract its drilling rigs, related equipment and work crews on a dayrate basis to drill oil and gas wells. As of February 9, 2017, it owned or had partial ownership interests in and operated 56 mobile offshore drilling units. As of February 9, 2017, its fleet consisted of 30 floaters, seven harsh environment floaters, three deepwater floaters, six midwater floaters and 10 high-specification jackups. As February 9, 2017, it also had four ultra-deepwater drillships and five high-specification jackups under construction or under contract to be constructed. Its contract drilling services operations are spread across oil and gas exploration and development areas throughout the world. The Company's drilling fleet can be characterized as floaters, including drillships and semisubmersibles, and jackups.",10,5252,RIG.N,0.17273563
5290,"Valaris PLC is a United Kingdom-based offshore contract drilling company. The Company provides offshore contract drilling services to the international oil and gas industry. The Company operates through four segments: Floaters, Jackups, Aramco Rowan Offshore (ARO) and Other. Its floaters segment includes drill ships and semisubmersible rigs. Its ARO drilling owns, manages, and operates drilling rigs offshore Saudi Arabia. The other segment consists of management services on rigs owned by third parties. The Floaters and the Jackups segments provide contract drilling. It owns and operates an offshore drilling rig fleet of 82 rigs, including three rigs under construction, with drilling operations in markets around the world. It also has two deep water managed units. It provides an integrated service that includes the provision of a drilling rig and rig crews.",10,5290,VAL.N^H20,0.1642344
189,"Schlumberger N.V. provides technology for reservoir characterization, drilling, production and processing to the oil and gas industry. The Company's segments include Reservoir Characterization Group, Drilling Group, Production Group and Cameron Group. The Reservoir Characterization Group consists of the principal technologies involved in finding and defining hydrocarbon resources. The Drilling Group consists of the principal technologies involved in the drilling and positioning of oil and gas wells. The Production Group consists of the principal technologies involved in the lifetime production of oil and gas reservoirs and includes Well Services, Completions, Artificial Lift, Integrated Production Services (IPS) and Schlumberger Production Management (SPM). The Cameron Group consists of the principal technologies involved in pressure and flow control for drilling and intervention rigs, oil and gas wells and production facilities.",10,189,SLB.N,0.16353332
5110,"Cameron International Corp is a United States- based Company. The Company is engaged in manufacturing of oil and gas pressure control and separation equipment, including valves, wellheads, controls, chokes, blowout preventers and assembled systems for oil and gas drilling, production and transmission used in onshore, offshore and subsea applications, and provides oil and gas separation, metering and flow measurement equipment.",10,5110,CAM.N^D16,0.14443715
5222,"Noble Holding Corporation Plc, formerly Noble Corporation plc, is an offshore drilling contractor for the oil and gas industry. It provides contract drilling services to the international oil and gas industry with its global fleet of mobile offshore drilling units. It focuses on fleet of floating and jackup rigs and the deployment of its drilling rigs in oil and gas basins. Its subsidiaries offers contract drilling services with a fleet of approximately 24 offshore drilling units, consisting of approximately 12 floaters and 12 jackups. Its floaters unit include Noble Bob Douglas, Noble Bully II, Noble Globetrotter I, Noble Sam Croft, Noble Tom Madden, Noble Jim Day and Noble Paul Romano. Its independent leg cantilevered jackups unit include Noble Hans Deul, Noble Joe Beall, Noble Lloyd Noble, Noble Scott Marks and Noble Tom Prosser. Its fleets are located in Canada, Far East Asia, the Middle East, the North Sea, Oceania, South America and the United States Gulf of Mexico.",10,5222,NE.N^H20,0.14050974
5139,"Diamond Offshore Drilling Inc is a United States-based provides contract drilling services to the energy industry. The Company offers contract drilling services to deep water challenges around the globe. The Company has fleet of 13 offshore drilling rigs, which consists of nine semisubmersibles and four dynamically positioned drill ships.",10,5139,DO.N^D20,0.109510005
192,"FLEETCOR Technologies, Inc. is a global business payments company. The Company provides digital payment solutions that enables businesses to control purchases and make payments efficiently. It operates through three business segments, North America, International, and Brazil. The Company offers its solution through two categories, Corporate Payments solutions and Expense Management solutions. The Corporate Payments solutions include accounts payable (AP) automation, virtual cards, cross-border, and purchasing and travel and entertainment (T&E) cards. It is designed to help businesses streamline the back-office operations associated with making outgoing payments. The Expense Management solutions are designed to provide customers with control and visibility of employee spending when compared to payment methods, such as cash or general-purpose credit cards.",11,192,FLT.N,0.34082276
252,"Jack Henry & Associates, Inc. is a provider of technology solutions and payment processing services primarily for financial services organizations. The Company operates through four segments: Core, Payments, Complementary, and Corporate and Other. The Core segment provides core information processing platforms to banks and credit unions, which consists of integrated applications required to process deposit, loan, and general ledger transactions, and maintain centralized customer/member information. The Payments segment provides secure payment processing tools and services, including automated teller machine (ATM), debit, and credit card processing services; online and mobile bill pay solutions; automated clearinghouse (ACH) origination and remote deposit capture processing; and risk management products and services. The Complementary segment provides additional software and services that can be integrated with the Company's core solutions or used independently.",11,252,JKHY.OQ,0.34025794
5286,"Total System Services, Inc. (TSYS) is a payment solutions provider that provides payment processing services, merchant services and related payment services to financial and non-financial institutions. The Company's segments include North America Services, Merchant Services, NetSpend and International Services. In addition, it provides general purpose reloadable (GPR) prepaid and payroll cards, and alternative financial service solutions to the underbanked and other consumers. The Company's Merchant Services segment provides third party processing services to merchant acquirers and Independent Sales Organizations (ISOs) and financial institutions. The Company's NetSpend segment is engaged in the provision and sale of prepaid access devices, such as its GPR prepaid debit cards. The Company's services and solutions include Issuing Services, Acquiring Services, Prepaid Solutions and Merchant Solutions.",11,5286,TSS.N^I19,0.31575716
245,"American Express Company is an integrated payments company. The Company provides its customers with access to products, insights and experiences that builds business. It provides credit and charge cards to consumers, small businesses, mid-sized companies and corporations around the world. Its various products and services are sold to diverse customer groups through various channels, including mobile and online applications, affiliate marketing, customer referral programs, third-party vendors and business partners, direct mail, telephone, in-house sales teams and direct response advertising. It is engaged in businesses comprising three reportable operating segments: Global Consumer Services Group (GCSG), Global Commercial Services (GCS) and Global Merchant and Network Services (GMNS). It operates a payments network through which it maintains relationships with third-party banks and other institutions.",11,245,AXP.N,0.29065666
272,"Global Payments Inc. is a provider of payment technology services. The Company provides payment and digital commerce solutions. The Company operates through three segments: Merchant Solutions, Issuer Solutions and Business and Consumer Solutions. The Company's segments primarily provide payment solutions for credit cards, debit cards, electronic payments and check-related services. The Company's segments target customers in various industries, including financial services, gaming, government, healthcare, professional services, restaurants, retail, universities, not-for-profit organizations and utilities. It provides services across a range of channels to merchants and partners in over 100 countries throughout North America, Europe, Asia-Pacific and Latin America.",11,272,GPN.N,0.2777754
266,"Fiserv, Inc. is a global provider of payments and financial services technology solutions. The Company provides account processing and digital banking solutions, card issuer processing and network services, payments, e-commerce, merchant acquiring and processing, and the Clover cloud-based point-of-sale solution. The Company operates through three segments: Merchant Acceptance (Acceptance), Financial Technology (Fintech) and Payments and Network (Payments). Its Acceptance segment offers a wide range of products and services to merchants around the world. Its Fintech segment is engaged in providing financial institutions with the technology solutions they need to run their operations. Its Payments segment offers products and services required to process digital payment transactions. The Company serves clients around the globe, including banks, credit unions, corporates, associates, government, healthcare, other financial institutions and merchants.",11,266,FISV.OQ,0.26076263
462,"Visa Inc. (Visa) is a payments technology company that provides digital payments across more than 200 countries and territories. The Company connects consumers, merchants, financial institutions, businesses, strategic partners and government entities to electronic payments. The Company operates through payment services segment. The Company's transaction processing network, VisaNet, facilitates authorization, clearing and settlement of payment transactions and enables to provide its financial institution and merchant clients a range of products, platforms and value-added services. The Company is a retail electronic payment network based on payments volume, number of transactions and number of cards in circulation. Its products/services include transaction processing services, Visa-branded payment products, including credit, debit, prepaid and cash access programs for individual, business and government account holders.",11,462,V.N,0.24624074
442,"Mastercard Incorporated is a technology company that connects consumers, financial institutions, merchants, governments and businesses across the world, enabling them to use electronic forms of payment. The Company allows user to make payments by creating a range of payment solutions and services using its brands, which include MasterCard, Maestro and Cirrus. It provides a range of products and solutions that support payment products, which customers can offer to their cardholders. The Company's services facilitate transactions on its core network among account holders, merchants, financial institutions, businesses, governments and other organizations in markets globally. Its products include consumer credit, consumer debit, prepaid and commercial credit and debit. It also provides integrated offerings such as cyber and intelligence products, information and analytics services, identity verification services, consulting, loyalty and reward programs, processing and open banking.",11,442,MA.N,0.22943778
217,"The Western Union Company is a provider of money movement and payment services. The Company’s segments include Consumer-to-Consumer and Business Solutions. The Consumer-to-Consumer operating segment facilitates money transfers that are sent from retail agent locations worldwide or through Websites and mobile devices, including digital money transfer services. Its money transfer service is provided through one interconnected global network and these services are available for international cross-border transfers and, in certain countries, intra-country transfers. The Business Solutions segment facilitates payment and foreign exchange solutions, primarily cross-border, cross-currency transactions, for small and medium-sized enterprises, and other organizations and individuals.",11,217,WU.N,0.20792392
368,"PayPal Holdings, Inc. is a technology platform and digital payments company that enables digital and mobile payments on behalf of consumers and merchants. The Company's combined payment solutions, including its PayPal, PayPal Credit, Braintree, Venmo, Xoom, iZettle, and Hyperwallet products and services, comprise its Payments Platform. It operates a two-sided network that links its customers around the globe to facilitate the processing of payment transactions, allowing it to connect merchants and consumers. The Company allows its customers to use their account for both purchase and paying for goods, as well as to transfer and withdraw funds. It enables consumers to exchange funds with merchants using funding sources, which include bank account, PayPal account balance, PayPal Credit account, credit and debit card or other stored value products. The Company also offers consumers person-to-person (P2P) payment solutions through its PayPal Website and mobile application, Venmo and Xoom.",11,368,PYPL.OQ,0.10649518
29,"The Mosaic Company is a producer and marketer of concentrated phosphate and potash crop nutrients. The Company operates through three segments: Phosphates, Potash and Mosaic Fertilizantes. It serves customers in approximately 40 countries. The Phosphates segment owns and operates mines and production facilities in Florida, which produce concentrated phosphate crop nutrients and phosphate-based animal feed ingredients, and processing plants in Louisiana, which produces concentrated phosphate crop nutrients. The Potash segment owns and operates potash mines and production facilities in Canada and the United States, which produce potash-based crop nutrients, animal feed ingredients and industrial products. The Mosaic Fertilizantes segment includes the assets in Brazil, which consist of five phosphate rock mines, four phosphate chemical plants and a potash mine. It also operates crop nutrient blending and bagging facilities, port terminals and warehouses in Brazil and Paraguay.",12,29,MOS.N,0.1692806
50,"Expeditors International of Washington, Inc. provides a range of global logistics services. The Company’s services include air and ocean freight consolidation and forwarding, customs brokerage, warehousing and distribution, purchase order management, vendor consolidation, time-definite transportation services, temperature-controlled transit, cargo insurance, specialized cargo monitoring and tracking, and other supply chain solutions. The Company’s principal services categories include airfreight services, ocean freight and ocean services, and customs brokerage and other services. In addition, the Company provides design and optimization, order management, risk management, customs & compliance, trade consulting, trade flow trade management software and customs brokerage services. The Company serves a range of industries, including aerospace, automotive & mobility, fashion, healthcare, manufacturing, oil & energy, retail and technology.",13,50,EXPD.OQ,0.26464403
339,"United Parcel Service, Inc. (UPS) is a package delivery company. The Company is a provider of global supply chain management solutions. The Company operates through three segments: U.S. Domestic Package operations, International Package operations, and Supply Chain & Freight operations. U.S. Domestic Package and International Package are together referred to as global small package operations, which provides delivery services for express letters, documents, packages and palletized freight via air and ground services. The International Package segment includes the small package operations in Europe, Asia-Pacific, Canada, Latin America and Indian Subcontinent, Middle East and Africa (ISMEA). Supply Chain & Freight consists of its forwarding, truckload brokerage, logistics and distribution, UPS Freight, UPS Capital and other businesses. Its services include transportation, distribution, contract logistics, ground freight, ocean freight, air freight, customs brokerage and insurance.",13,339,UPS.N,0.23846072
1,"C.H. Robinson Worldwide, Inc. a is provider of transportation services and logistics solutions operating through a network of offices located in North America, Europe, Asia, Oceania, and South America. The Company operates through three segments: North American Surface Transportation (NAST), Global Forwarding, and All Other and Corporate. NAST segment provides freight transportation services across North America through a network of offices in the United States, Canada, and Mexico. Global Forwarding segment provides ocean freight services, air freight services and customs brokerage. All Other and Corporate segment includes its Robinson Fresh and Managed Services segments, as well as Other Surface Transportation outside of North America. Robinson Fresh provides sourcing services, including the buying, selling, marketing of fresh fruits, vegetables, and other perishable items. Managed Services provides transportation management services, or managed TMS.",13,1,CHRW.OQ,0.22158465
341,"Union Pacific Corporation is a railroad operating company in the United States. The Company operates through its principal operating company, Union Pacific Railroad Company (UPRR). The Company connects approximately 23 states in the western two-thirds of the country by rail and maintains coordinated schedules with other rail carriers for the handling of freight to and from the Atlantic Coast, the Pacific Coast, the Southeast, the Southwest, Canada and Mexico. Export and import traffic is moved through Gulf Coast and Pacific Coast ports and across the Mexican and Canadian borders. The Company's Railroad’s diversified business mix includes Bulk, Industrial, and Premium. It transports hazardous materials and other materials, including crude oil, ethanol, and toxic inhalation hazard (TIH) materials, such as chlorine, that pose risks in the event of a release or combustion.",13,341,UNP.N,0.20810355
249,"FedEx Corporation (FedEx) provides a portfolio of transportation, e-commerce and business services through companies competing collectively and operating independently, under the FedEx brand. The Company's segments include FedEx Express, FedEx Ground, FedEx Freight and FedEx Services. The FedEx Express segment offers a range of United States domestic and international shipping services for delivery of packages and freight. The FedEx Ground segment provides small-package ground delivery services, which includes day-certain service to any business address in the United States and Canada, as well as residential delivery services through its FedEx Home Delivery service. The FedEx Freight segment offers less-than-truckload (LTL) freight services. The FedEx Services segment provides sales, marketing, information technology, communications, customer service, technical support, billing and collection services, and certain back-office functions that support the Company's operating segments.",13,249,FDX.N,0.17585824
5247,"Ryder System, Inc. is a logistics and transportation company. The Company operates through three segments: Fleet Management Solutions (FMS), Supply Chain Solutions (SCS), and Dedicated Transportation Solutions (DTS). The FMS segment provides full-service leasing and leasing with flexible maintenance options, commercial rental, and maintenance services of trucks, tractors and trailers to customers, principally in the United States, Canada and the United Kingdom. The SCS segment provides integrated logistics solutions, including distribution management, dedicated transportation, transportation management, last mile and professional services in North America. The DTS segment provides turnkey transportation solutions in the United States that include dedicated vehicles, drivers, management and administrative support. Its FMS product offering includes ChoiceLease, SelectCare and Commercial Rental.",13,5247,R.N,0.15334688
99,"J.B. Hunt Transport Services, Inc. is a surface transportation, delivery, and logistics company in North America. The Company's segments include Intermodal (JBI), Dedicated Contract Services (DCS), Integrated Capacity Solutions (ICS), Final Mile Services (FMS) and Truck (JBT). The Company, through its subsidiaries, provides transportation and delivery services to a range of customers and consumers throughout the continental United States, Canada and Mexico. The JBI segment offers intermodal rail services. Its DCS segment focuses on private fleet conversion and creation in replenishment and specialized equipment. Its ICS segment provides traditional freight brokerage and transportation logistics solutions to customers through relationships with third-party carriers and integration. Its FMS segment provides final-mile delivery services. Its JBT segment offers full-load, dry-van freight, utilizing tractors operating over roads and highways.",13,99,JBHT.OQ,0.13484153
