,Doc,Topic,Doc_ID,ticker,sim_sect
5194,"Kohl's Corporation (Kohl's) is an operator of department stores. The Company operates approximately 1,154 Kohl's department stores, a Website (www.Kohls.com), approximately 12 FILA outlets, and approximately three Off-Aisle clearance centers. The Company's stores and Website sell moderately-priced private label and national brand apparel, footwear, accessories, beauty and home products. The Company's Website includes merchandise that is available in its stores, as well as merchandise that is available only online. The Company's merchandise mix includes both national brands and private brands that are available only at Kohl's. The Company's private brands include Apt. 9, Croft & Barrow, Jumping Beans, SO and Sonoma Goods for Life. The Company's exclusive brands include Food Network, Jennifer Lopez, Marc Anthony, Rock & Republic and Simply Vera Vera Wang.",23,5194,KSS.N,0.17630513
5283,"Tiffany & Co is a United States-based company operates as a jeweler and specialty retailer. The Company operates approximately 300 retail stores worldwide. The Company and its subsidiaries design, manufacture and market jewelry, watches and luxury accessories. Artisans cut Tiffany diamonds and craft jewelry in the Company’s own workshops.",23,5283,TIF.N^A21,0.17618692
406,"The Gap, Inc. is a specialty apparel company offering clothing, accessories, and personal care products for women, men, and children under the Old Navy, Gap, Banana Republic, and Athleta brands. The Company is an omni-channel retailer, with sales to customers both in stores and online, through Company-operated and franchise stores, Company-owned websites, and third-party arrangements. It designs, develops, markets, and sells a range of apparel, footwear and accessories products. It has Company-operated stores in the United States, Canada, the United Kingdom, France, Ireland, Japan, Italy, China, Taiwan, and Mexico. It also has franchise agreements with unaffiliated franchisees to operate its stores throughout Asia, Europe, Latin America, the Middle East, and Africa. The Company's omni-channel services, including curbside pick-up, buy online pick-up in store, order-in-store, find-in-store, and ship-from-store are tailored across its collection of brands.",23,406,GPS.N,0.16995768
278,"Walmart Inc is engaged in the operation of retail, wholesale and other units, as well as eCommerce, located throughout the United States, Africa, Canada, Central America, Chile, China, India and Mexico. The Company offers an assortment of merchandise and services at everyday low prices (EDLP). The Company operates through three segments: Walmart U.S., Walmart International and Sam's Club. The Walmart U.S. segment includes the Company's mass merchant concept in the United States. The Walmart International segment consists of the Company's operations outside of the United States. The Sam's Club segment includes the warehouse membership clubs in the United States. The Company operates approximately 10,500 stores, clubs and eCommerce Websites under 48 banners in 24 countries.",23,278,WMT.N,0.16619012
58,"Under Armour, Inc. is engaged in the development, marketing and distribution of branded performance apparel, footwear and accessories for men, women and youth. The Company's segments include North America, consisting of the United States and Canada; Europe, the Middle East and Africa (EMEA); Asia-Pacific; Latin America, and Connected Fitness. Its products are sold across the world and worn by athletes at all levels, from youth to professional, on playing fields around the globe, as well as by consumers with active lifestyles. The Company sells its branded apparel, footwear and accessories in North America through its wholesale and direct to consumer channels. As of December 31, 2016, the Company had approximately 151 factory house stores in North America primarily located in outlet centers throughout the United States. In addition, the Company distributes its products in North America through third-party logistics providers with primary locations in Canada, New Jersey and Florida.",23,58,UAA.N,0.15928431
456,"Under Armour, Inc. is engaged in the development, marketing and distribution of branded performance apparel, footwear and accessories for men, women and youth. The Company's segments include North America, consisting of the United States and Canada; Europe, the Middle East and Africa (EMEA); Asia-Pacific; Latin America, and Connected Fitness. Its products are sold across the world and worn by athletes at all levels, from youth to professional, on playing fields around the globe, as well as by consumers with active lifestyles. The Company sells its branded apparel, footwear and accessories in North America through its wholesale and direct to consumer channels. As of December 31, 2016, the Company had approximately 151 factory house stores in North America primarily located in outlet centers throughout the United States. In addition, the Company distributes its products in North America through third-party logistics providers with primary locations in Canada, New Jersey and Florida.",23,456,UA.N,0.15928428
5260,"Sears Holdings Corporation is an integrated retailer. The Company is the parent company of Kmart Holding Corporation (Kmart) and Sears, Roebuck and Co. (Sears). The Company's segments are Kmart and Sears Domestic. It also offers Shop Your Way, a member-based social shopping platform that offers rewards, and personalized products and services. The Company is the home appliance retailer, as well as offers tools, lawn and garden, fitness equipment, automotive repair and maintenance. Its brands include Kenmore, Craftsman and DieHard. It also maintains a range of apparel and home offering, including labels, such as Jaclyn Smith, Joe Boxer, Route 66, Cannon, Ty Pennington Style and Levi's and also offers Lands' End merchandise in some of its Full-line stores. As of February 3, 2018, it is also a provider of home services, with over five million service and installation calls made annually and it is operated through a network of stores with 1,002 full-line and specialty retail stores.",23,5260,SHLD.OQ^J18,0.15727162
65,"PVH Corp. is an apparel company. The Company's segments include: Tommy Hilfiger, which consists of the Tommy Hilfiger North America and Tommy Hilfiger International segments, and Calvin Klein, which consists of the Calvin Klein North America and Calvin Klein International segments. The Company's brand portfolio consists of various brand names, including Calvin Klein, Tommy Hilfiger, Van Heusen, IZOD, ARROW, Warner's, Olga, True&Co. and Geoffrey Beene, which are owned, as well as various other owned, licensed and private label brands. The Company designs and markets dress shirts, neckwear, sportswear, jeanswear, underwear, intimate apparel, performance apparel, swimwear, handbags, accessories, footwear and other related products, and licenses its owned brands over a range of products. The Company sells its brands at multiple price points and across multiple channels of distribution and geographies.",23,65,PVH.N,0.1522349
155,"Ross Stores, Inc. and its subsidiaries operate two brands of off-price retail apparel and home fashion stores-Ross Dress for Less (Ross) and dd's DISCOUNTS. Ross is an off-price apparel and home fashion chain in the United States, with 1,589 locations in 40 states, the District of Columbia and Guam. Ross offers in-season, name brand and designer apparel, accessories, footwear, and home fashions for the entire family at savings of 20% to 60% off department and specialty store regular prices every day. The Company also operates 277 dd's DISCOUNTS stores in 21 states, which offers name brand apparel, accessories, footwear, and home fashions for the entire family at savings of 20% to 70% off department and discount store regular prices every day. The Company operated a total of 1,866 stores comprised of 1,589 Ross stores and 277 dd’s DISCOUNTS stores. The Company owns and operates distribution processing facilities.",23,155,ROST.OQ,0.14648482
5103,"Big Lots, Inc. is a community retailer operating in the United States. It operates approximately 1,418 stores in 47 states and an e-commerce platform. The Company's merchandising categories include furniture; seasonal; soft home; food; consumables; hard home and electronics, toys, and accessories. The furniture category includes its upholstery; mattress; case goods; and ready-to-assemble departments. The seasonal category includes its lawn and garden; summer; Christmas and other holiday departments. The soft home category includes fashion bedding; utility bedding; bath; window; decorative textile; home organization; area rugs; home decor and frames departments. The food category includes its beverage and grocery; candy and snacks and specialty foods departments. The consumables category includes its health, beauty and cosmetics; plastics; paper; chemical and pet departments. The hard home category includes its small appliances, stationery, and home maintenance departments.",23,5103,BIG.N,0.13766992
288,"NIKE, Inc. is engaged in the designing, marketing and distributing of athletic footwear, apparel, equipment and accessories for sports and fitness activities. The Company's operating segments include North America, Europe, Middle East & Africa (EMEA), Greater China, and Asia Pacific & Latin America (APLA). It focuses its NIKE Brand product offerings in categories such as Running, NIKE Basketball, the Jordan Brand, Football (Soccer), Training and Sportswear. It also markets products designed for kids, as well as for other athletic and recreational uses such as American football, baseball, cricket, golf, lacrosse, skateboarding, tennis, volleyball, walking, wrestling and other outdoor activities. It sells a line of performance equipment and accessories under the NIKE Brand name, including bags, socks, sport balls, eyewear, timepieces, digital devices, bats, gloves, protective equipment and other equipment designed for sports activities.",23,288,NKE.N,0.13223419
5204,"Macy's, Inc. is an omnichannel retail company operating stores, Websites and mobile applications under three brands, such as Macy's, Bloomingdale's and bluemercury. The Company sell a range of merchandise, including apparel and accessories (men's, women's and kid's), cosmetics, home furnishings and other consumer goods. Its subsidiaries provide various support functions to its retail operations. Its bank subsidiary, FDS Bank, provides certain collections, customer service and credit marketing services in credit card accounts that are owned either by Department Stores National Bank (DSNB), a subsidiary of Citibank, N.A., or FDS Bank. The other subsidiaries, which provides support functions to its retail operations include Macy's Systems and Technology, Inc. (MST), Macy's Merchandising Group, Inc. (MMG) and its subsidiary and Macy's Logistics and Operations (Macy's Logistics). The private label brands offered by the Company include Alfani, Aqua, Bar III, Belgique and many others.",23,5204,M.N,0.122610964
5191,"Nordstrom, Inc. is focused on offering privately labeled apparel, shoes, cosmetics and accessories for women, men, young adults and children. The Company’s Retail segment aggregates two operating segments, Nordstrom and Nordstrom Rack. Nordstrom consists of Nordstrom.com, TrunkClub.com, Nordstrom-branded United States stores, Canada, which includes Nordstrom.ca, Nordstrom Canadian stores and Nordstrom Rack Canadian stores. The Company’s operations consist of its Nordstrom United States and Canada full-line stores, the United States and Canada Nordstrom Rack stores, Jeffrey boutiques, Last Chance clearance stores, Trunk Club clubhouses and Nordstrom Local. In addition, the Company’s customers are also served online through Nordstrom.com, Nordstromrack.com, HauteLook and TrunkClub.com.",23,5191,JWN.N,0.12119532
5195,"Kontoor Brands, Inc. is a lifestyle apparel company. The Company operates through three segments: Wrangler, Lee, and Other. The Wrangler segment offers denim, apparel, and accessories for men and women. Wrangler branded products are available through wholesale arrangements with mass and mid-tier retailers, specialty stores, department stores, independently operated partnership stores, and e-commerce platforms, as well as through its Company-operated retail stores and websites. The Lee segment offers jeans, pants, shirts, shorts, and jackets for men, women, boys and girls, with boys and girls jackets licensed in the United States. Lee branded products are distributed domestically and internationally through the wholesale channel including department stores, mass merchants, specialty stores, independently operated partnership stores, and e-commerce platforms, as well as through its Company-operated retail stores and websites.",23,5195,KTB.N,0.11606559
479,"V.F. Corporation is an apparel, footwear and accessories company. The Company is engaged in the design, procurement, production, marketing and distribution of branded lifestyle apparel, footwear and related products. The Company's segments include Outdoor, Active and Work. It owns a portfolio of brands in the outerwear, footwear, apparel, backpack, luggage and accessories categories. Its products are marketed to consumers through its wholesale channel, primarily in specialty stores, national chains, mass merchants, department stores, independently operated partnership stores and with strategic digital partners. Its products are also marketed to consumers through its own direct-to-consumer operations, which include VF-operated stores, concession retail stores, brand e-commerce sites and other digital platforms. Its brands primarily include Vans, The North Face, Timberland and Dickies.",23,479,VFC.N,0.112725616
5153,"Foot Locker, Inc. is a retailer of shoes and apparel. The Company operates through three operating segments: North America, Europe, Middle East, and Africa (EMEA), and Asia Pacific. The Company's portfolio of brands includes Foot Locker, Lady Foot Locker, Kids Foot Locker, Champs Sports, Eastbay, Footaction, and Sidestep. The Company uses its omni-channel capabilities to bridge the digital world and physical stores, including order-in-store, buy online and pickup-in-store, and buy online and ship-from-store, as well as e-commerce. It operates websites and mobile apps aligned with the brand names of its store banners, including footlocker.com, ladyfootlocker.com, kidsfootlocker.com, champssports.com, footaction.com, footlocker.ca, footlocker.eu and related e-commerce sites in the various European countries. It operates approximately 2,911 stores in 27 countries across the United States, Canada, Europe, Australia, New Zealand, and Asia.",23,5153,FL.N,0.11173265
66,"Tapestry, Inc. is a house of modern luxury accessories and lifestyle brands. The Company operates through three segments: Coach, Kate Spade and Stuart Weitzman. The Coach segment includes sales of Coach products to customers through Coach operated stores, including e-commerce sites and concession shop-in-shops, and sales to wholesale customers and through independent third-party distributors. The Kate Spade segment includes sales primarily of kate spade new york brand products to customers through Kate Spade operated stores, including e-commerce sites, sales to wholesale customers, through concession shop-in-shops and through independent third-party distributors. The Stuart Weitzman segment includes sales of Stuart Weitzman brand products primarily through Stuart Weitzman operated stores, including e-commerce sites, sales to wholesale customers and through numerous independent third-party distributors.",23,66,TPR.N,0.10833948
282,"Dollar General Corporation is a discount retailer. It offers merchandise, including consumable items, seasonal items, home products and apparel. Its merchandise includes brands from manufacturers, as well as its own private brand selections with prices at discounts to brands. Its consumables category includes paper and cleaning products, packaged food, perishables, snacks, health and beauty, pet, and tobacco products. Its seasonal products include holiday items, toys, batteries, small electronics, greeting cards, stationery, prepaid phones and accessories, gardening supplies, hardware, automotive and home office supplies. Its home products include kitchen supplies, cookware, small appliances, light bulbs, storage containers, frames, candles, craft supplies and kitchen, bed and bath soft goods. Its apparel products include casual everyday apparel for infants, toddlers, girls, boys, women and men, as well as socks, underwear, disposable diapers, shoes and accessories.",23,282,DG.N,0.10681242
5090,"Abercrombie & Fitch Co. is a multi-brand omnichannel specialty retailer, whose products are sold primarily through its digital channels and Company-owned stores, as well as through various third-party arrangements. The Company offers an assortment of apparel, personal care products and accessories for men, women and kids under the Company’s two brand-based operating segments: Hollister, which includes the Company’s Hollister and Gilly Hicks brands, and Abercrombie, which includes the Company’s Abercrombie & Fitch and abercrombie kids brands. The Company operates primarily in North America, Europe and Asia. The Company operates approximately 733 stores in the United States and 199 stores outside of the United States.",23,5090,ANF.N,0.10010874
5294,"Victoria's Secret & Co. is a retailer of women's intimate and other apparel, personal care and beauty products. The Company sell its product through two brands, Victoria's Secret and PINK. The Company operates through two segments: The North America and International. The Company's product category includes fragrance, beauty, apparel, loungewear, sleepwear, athletic attire and swimwear. The Company operates approximately 867 stores in North America and it operates 520 stores outside of North America, including 62 Company operated stores in Greater China and 458 partner-operated stores, including locations across the Americas, Europe, Asia, Africa and the Middle East. The Company provides products through online at www.VictoriasSecret.com and www.PINK.com and other online channels.",23,5294,VSCO.N,0.093991004
80,"Ralph Lauren Corporation is engaged in the design, marketing and distribution of lifestyle products, including apparel, accessories, home furnishings, fragrances and hospitality. The Company operates through segments North America, Europe, and Asia. Its wholesale business sells its products to mid-tier department stores, specialty stores, and golf and pro shops, as well as to various third-party digital partners. Its licensing business combines its consumer insight, design, and marketing skills with the product of its licensing partners to create and build new businesses. The Company’s retail business sells to customers throughout the world via its retail stores and concession-based shop-within-shops, as well as through its own digital commerce sites and those of various third-party digital partners.",23,80,RL.N,0.08796455
5126,"Capri Holdings Limited is a designer, marketer, distributor and retailer of branded women’s and men’s accessories, footwear and ready-to-wear, as well as wearable technology, watches, jewelry, eyewear and fragrance products. The Company’s segments include Versace, Jimmy Choo and Michael Kors. Versace segment engaged in selling of Versace products through approximately 210 retail stores (including concessions) and e-commerce sites, through approximately 868 wholesale doors (including multi-brand stores). Jimmy Choo includes worldwide sales of Jimmy Choo products through approximately 227 retail stores (including concessions) and e-commerce sites, through approximately 450 wholesale doors (including multi-brand stores). The Michael Kors includes worldwide sales of Michael Kors products through approximately 820 retail stores (including concessions) and e-commerce sites, through approximately 2,852 wholesale doors.",23,5126,CPRI.N,0.078458995
382,"The TJX Companies, Inc. (TJX) is an off-price apparel and home fashions retailer in the United States and across the world. The Company operates through four segments: Marmaxx, HomeGoods, TJX Canada and TJX International. T.J. Maxx and Marshalls chains in the United States (Marmaxx) are collectively the off-price retailer in the United States with approximately 2,402 stores. The HomeGoods chain is an off-price retailer of home fashions in the United States with approximately 821 stores. The TJX Canada segment operates the Winners, HomeSense and Marshalls chains in Canada. Winners is the off-price apparel and home fashions retailer in Canada. HomeSense offers home fashions off-price concept in Canada. The Company operates approximately 102 Marshalls stores in Canada. The TJX International segment operates the T.K. Maxx and HomeSense chains in Europe. The Company operates approximately 602 T.K. Maxx stores in the United Kingdom, Ireland, Germany, Poland, Austria and the Netherlands.",23,382,TJX.N,0.06296696
4121,"Urban Outfitters, Inc. is a lifestyle products and services company. The Company operates through three segments: Retail, Wholesale and Subscription. The Retail segment includes its store and digital channels and consists of its Anthropologie, Bhldn, Free People, FP Movement, Terrain, Urban Outfitters and Menus & Venues brands. The Wholesale segment consists of the Free People, FP Movement and Urban Outfitters brands. This segment sells through department and specialty stores worldwide, digital businesses and the Retail segment. The Wholesale segment primarily designs, develops, and markets apparel, intimates and activewear. The Subscription segment consists of the Nuuly brand, which is a monthly women’s apparel subscription rental service. The Company also offers its products and services directly to its customers through its websites, mobile applications, catalogs, customer contact centers and third-party operated digital businesses.",23,4121,URBN.OQ,0.04953202
106,"Target Corporation (Target) is a general merchandise retailer selling products through its stores and digital channels. Its general merchandise stores offer an edited food assortment, including perishables, dry grocery, dairy and frozen items. Its digital channels include a range of merchandise assortment, including many items found in our stores, along with a complementary assortment. The Company sells assortment of general merchandise and food. Its format stores offer curated general merchandise and food assortments. The Company manages its inventory in a range of merchandise categories, including apparel, accessories, home decor, electronics, toys, seasonal offerings, food, and others. It operates stores, including format stores in urban markets and on college campuses. The Company’s product category includes apparel and accessories, beauty and household essentials, food and beverage, hardlines, and home furnishings and decor.",23,106,TGT.N,0.02864761
475,"Hanesbrands Inc. is a marketer of everyday basic innerwear and activewear apparel in the Americas, Europe, Australia and Asia/Pacific. The Company operates through various apparel brands, including Hanes, Champion, Bonds, DIM, Bali, Maidenform, Playtex, Bras N Things, Nur Die/Nur Der, JMS/Just My Size, Wonderbra, Lovable, Alternative, Berlei, L’eggs and Gear for Sports. The Company operates through three segments: Innerwear, Activewear, and International. The Innerwear segment includes men’s underwear, women’s panties, children’s underwear and socks, and intimate apparel, such as bras and shapewear. The Activewear segment includes T-shirts, fleece, sport shirts, performance T-shirts and shorts, sports bras, thermals and teamwear. The International segment includes activewear, men’s underwear, women’s panties, children’s underwear, intimate apparel, socks, hosiery, and home goods.",23,475,HBI.N,0.025112014
5190,"Komatsu Mining Corp is a United States-based company. The Company is engaged in manufacturing machinery and equipment for mining, forestry and forklift. It offers Crushing, dozers, draglines, electric rope shovels, excavators, hybrid mining shovels, motor graders, shaft sinking equipment, blasthole drills and underground hard rock drills.",24,5190,JOY.N^D17,0.22148305
236,"News Corporation is a media and information services company focused on creating and distributing authoritative and engaging content and other products and services to consumers and businesses throughout the world. The Company's segment includes Digital Real Estate Services, Subscription Video Services, Dow Jones, Book Publishing, and News Media. The Company comprises businesses across a range of media, including digital real estate services, subscription video services in Australia, news and information services and book publishing, that are distributed under brands, including The Wall Street Journal, Barron’s, Dow Jones, The Australian, Herald Sun, The Sun, The Times, HarperCollins Publishers, Foxtel, FOX SPORTS Australia, realestate.com.au, realtor.com, talkSPORT and many others. It distributes its content and other products and services to consumers across an array of digital platforms including websites, mobile device and tablet applications, social media, and e-book devices.",25,236,NWSA.OQ,0.45012653
