,Instrument,Business Description
0,002371.SZ,"NAURA Technology Group Co Ltd is a China-based company mainly engaged in the research and development, production, sales and technical services of basic electronic products. The Company's main products are electronic process equipment and electronic components. The Company's electronic process equipment mainly includes semiconductor equipment, vacuum equipment and lithium battery equipment. Its electronic components mainly include resistors, capacitors, crystal devices, microwave components, module power supplies and hybrid integrated circuits. Its products are used in integrated circuits, semiconductor lighting, power devices, micro-electromechanical systems, advanced packaging, photovoltaics, new displays, vacuum electronics, new materials, lithium-ion batteries, aerospace, precision instrumentation, automatic control and other industries. The Company mainly conducts its businesses in the China market."
1,600900.SS,"China Yangtze Power Co., Ltd. is a China-based company, principally engaged in hydroelectricity business. The Company is engaged in operations management and Three Gorges Power Station, Gezhouba Power Station, Xiluodu Power Station and Xiangjiaba Power Station. The Company also provides technology of electrical power generation, and water and electricity engineering maintenance services. Its main clients consist of State Grid Corporation of China and China Southern Power Grid Company, among others."
2,002463.SZ,"WUS PRINTED CIRCUIT (KUNSHAN) CO., LTD. is a China-based company, principally engaged in the manufacture, distribution and after-sale services of printed circuit boards (PCBs). Its products include enterprise communication market boards, office and industrial equipment boards, automobile boards, consumer electronic boards and other products. The Company is also engaged in the wholesaling, import and export trading, after-sale maintenance and technology services of related products. The Company distributes its products within domestic market and to overseas markets."
3,000425.SZ,"XCMG Construction Machinery Co Ltd is a China-based company principally engaged in the research and development, manufacturing, sales and service of construction machinery and spare parts. The Company's main products include hoisting machinery, shoveling machinery, compaction machinery, road machinery, piling machinery, fire-fighting machinery, sanitation machinery and other construction machinery and spare parts. The Company's products are mainly used in the fields of infrastructure construction, real estate development, large-scale projects, disaster relief, transportation and natural resource extraction. The Company distributes its products both in the domestic market and to overseas markets."
4,002384.SZ,"Suzhou Dongshan Precision Manufacturing Co., Ltd is a China-based company, principally engaged in the research and development, manufacture and distribution of precision metal products and precision electronic products. The Company's main products include precision sheet metals, precision die-castings, light-emitting diodes (LEDs) and its display components, touch panels, liquid crystal display module (LCM) modules and flexible circuit boards. Its precision sheet metals are applied in mobile communications and automobiles. Its precision electronic products are applied in consumer electronics and others. The Company distributes its products within domestic market and to overseas markets."
5,300601.SZ,"Shenzhen Kangtai Biological Products Co.,Ltd. is a China-based company and mainly engaged in research and development, manufacture and sale of vaccine. The main products of the company are recombinant hepatitis B virus, haemophilus influenzae type b combined vaccine, measles rubella combined attenuated live vaccine, non-cell Bai Bai Po haemophilus influenzae combined vaccine and other products. The Company operates its businesses primary in domestic market."
6,300124.SZ,"Shenzhen Inovance Technology Co.,Ltd is a China-based company principally engaged in the research, development, manufacture and distribution of industrial automatic control products and new energy related products. The Company’s main products include inverters, servo systems, control systems, industrial visual systems, sensors, motor controllers, auxiliary power systems, traction converters, auxiliary converters, high voltage boxes, traction motors and Train Control and Management Systems (TCMSs), among others. The Company distributes its products in domestic market and to overseas markets."
7,000166.SZ,"Shenwan Hongyuan Group Co Ltd is a China-based investment holding company principally involved in securities business. The Company operates four segments. Enterprise Finance segment is engaged in investment banking and principal investment businesses. Personal Finance segment is engaged in the provision of securities and futures brokerage, margin financing and securities lending, stock-backed lending, sales of financial products and investment advisory for personal finance clients. Institutional Services and Trading segment is engaged in the provision of prime brokerage and research services and proprietary trading. Investment Management segment is engaged in asset management, mutual fund management and private equity fund management."
8,000066.SZ,"CHINA GREATWALL TECHNOLOGY GROUP CO., LTD., formerly CHINA GREAT WALL COMPUTER SHENZHEN CO., LTD., is a China-based company primarily engaged in the manufacture and distribution of power products, computers and relevant equipment. The Company’s main products include industrial power products, consumer power products, photovoltaic power systems, computer and computer peripherals, liquid crystal display (LCD) televisions, display screens, printers, consumable items and solar inverters, among others. The Company distributes its products in domestic market and to overseas markets, including the Americas, Europe, Australia, Africa and others."
9,002508.SZ,"HANGZHOU ROBAM APPLIANCES CO., LTD. is a China-based company, principally engaged in the research and development, production and distribution of kitchen appliances. The Company mainly provides smoke exhausters, gas ovens, disinfection cabinets, electric pressure cookers, induction cookers, electric kettles and electric juicers, among others. The Company distributes its products under the brand name of Robam. The Company distributes its products within domestic market and to overseas markets."
10,600886.SS,"SDIC Power Holdings CO., LTD. is a China-based company, principally engaged in the investment, construction, operation and management of electric power plants. The Company operates hydropower plants, thermal power plants, wind power plants and photovoltaic power plants. The Company also provides consulting services. The Company conducts its businesses within domestic markets."
11,002001.SZ,"ZHEJIANG NHU COMPANY LTD. is a China-based company principally engaged in the manufacture and sales of nutrition products. The Company is also involved in the production and sales of flavors and fragrances, high polymer new materials, as well as bulk pharmaceutical chemicals. The Company's main products include vitamin E, vitamin A, astaxanthin, raspberry ketone and linalool. The Company distributes its products within domestic market and to overseas markets."
12,002050.SZ,"ZHEJIANG SANHUA INTELLIGENT CONTROLS CO., LTD., formerly ZHEJIANG SANHUA Co., Ltd., is principally engaged in the manufacture and sales of air conditioning parts, refrigerator parts and other products. The Company's main products include cross change valves for air conditioners, stop valves, electronic expansion valves, electromagnetic valves, ball valves, square valves, liquid reservoirs for compressors, draining pumps, check valves, packaged tubes, electromagnetic valves for bridges, as well as dry filters, among others. The Company's products are applied in the manufacture of air conditioners and refrigerators. The Company is also involved in the manufacture of components for coffee machines, dish-washing machines and washing machines. The Company distributes its products within domestic market and to overseas markets"
13,002304.SZ,"Jiangsu Yanghe Brewery Joint-Stock Co., Ltd. is a China-based company, principally engaged in the production and distribution of liquor and related products. The Company produces liquor products and red wine products. The Company's major liquor offerings include Yanghe, Shuanggou and Siyang series. The Company primarily distributes its products within domestic markets, with Jiangsu Province as its main market."
14,600383.SS,"Gemdale Corp is a China-based company principally engaged in the development and sales of real estate. The Company's main businesses include residential real estate development, commercial real estate and industrial real estate development and operation, real estate finance, property leasing and property management services. The Company mainly conducts its businesses in the domestic market."
15,603338.SS,"ZHEJIANG DINGLI MACHINERY CO.,LTD is a China-based company principally engaged in the research and development, manufacture, sales and provision of services of aerial work platforms. The Company's main products include three types of aerial work platforms, which include scissor type, arm type and mast type. The Company's products are applied in various industries, such as aircraft and ship building and maintenance, building construction and installation, highway and bridge construction, municipal engineering projects, warehousing and supermarket."
16,000656.SZ,"JINKE PROPERTY GROUP CO.,LTD. is a China-based company principally engaged in the development and distribution of real estates. The Company mainly operates through three segments. Real Estate segment is primarily engaged in the development of residential and commercial properties, as well as the development and operation of industrial estates. Community Integrated Services segment mainly provides property management services. New Energy segment consists of wind power and photovoltaic power generation. The Company is also involved in hotel management, gardening and architecture decoration businesses. The Company operates its business in domestic market, mainly in Chongqing and Jiangsu Province, China."
17,002202.SZ,"Xinjiang Goldwind Science & Technology Co Ltd is a China-based company that provides overall solutions for wind turbines, wind power services and wind farm development. The Company operates its businesses through four segments. The Wind Turbine Manufacturing and Sales segment is mainly engaged in the research and development, manufacturing and sales of wind turbines and their parts. The Wind Power Service segment mainly provides wind power-related consultants, wind farm construction and maintenance and transportation services. The Wind Farm Development segment is mainly engaged in the development and operation of wind farms. Other segment is mainly engaged in financial leasing and water treatment development and operation business. The Company conducts its businesses both in the domestic market and overseas markets."
18,600016.SS,"CHINA MINSHENG BANKING CORP., LTD. (the Bank) is a China-based financial institution principally engaged in corporate banking, personal banking, capital business and other business. The Bank operates its business mainly in North China, East China, South China and other areas in China."
19,601878.SS,"Zheshang Securities Co Ltd is a China-based company mainly engaged in securities brokerage and futures business. The Company's main businesses are securities brokerage business, investment banking business, securities proprietary business, credit business, wealth management business, asset management business, futures business, private equity fund management and investment business, and securities research business. Brokerage business is mainly engaged in securities agency trading business, that is, securities companies accept clients' entrustment to buy and sell securities on behalf of clients. It also includes services such as agency repayment of principal and interest, dividend distribution, securities custody, authentication, and agency registration and account opening. The futures business is mainly engaged in futures brokerage, futures investment consulting and asset management services. The Company mainly conducts business in the domestic market."
20,601601.SS,"China Pacific Insurance (Group) Co., Ltd. is a China-based company mainly engaged in the insurance business. The Company operates its businesses through life insurance business, including individual life insurances, group life insurances, and short-term casualty and health insurances, among others; property insurance business, including motor vehicle insurances and non motor vehicle insurances, as well as asset management business, including bond investment, equity investment and investment real estate, among others. Through its subsidiaries, the Company is also engaged in the pension business. It operates its businesses primarily in domestic market."
21,300676.SZ,"BGI Genomics Co., Ltd. is a China-based company principally engaged in the diagnosis and research of genomics. The Company's main products and services include reproductive health basic research and clinical application services, basic science research services (genome sequencing, bioinformatics analysis and other multithreaded solutions), complex disease basic research and clinical application services, as well as drugs basic research and clinical application services. The Company mainly provides services for domestic and overseas academic institutions, research institutes, independent laboratories, pharmaceutical companies, hospitals and medical institutions, among others."
22,601877.SS,"ZHEJIANG CHINT ELECTRICS CO., LTD. is a China-based company principally engaged in the manufacture and distribution of low voltage electrical devices. The Company’s principal products include power distribution devices, terminal devices, control devices, power supply devices, electronic devices, instrumentation, constructive electric appliances, control systems, solar modules, among others. The Company is also involved in the power plant operation and the photovoltaic power plant contracting businesses through its subsidiaries. The Company mainly operates its businesses in domestic and overseas markets."
23,002714.SZ,"Muyuan Foods Co.,Ltd. is a China-based company principally engaged in the breeding and distribution of pigs. The Company’s main products consist of piglets, boars and commodity pigs. The Company operates its business mainly through feedstuff processing, hog breeding, boar breeding and commodity pig feeding. The Company operates its business in domestic market."
24,601009.SS,"Bank of Nanjing Co., Ltd. is a city commercial bank. The main business activities of the Bank include deposits taking; provision of short-term, medium-term and long-term loans; local and international payments and settlements; bills acceptance and discounting; issuing of financial bonds; agency issuing, cashing and underwriting of government bonds; purchase and sales of government bonds and financial bonds; inter-bank placements and borrowings; services or agency service in trading of foreign currencies; bank card business; provision of letters of credit and guarantee; agency collections and payments; agency sales of insurance; as well as safe-box service, among others. The Company operates its business through Personal Banking Segment, Corporate Banking Segment, Financing Business Segment and Intermediary Service Segment."
25,600276.SS,"Jiangsu Hengrui Pharmaceuticals Co Ltd is a China-based company principally engaged in the manufacture and distribution of pharmaceutical tablets, injections and raw materials. The Company's main products portfolio consists of antineoplastic drugs, angiomyocardiac drugs, drugs for surgery, contrast agents, antibiotics, specialty infusions and others. The Company distributes its products within domestic market and to overseas markets."
26,603288.SS,"Foshan Haitian Flavouring and Food Company Ltd. is a China-based company, principally engaged in the manufacture and distribution of seasonings. The Company's products portfolio consists of soybean sauces, general sauces, oyster sauces, chicken essence seasonings, vinegar and others, with soybean sauces, general sauces and oyster sauces as its main products. Its general sauces are applied in barbecue sauces, hot pot sauces and others. Its oyster sauces are applied in cooking, salad dressings and others. The Company conducts its businesses mainly within domestic markets."
27,600438.SS,"TONGWEI CO.,LTD is a China-based company principally engaged in the production and distribution of feedstuffs. The Company is also involved in food processing and cultivation business, as well as the production of animal drugs. Meanwhile, the Company is also engaged in the research and development, manufacture and distribution of polysilicon and solar cells. The Company distributes its products in domestic market and to overseas markets."
28,600703.SS,"SANAN OPTOELECTRONICS CO., LTD is a China-based company principally engaged in the research, development, production and sales of light emitting diode (LED) products and chips. Its chip products include radio frequency (RF) chips for mobile phones and devices, RF chips for mobile phone base stations and power conversion chips, among others. The Company is also engaged in the research, development and sales of semiconductor materials. The Company operates businesses in both domestic and overseas markets."
29,688363.SS,"BLOOMAGE BIOTECHNOLOGY CORPORATION LIMITED is a China-based company mainly engaged in the research, development, production and sales of various raw materials of sodium hyaluronate and relevant bioactive ingredients, as well as end products such as medicines, medical devices and functional skin care products. The Company relies on microbial fermentation and cross-linking technology platforms to provide raw materials such as gradesodium hyaluronate, medical end products such as sodium hyaluronate injection and functional skin care products to serve the world in areas like pharmaceutical, cosmetic and food manufacturing, medical institutions and users. The Company owns cosmetics brands such as BIOHYALUX, CYTOCARE and MEDREPAIR. The Company conducts its businesses within the domestic market and to overseas markets."
30,002415.SZ,"HANGZHOU HIKVISION DIGITAL TECHNOLOGY CO., LTD. is a China-based company, principally engaged in the research and development, manufacture and distribution of video products, as well as the provision of video services. The Company mainly provides front-end products, back-end products and center control products. The Company's products include video encoders, video decoders, video optical transceivers, network optical transceivers, mixed video recorders (XVRs) and network video recorders (NVRs), among others. The Company also provides construction engineering services and innovation business. The Company conducts its businesses within domestic and overseas markets."
31,000703.SZ,"HENGYI PETROCHEMICAL CO., LTD is a China-based company principally engaged in the production and distribution of petrochemical products. The Company's main products include pure terephthalic acid (PTA), caprolactam (CPL), polyethylene terephthalate (PET) chips, PET bottle flakes, polyester pre-oriented yarns (POYs), fully drawn yarns (FDYs) and draw texturing yarns (DTYs), among others. The Company is also involved in financial equity investment business. The Company distributes its products in domestic market and to overseas markets."
32,600848.SS,"SHANGHAI LINGANG HOLDINGS CO.,LTD is a China-based company principally engaged in the park development business. The Company is mainly involved in the development and construction as well as operation of industrial carriers such as research and development technology buildings and industrial plants. The Company mainly operates its business in Shanghai, China."
33,300059.SZ,"East Money Information Co.,Ltd. is a China-based company principally engaged in the operation of Internet financial service platforms. The Company is mainly engaged in securities business, financial e-commerce service business, financial data service business and Internet advertising service business. The Company primarily provides paid financial data services, financial e-commerce services and Internet advertisement services through its Website, eastmoney.com."
34,000063.SZ,"ZTE Corp is a China-based company principally engaged in the design, development, production, distribution and installation of a range of Information and Communication Technology (ICT) related systems, equipment and terminals. The Company mainly operates its business through three segments. Carriers’ Network segment mainly provides wireless network, wired network, core network and telecommunication software systems and services, as well as other technologies and product solutions. Government and Corporate segment provides the government and corporate information projects with top-level design, consulting services and integrated information solutions. Consumer segment is mainly involved in the development, production and sale of smart phones, mobile data terminals, family terminals and wearable devices, as well as the provision of related software applications and value-added services."
35,600585.SS,"Anhui Conch Cement Co Ltd is a China-based company principally engaged in production and sale of cement, commodity clinker and aggregate. The Company’s main cement products included 32.5-grade cement, 42.5-grade cement and 52.5-grade cement, which are widely used in construction projects of large-scale national infrastructures such as railways, expressways, airports and hydraulic power as well as urban property, cement products and the rural markets. The Company distributes its products within domestic market and to overseas markets."
36,002739.SZ,"WANDA CINEMA LINE CO., LTD, formerly WANDA FILM HOLDING CO., LTD., is a China-based company principally engaged in the investment, construction, operation and management of cinemas. The Company is mainly engaged in the investment and construction of cinemas, film distribution, film screening and theater-related derivatives businesses, including the sale of goods and food and drinks, as well as advertising publishing. The Company operates its business in domestic and overseas markets."
37,601916.SS,"CHINA ZHESHANG BANK CO., LTD. operates as one joint-stock commercial bank headquartered in Zhejiang. The Bank operates its businesses through segments: Corporate Banking segment, which provides financial products and services to corporations, government agencies and financial institutions, and its range of products and services include corporate loans and advances, trade finance, deposit products and other types of corporate intermediary services; Retail Banking segment, which provides financial products and services to individual customers, and its range of products and services includes personal loans and advances, deposit products, bank cards business and other types of personal intermediary services; Treasury Business segment, which conducts money market and repurchase transactions, debt instruments investments and financial derivatives business for proprietary trading or on behalf of customers, and Others segment."
38,600161.SS,"BEIJING TIANTAN BIOLOGICAL PRODUCTS CORPORATION LIMITED is a China-based company principally engaged in the biopharmaceutical businesses. The Company’s primary products include preventive products, blood products and other biological products, such as the influenza A (H1N1) vaccines (split, inactivated),hepatitis B vaccines, poliomyelitis vaccines, measles-mump-rubella (MMR) vaccines, encephalitis B vaccines, influenza vaccinations, bacterial vaccines, human serum albumin (HSA) and intravenous immunoglobulin (IVIG), among others. The Company mainly distributes its products within domestic markets and to Hong Kong markets."
39,002024.SZ,"SUNING.COM CO LTD, formerly SUNING COMMERCE GROUP CO LTD, is a China-based company principally engaged in the retailing of household appliances, digital products and communication products. The Company operates businesses through three segments. The Retailing segment is engaged in the sales of communication products, small household appliances, digital and information technology (IT) service products, refrigerators, washing machines, color televisions (TVs) and air conditioners through online and offline channels, as well as the provision of installation and maintenance services. The Logistics segment is engaged in the provision of logistics services. The Finance segment is engaged in the payment business and the supply chain finance business, among others. The Company operates businesses both in domestic and overseas markets."
40,000728.SZ,"Guoyuan Securities Co Ltd is a China-based securities company. The Company's main businesses include securities brokerage business, securities credit business, investment banking business, proprietary investment business and asset management business. In addition, the Company also operates international business, futures business, alternative investment, equity investment, public equity funds, private equity funds, and regional equity markets through its holding companies and joint stock companies. The Company conducts its businesses both in the domestic market and overseas markets."
