,Instrument,Business Description
161,001979.SZ,"CHINA MERCHANTS SHEKOU INDUSTRIAL ZONE HOLDINGS CO.,LTD is a China-based company principally engaged in the development and operation of industrial parks, communities and cruise business. The Company mainly operates through three segments. Community segment provides quality residential real-estates for family level customers under the brand of China Merchants. Industrial Park Development segment is mainly involved in the development and operation of the theme industrial parks, characteristic industrial belts and the ecological zones. Cruise segment is mainly involved in the construction, operation and management of Shekou Cruise Terminal. The Company operates its business in the domestic and overseas markets, with China as its domestic market."
162,603160.SS,"Shenzhen Goodix Technology Co., Ltd. is a China-based company mainly engaged in the research and development of intelligent human-machine interaction technologies. The Company's main products include capacitive touch screen controller and fingerprint identification chips. The Company is also engaged in the manufacture of fixed phone chips. The capacitive touch screen controllers are mainly applied in smart phones, tablet personal computers (PCs), navigators and other intelligent terminal touch screen control devices. Otherwise, the small proportions of capacitive touch key chips are applied in MP3, MP4 and control buttons of terminal products (such as household appliances). The Company distributes its products in domestic market and to overseas markets."
163,300274.SZ,"Sungrow Power Supply Co., Ltd. is a China-based company principally engaged in the research, development and manufacture of photovoltaic inverters, as well as power station system integration businesses. The main products of the Company include photovoltaic inverters, wind energy converters, energy storage systems and motor controllers for electric vehicles, among others. Its power station system integration businesses include the development, design and system integration of photovoltaic power generation projects, as well as the provision of power station-level performance optimization services and operation and maintenance services. The Company operates businesses in both domestic market and overseas market."
164,600030.SS,"CITIC Securities Company Limited is a China-based securities company. The Company mainly involves in securities brokerage, securities investment and consulting, asset management, securities underwriting and recommendation, financial advising related to securities trading and investment activities, securities proprietary business, margin trading, commission on securities investment funds, futures brokerage, commission on financial instruments and marketing stocks and options."
165,600893.SS,"AECC AVIATION POWER CO,LTD, formerly AVIC AVIATION ENGINECORPORATION PLC, is a China-based company, principally engaged in the research and development, manufacture and distribution of aircraft engines and derivatives. The Company is also engaged in trading export subcontract business and the manufacture and distribution of non - aviation products. The Company distributes its products in domestic markets and to overseas markets."
166,601816.SS,"Beijing-Shanghai High Speed Railway Co., Ltd. is a China-based company mainly engaged in railway business. The Company is the main body of investment, construction and operation of the Beijing-Shanghai high-speed railway and the stations along the line. It manages the transportation of the Beijing-Shanghai high-speed railway through a commissioned transportation management model. The Company's main business is high-speed rail passenger transportation, including providing high-speed rail transportation services to passengers who take the train and collecting fares; when other trains run by the railway transport companies run on the Beijing-Shanghai high-speed railway, they provide line use, contact networks use and other services to charge corresponding fees, etc. The Company mainly operates its business in the domestic market."
167,000800.SZ,"FAW Jiefang Group Co Ltd, formerly FAW Car Co Ltd, is a China-based company principally engaged in the development, manufacturing and sale of passenger cars. The Company’s products include whole vehicles, spare parts and others. The Company provides products under the brand names of Besturn, Hongqi and Mazda, among others. The Company is also engaged in the research and development, manufacturing and sales of commercial vehicles through its subsidiary, FAW Jiefang Automotive Co Ltd. The Company distributes its products primarily in domestic market."
168,601328.SS,"Bank of Communications Co Ltd mainly provides banking and related financial services. The Bank's businesses are divided into four segments: Personal Finance Business segment, Corporate Finance Business segment, Capital Business segment and Other Businesses segment. Personal Finance Business segment mainly include personal loans, retail deposits, credit cards and remittances. Corporate Finance Business segment mainly include corporate loans, bills, trade financing, corporate deposits and remittances. Capital Business segment mainly include money market fund borrowing and buying, investment securities, and selling securities under sell repurchase agreements."
169,601100.SS,"Jiangsu Hengli Hydraulic Co. Ltd. is a China-based company, principally engaged in the manufacture and sales of professional hydraulic components and hydraulic systems. The Company's products mainly include cylinders for diggers and nonstandard cylinders for heavy equipment. Its cylinders for diggers include boom cylinders, stick cylinders and bucket cylinders. Its nonstandard cylinders include nonstandard cylinders for large-scale infrastructure equipment, ships, marine engineering equipment and port machinery. The Company's products also include hydraulic complete sets, oil cylinder parts and hydraulic pump valves. The Company distributes its products within domestic market and to overseas markets."
170,601288.SS,"AGRICULTURAL BANK OF CHINA LIMITED is a China-based commercial bank. The Bank mainly operates through four business segments. The Corporate Finance segment is engaged in the deposit and loan business, small and micro business finance, settlement and cash management, trade financing and investment banking, among others. The Personal Finance segment is engaged in personal deposit and loan, credit card business and private banking business. The Treasury segment is engaged in money market business and investment portfolio management. The Asset Management segment is engaged in the provision of financial services, asset custody business, pension business and precious metal business."
171,601818.SS,"CHINA EVERBRIGHT BANK COMPANY LIMITED. is a commercial bank. The Bank is principally engaged in the corporate banking, retail banking, treasury and other businesses. The corporate banking businesses mainly includes the corporate deposit and loan business, the investment banking, capital custody, pension fund business, trade financing business and micro-financial business. The retail banking businesses mainly include the private deposit business, personal loan business and bank card business. The bank is also engaged in the funds and interbank business, gold agency business, asset management business and electronic banking business. The Bank mainly operates its businesses in domestic markets."
172,600845.SS,"Shanghai Baosight Software Co., Ltd. is a China-based company, principally engaged in software development and engineering, outsourcing services, and system integration. The company's products are applied in steel, transportation, service outsourcing, mining, nonferrous metals, petrochemical, equipment manufacturing (including shipbuilding), resources, finance, public services, water conservancy, medicine and other industries."
173,600919.SS,"BANK OF JIANGSU CO., LTD. is a China-based regional commercial bank. The bank is principally engaged in the provision of banking and related financial services. The Bank mainly operates its businesses through personal banking business, corporate banking business, interbank financial business, network finance business, small and micro financial business, as well as credit card issuing. Its personal banking business provides loan, deposit, investment and financing, as well as bank card business to individuals. Its corporate banking business provides deposit and lending services, wealth management services, as well as project finance financing services, among others to enterprises. The Bank is also involved in the provision of electronic banking, Internet banking, mobile phone banking and telephone banking services."
174,603233.SS,"DaShenLin Pharmaceutical Group Co Ltd is a China-based company principally engaged in the pharmaceutical retailing business. The Company's primary business includes direct sales and retailing of Chinese and Western medicine, ginseng nourishing herbs and Chinese medicine pieces, health products, medical apparatus and instruments and other commodities. The Company mainly conducts its business within domestic market."
175,601066.SS,"China Securities Co., Ltd. is mainly engaged in securities brokerage, securities investment consulting, financial advisers related to securities trading and securities investment activities, securities underwriting and sponsor, securities self-management, securities asset management, securities investment fund agent distribution, providing futures companies with medium introduction services, margin financing, financial products agent distribution, insurances facultative agent, stock options market making, securities investment fund trusteeship and precious metal products sales businesses."
176,600705.SS,"AVIC Industry-Finance Holdings Co Ltd, formerly AVIC Capital Co Ltd, is engaged in the operation of financial business and financial industrial equity investment business, with a focus on securities, leasing, futures, finance companies and trust operations. Its securities operations include securities brokerage, securities proprietary, underwriting and sponsoring, entrusted asset management and other business; financial operations include deposit and loan business; leasing operations include financial leasing and operation leasing of aircrafts, ships and other equipment; trust operations include fund trust, movable property trust and real estate trust businesses; futures operations include futures brokerage business, and commodity sales operations include production and sales of cell kit and medicinal edible oil. The Company operates its businesses in East China, North China, Northeast China, Northwest China, Southwest China and South China."
177,601872.SS,"China Merchants Energy Shipping Co., Ltd. is principally engaged in crude oil transportation, international bulk cargo transportation and liquefied natural gas (LNG) transportation. The Company involves in the LNG transportation business through its subsidiary, China LNG Shipping (Holdings) Limited. The Company provides transportation services of oil, iron mineral ore, steel, coal, nickel ore and aluminum oxide and LNG."
178,002624.SZ,"Perfect World Co Ltd is a China-based company principally engaged in the research and development, distribution and operation of online games. The Company conducts its businesses through two segments. The Game segment is mainly engaged in the development, distribution and operation of Personal Computer (PC) online games, mobile online games and console games. The Film and Television segment is mainly involved in the production, distribution and derivative business of TV series and movies, variety entertainment business, artist brokerage services and related service businesses. The Company operates its businesses both in the domestic market and overseas markets."
179,601998.SS,"CHINA CITIC BANK CORPORATION LIMITED is a commercial bank. The Bank provides banking business, international business, financial market business, institution business, investment banking business, factoring business, custody business and other comprehensive financial solutions to enterprises and institution customers; as well as provides retail banking service, credit cards, consumer financial service, wealth management, personal banking service, overseas financial and other related products and services to individual customers. The Company mainly conducts its businesses within domestic market."
180,603882.SS,"Guangzhou Kingmed Diagnostics Group Co Ltd is a company that mainly provides medical diagnosis services. The Company is also engaged in other businesses, including sales of diagnostic products, provision of physical examination and cold chain logistics services."
181,300003.SZ,"Lepu Medical Technology (Beijing) Co., Ltd. is a China-based company principally engaged in the research, development, production and sale of cardiovascular related medical equipment, medicines and health products, as well as in the provision of related medical services. The Company’s main products include stent systems, occluders, bulk drugs, clopidogrel sulfate, atorvastatin calcium tablets, pacemakers, in vitro diagnostic reagents and equipment and surgical instrument, among others. The Company distributes its products in domestic market and to overseas markets."
182,601600.SS,"Aluminum Corp of China Ltd is a China-based company principally engaged in the production and sales of alumina, primary aluminum and aluminum alloy products. The Company operates businesses through five segments. The Alumina segment is engaged in the production and sales of alumina, fine alumina and aluminum ore. The Primary Aluminum segment is engaged in the production and sales of primary aluminum, carbon products, aluminum alloys and other electrolytic aluminum products. The Energy segment is mainly engaged in coal mining, thermal power generation, wind power generation, photovoltaic power generation and new energy equipment manufacturing. The Trading segment mainly provides alumina, primary aluminum, aluminum processed products and other non-ferrous metal products and coal and other raw materials, auxiliary materials trading and logistics services. The Headquarters and Other Operating segment is engaged in other research and development of aluminum business and other activities."
183,300408.SZ,"CHAOZHOU THREE-CIRCLE (GROUP) CO., LTD is engaged in the production and sales of electronic ceramic electronic components and its basic materials. Its main products include fiber ceramic ferrules and sleeves, fuel cell separator plates, ceramic package bases, ceramic substrates, ceramic matrix, terminals, multiplayer ceramic chip capacitors (MLCC) and resistance. Its products are applied in electronics, communications, consumer electronics, industrial electronics, new energy and other fields."
184,002673.SZ,"WESTERN SECURITIES CO.,LTD. is a China-based securities company. The Company mainly operates through four segments. Securities Brokerage segment is mainly engaged in agent trading of stocks, funds, bonds and financial products. Asset Management segment mainly provides financial products, oriented asset management services and direct investment services. Investment Banking segment is mainly engaged in initial public offering (IPO) securities underwriting and bonds underwriting. Securities Proprietary Trading Segment is mainly engaged in the self-operated trading of stocks, bonds, warrants and securities investment funds. The Company is also involved in credit transactions business, fixed income businesses and the over-the-counter businesses, among others."
185,603501.SS,"Will Semiconductor Co., Ltd. Shanghai is a China-based company principally engaged in the research and development, design and sales of semiconductor devices. The Company’s main businesses include the research and development and design of semiconductors, as well as the distribution of semiconductor products. The Company’s products mainly include semiconductor discrete devices, power management integrated circuits (IC), transient voltage suppressers (TVS), metal-oxide-semiconductor field-effect transistors (MOSFET), schottky diodes, as well as the passive components such as resistances, capacitances and inductances. The Company’s products are primarily applied in mobile communication, vehicle-mounted electronics, security, internet communication and household appliances, among others."
186,600547.SS,"Shandong Gold Mining Co., Ltd. is a China-based company principally engaged in the mining, processing and sales of gold. The Company operates two segments. The Gold Mining segment is engaged in the mining of gold ore. The Gold Refining segment is engaged in the production and sales of gold. The Company is also engaged in the distribution of other metals extracted during the gold ore smelting process, such as silver, copper, iron, lead and zinc. The Company conducts its businesses in domestic and overseas markets."
187,002773.SZ,"Chengdu Kanghong Pharmaceutical Group Co., Ltd is a China-based company principally engaged in the research, development, manufacture and distribution of Chinese patent medicines, chemical drugs and biological products. The Company’s main products include Conbercept Ophthalmic Injection, Songling capsules conducive to blood vessels, Keluoxin capsules, venlafaxine hydrochloride capsules and sustained release tablets, aripiprazole tablets and orally disintegrating tablets, mosapride citrate tablets and dispersible tablets, dexzopiclone tablets, Shuganjieyu capsules, Danshu capsules and Yiqing capsules, among others. The Company distributes its products in domestic market."
188,601688.SS,"HUATAI SECURITIES CO., LTD. is an integrated securities company in China. The Company's main businesses include wealth management business, institutional service business, investment management business and international business. Its wealth management business includes securities, futures and options brokerage, financial product sales, capital intermediation and other services. The Institutional service business mainly includes investment banking, research and institutional sales, investment trading and asset custody. The investment management business mainly includes asset management of securities companies, management of private equity funds and asset management of fund companies. Its international business mainly includes investment banking, brokerage and wealth management, research and institutional sales, equity derivatives, fixed income sales and trading, as well as asset management."
189,000338.SZ,"Weichai Power Co., Ltd. is engaged in the manufacturing of transportation equipment. The Company’s main business includes the research, development, manufacture, distribution of vehicles and key components, non-automotive engines and other components, as well as the production of forklift and the provision of warehouse technical services. The Company is also involved in the research, development, design, sales and maintenance of air purification products, transfer and consulting business of air purification technology, as well as import and export trade business."
190,300122.SZ,"Chongqing Zhifei Biological Products Co., Ltd. is a China-based company principally engaged in the research, development, production, sale and distribution of vaccine products. The Company's main products include bacterial vaccines for the prevention of meningitis and pneumonia-based bacteria, biological products for the prevision and treatment of tuberculosis, viral vaccines for the prevention of rabies virus, influenza virus and other virus, general drugs and other biological products, among others. The Company is also involved in the agency sale of vaccines. The Company distributes its products in domestic market and to overseas markets, with Central China as its main market."
191,600029.SS,"China Southern Airlines Company Limited is principally engaged in the operation of civil aviation, including the provision of passenger, cargo, mail delivery and other extended transportation services. The Company operates through two business segments, including Airline Transportation segment and Other segment. Airline Transportation segment consist of passenger and cargo and mail operations. Other segment includes hotel and tour operation, ground services, cargo handling and other miscellaneous services. . The Company also provides services of general aviation and aircraft maintenance. The Company acts as an agency of domestic and foreign airlines, and other aviation and related business, such as personal accident insurance and agency business."
192,601901.SS,"Founder Securities Co., Ltd. is a China-based company principally engaged in the security related businesses. The Company's main businesses include the securities brokerage, asset management, investment banking and other comprehensive financial services, as well as the securities proprietary and investment businesses. The securities proprietary and investment businesses mainly include the securities broking, futures broking, investment banking, asset management, research and consulting, margin trading, direct investment and over the counter (OTC) market operations, among others."
193,600143.SS,"KINGFA SCI. &TECH.CO., LTD. is a China-based company principally engaged in the research, development, production and sales of new chemical materials. The Company's main products include modified plastics, biodegradable plastics, high-performance carbon fibers and composite materials, special engineering plastics, environmentally friendly high-performance recycled plastics and others. Its products are mainly applied in automotive, household appliances, modern agriculture, rail transportation, aerospace, high-end equipment, new energy, communications, electrical and electronic, as well as building decoration industries. The Company distributes its products in domestic market and to overseas markets."
194,600028.SS,"China Petroleum & Chemical Corporation is a China-based energy and chemical company. The Company's segments include Exploration and Development segment, Refining segment, Marketing and Distribution segment, Chemicals segment, and Corporate and Others segment. Exploration and Development segment explores and develops oil fields, as well as produces crude oil and natural gas. Refining segment processes and purifies crude oil, which is sourced from Exploration and Development segment and external suppliers. Marketing and Distribution segment owns and operates oil depots and service stations in China. Chemical segment manufactures and sells petrochemical products, derivative petrochemical products and other chemical products to external customers."
195,601633.SS,"Great Wall Motor Company Limited is a sport utility vehicle (SUV) manufacturer in the People's Republic of China (the PRC). The Company is principally engaged in the design, research and development, manufacture and sale, as well as distribution of SUVs, sedans, pick-up trucks and automobile-related parts and components. The Company has three brands, Great Wall, Havel and WEY, and its products include SUVs, sedans and pick-up trucks. The Company also manufactures and supplies relative automotive parts and components. The Company's vertically integrated parts and components production unit manufactures various products, including engines, transmissions, chassis, electronics, interior and exterior decoration parts and molds. The Company manufactures cars, which include Great Wall C50 and Great Wall C30. The Company's SUVs include Great Wall H6, Great Wall H5-E and Great Wall M4. The Company's pick up vehicles are Wingle 5, Wingle 6 and Wingle 5 Upgrade."
196,601669.SS,"Power Construction Corporation of China, Ltd. is a China-based company principally engaged in the contracting, survey and design of water conservancy and hydropower projects. The Company's principal businesses include the construction contracting, electric investment and operations, real estate development, equipment manufacturing and leasing, among others. The Company is also engaged in the commodity trading, the sales of materials and the construction of highways and bridges through its subsidiaries. The Company mainly operates its businesses in the domestic and overseas markets."
197,600019.SS,"Baoshan Iron & Steel Co.,Ltd. is a China-based company principally engaged in the manufacture and trading of iron and steel products. The Company’s main steel products include cold-rolled carbon steel, hot-rolled carbon steel, steel pipe products and other steel products. The products of the Company are applied in various industries, including automobile, home electric appliance, petrochemical, machinery manufacturing, energy and transportation, among others. The Company also involves in possessing and delivery business, chemical industry, information technology (IT), financial business and electronic commerce related to the iron and steel business. The Company distributes its products in domestic market and to overseas markets."
198,601888.SS,"China Tourism Group Duty Free Corp Ltd, formerly China International Travel Service Corp Ltd, is a China-based company principally engaged in the travel agency businesses and duty free businesses. The travel agency businesses mainly include the inbound tourism, outbound tourism, domestic tourism, visa services, business travel services, air services and e-commerce, among others. The duty free businesses mainly include the wholesaling and retailing of alcohols, tobaccos, perfumes and cosmetics. The Company is also engaged in commercial complex investment development."
