,Instrument,Business Description
199,002607.SZ,"Offcn Education Technology Co., Ltd., formerly Yaxia Automobile Corporation, is a China-based company principally involved in technology development, technical services, technology promotion, technology transfer and technology consulting businesses in the field of education technology. The Company is also engaged in education and training, exhibition displays and cultural and artistic activities operation and other businesses. The Company operates its businesses primarily in Mainland China."
200,601211.SS,"Guotai Junan Securities Co.,Ltd. is principally engaged in the securities brokerage, securities credit transactions, investment banking, securities trading, securities research and over-the-counter (OTC) businesses. The Company operates its business through four segments. Institutional Financial Service segment include investment banking and institutional investor services. Personal Financial Service segment mainly includes the provision of securities and futures brokerage, margin business, wealth management, financial planning and other services. Investment Management segment provides asset management and fund management services mainly for institutions and individuals, as well as involves in the direct investment business. International Business segment mainly includes brokerage, corporate financing, asset management, loan and financing and financial products, marketing and investment businesses, as well as building an international business platform."
201,600406.SS,"NARI Technology Co., Ltd. is a China-based company principally engaged in the development, production and sales of hardware and software products related to the power industry. The Company is also engaged in the provision of related system integration services. The Company's main products include power grid automation products, power generation and new energy products, energy saving and environmental protection products, industrial control (including rail transportation) products, among others. The Company mainly distributes its products in domestic markets and overseas markets."
202,002812.SZ,"Yunnan Energy New Material Co Ltd is a China-based supplier of film products, packaging and printing products, as well as paper packaging products. Its film products mainly include lithium ion isolation film (including base film and coating film) and biaxially-oriented polypropylene (BOPP) film (including smoke film and flat film). Its packaging and printing products mainly include cigarette labels and aseptic packaging products. Its paper packaging products mainly include specialty paper products (including laser transfer anti-counterfeiting paper, direct plating paper and coated paper), holographic anti-counterfeiting anodized aluminum, transfer film and other products. The Company distributes its products in domestic market and to overseas markets."
203,600521.SS,"ZHEJIANGHUAHAIPHARMACEUTICALCO., LTD is a China-based company, principally engaged in the manufacture and distribution of active pharmaceutical ingredients (APIs), intermediates and preparations. The Company's main products are classified as -pril series, -sartan series and preparations, including irbesartan tablets, paroxetine hydrochloride tablets, risperidone tablets, fosinopril sodium tablets, as well as irbesartan and hydrochlorothinzide tablets, among others. The Company also provides related technical support services. The Company distributes its products in domestic and overseas markets."
204,600763.SS,"Topchoice Medical Co Inc, formerly Top choice Medical Investment Co Inc, is a China-based company mainly engaged in medical treatment. The Company operates in three segments. Medical Service segment mainly provides dental medical services, including dental implants, orthodontics and pediatric dental services. Product Sales segment is mainly engaged in the sales of medical equipment. Management services and Others segment is engaged in other management support businesses."
205,601088.SS,"China Shenhua Energy Co Ltd is a China-based comprehensive energy company. The Company operates its businesses through six segments. The Coal Business segment is engaged in coal mining and sales of surface and underground coal mines. The Power Generation Business segment is engaged in coal power generation, wind power generation, hydropower generation, gas power generation and power sales business. The Railway Business segment provides railway transportation services. The Port Business segment provides port cargo handling, handling and storage services. The Shipping Business segment provides shipping and transportation services. The Coal Chemical Business segment is engaged in the manufacturing and sales of olefin products. The Company conducts its businesses both in the domestic market and overseas markets."
206,601988.SS,"BANK OF CHINA LIMITED is a China-based commercial bank. The Bank is mainly engaged in the provision of banking and related financial services, including commercial banking business, investment banking business, insurance business, direct investments and investment management businesses, fund management business and aircraft leasing business, as well as others. The Company mainly provides loans to individual and corporate clients. The Bank mainly operates its businesses in China mainland, Hong Kong, Macau and Taiwan, as well as other countries."
207,601990.SS,"Nanjing Securities Co., Ltd. is a China-based comprehensive securities company. The Company is principally engaged in securities brokerage, investment banking, securities proprietary, asset management, credit trading, futures and other businesses. The securities brokerage business includes securities agency sales, financial products agency sales and intermediate introductions for futures. Its investment banking business includes equity underwriting and sponsorship, bond issuance underwriting and financial consultant. Its securities proprietary business includes equity securities investment, fixed income securities investment and security derivatives investment. Its asset management business includes collective asset management. The credit trading business includes margin financing and securities pledged repurchase transactions. Its futures business includes futures brokerage. Other businesses include fund management business."
208,601698.SS,"China Satellite Communications Co., Ltd. is a China-based company principally involved in the operation of satellite space segment and the provision of related application services. The satellite space segment operation provides users with broadcast, television, communications, video, data and other transmission services through investment, construction and operation of communication satellites and supporting ground monitoring and control systems. The satellite application services mainly include satellite ground segment operation services and integrated solutions for satellite communication services. The Company conducts its businesses in domestic and overseas markets."
209,600436.SS,"ZHANGZHOU PIENTZEHUANG PHARMACEUTICAL.LTD is a China-based company principally engaged in pharmaceutical production and distribution business. The Company's major products include Pientzehuang series for pain-inhibition, anti-inflammation, detoxification and curing hepatitis, tablets for coronary heart diseases and hypertension, bupleurum granules for cold, as well as pharmaceuticals for bone injuries and others. The Company is also engaged in the production and distribution of cosmetics and daily use chemicals, such as pearl paste series, sun screen series, anti-spotting series, shampoo, toothpastes and shower gel, among others, and the distribution of food. The Company distributes its products within domestic market and to overseas markets."
210,300015.SZ,"Aier Eye Hospital Group Co.,Ltd. is a China-based ophthalmic medical institution. The Company is mainly engaged in ophthalmic diseases treatment, surgical services and medical optometry. The Company mainly provides corneal refractive surgery, cataract operation, anterior segment operation, posterior segment operation and optometry services. The Company mainly operates its business in domestic market, with Central China as its main market."
211,000568.SZ,"Luzhou Laojiao CO.,LTD is a China-based company principally engaged in the design, manufacture and distribution of Chinese liquor products. The Company distributes its products primarily under the brand series of National Cellar 1573 and Luzhou Laojiao. The Company offers high-end liquor products, medium-end liquor products and low-end liquor products. The Company distributes its products in domestic market, with southwest area of China, North China and Central China as its main markets."
212,002352.SZ,"S.F. Holding Co., Ltd., formerly Maanshan Dingtai Rare Earth & New Materials Co., Ltd., is a China-based company principally engaged in the provision of integrated express logistics services. The Company provides integrated logistics services, such as warehousing management, sales forecasting, big data analysis and settlement management. The Company's logistics products include various express services, such as business express, e-commerce express, warehousing and distribution and international express; heavy cargo transport services, such as general cargo transport and heavy cargo express transport, as well as cold chain logistics services for food and pharmaceutical industries. The Company also offers value-added services, including insured transport, payment collection and others. The Company operates its businesses in domestic and overseas markets."
213,002938.SZ,"Avary Holding (Shenzhen) Co., Limited is a China-based company principally engaged in the design, research, development, manufacture and sales of various printed circuits boards. The Company’s main products include communication boards, consumer electronics and computer boards others. And these products are mainly applied in downstream products, including mobile phones, network equipment, tablet computers, wearable equipment, notebook computers, servers, storage and automotive electronics and others."
214,601162.SS,"TIANFENG SECURITIES CO., LTD. is a China-based securities company. The Company is mainly engaged in securities brokerage business, securities investment consulting business, financial advisory business related to securities trading and securities investment activities, securities investment fund commissioning business, securities underwriting and sponsorship business, securities proprietary business, securities asset management business, margin trading business, financial products commissioning business, as well as intermediate introduction business for futures companies."
215,601377.SS,"China Industrial Securities Co Ltd is a China-based company principally engaged in security brokerage and other related businesses. The Company operates its businesses through five segments. The Brokerage segment provides solutions for securities and futures brokerage, securities research and sales transactions for retail customers, high net worth individuals, corporate clients and financial institution clients.The Investment Banking segment provides one-stop direct financing services for corporate clients and government clients, including equity financing and merger and acquisition (M&A) financing services. The Asset Management segment provides various brokerage asset management services and private equity fund management services for institutional and individual clients. The Self-investment segment is engaged in the proprietary investment, trading and market making businesses of securities, derivatives and equities. The Overseas segment mainly conducts its businesses in Hong Kong."
216,002736.SZ,"Guosen Securities Co Ltd is a China-based securities company. The Company operates businesses through five segments. Brokerage and Wealth Management segment provides securities brokerage, futures brokerage, consignment of financial products, asset custody, investment consulting, margin financing and securities lending and other capital intermediaries services. Investment Banking segment provides financial services such as stock underwriting sponsorship, bond underwriting, mergers and acquisitions and restructuring, and national equities exchange and quotations recommendation. Investment and Transaction segment is engaged in the trading and market making business of financial products such as equity, fixed income, alternative investment, derivative products. Asset Management segment is engaged in collective asset management, directional asset management, special asset management and fund management business. Other segment is engaged in other business and headquarters operation business."
217,002032.SZ,"ZHEJIANG SUPOR CO., LTD. is a China-based company principally engaged in the research, development, manufacture and sale of cookware and electrical appliances. The Company's products are categorized into fire cooking utensils, small kitchen appliances, kitchen and bathroom appliances and environmental home appliances. The Company’s products include stir fry pans, pressure cookers, frying pans, soup and milk cookers, steamers, ceramic pots, kettles, cutters, shovel spoons, heat preservation pots, kitchen tools, fresh-keeping boxes, rice cookers, induction cookers, soybean milk machines, juice extractors, electrical saucepans, electrical hot pots, food processors, ventilators, gas ovens, sterilizers, air purifiers, hanging ironing machines, vacuum cleaners and electric irons, among others. The Company distributes its products in domestic market and to overseas markets, such as Japan, Europe, Americas and Southeast Asia."
218,002475.SZ,"Luxshare Precision Industry Co., LTD. is a China-based provider of Internet solutions. The Company's products include computer interconnection products and precision components, automotive interconnection products and precision components, communication products and precision components, consumer electronics, as well as other connectors. The Company distributes its products within domestic market and to overseas markets."
219,600031.SS,"SANY HEAVY INDUSTRY CO.,LTD is a China-based company principally engaged in the research and development, manufacture, distribution and provision of services of engineering machinery. The Company's major products are categorized into five types, which are concrete machinery, excavating machinery, hoisting machinery, pile driving machinery and road construction machinery, including truck-mounted concrete pumps, trailer concrete pumps, excavators, truck cranes, rotary drilling rigs and sets of road equipment, among others. The Company distributes its products in both domestic and to overseas markets."
220,601939.SS,"CHINA CONSTRUCTION BANK CORPORATION is a commercial bank. The Bank operates its businesses through corporate banking businesses, including corporate deposit, corporate credit loan, asset custody, enterprise annuity, trade financing, international settlement, international financing and value-added services, among others, personal banking businesses, including personal deposit, loan, bank card services, private bank services, foreign exchange trading and gold trading services, among others, and capital business. The Bank operates its businesses in domestic and overseas markets."
221,000100.SZ,"TCL Technology Group Corporation, formerly TCL Corporation, is a China-based company principally engaged in the manufacture and distribution of liquid crystal display (LCD) televisions (TVs) and intelligent terminals. The Company operates through three business segments. Product segment includes semiconductor display business, TCL multimedia electronics business, TCL communication technology business, household electrical appliance business, electronic business, commercial systems business and product and material business. Service segment consists of Internet application and service business and distribution and logistics service business. Venture Capital and Investment segment is mainly involved in real estate investment business."
222,300529.SZ,"Jafron Biomedical Co.,Ltd. is a China-based company principally engaged in the research, design, manufacture and distribute of biological materials and medical equipment. The Company’s products include disposable hemoperfusion devices, hemoperfusion machine, disposable bilirubin adsorbers, DX-10 blood purification machine, suture needle, as well as resins bandage, among others. The Company’s products are applied in uremia, poisoning, severe liver diseases, autoimmune diseases, as well as multisystem organ failure, among others. The Company’s products are applied in 31 provinces, more than 3000 hospitals in China."
223,600837.SS,"Haitong Securities Co., Ltd. is a China-based company principally engaged in security businesses. The Company operates its businesses through securities and futures broking, investment banking business, proprietary security business, direct investment business, security asset management, financing lease business and overseas business. The Company conducts its businesses in domestic and overseas markets."
224,601169.SS,"Bank of Beijing Co., Ltd. is a city commercial bank. The Bank's principal businesses include corporate banking, retail banking, financial markets and direct sales banking. The corporate banking businesses mainly include the corporate deposits, corporate loans and discount bills. The retail banking businesses mainly include the personal loans, credit cards, private banking and e-banking businesses. The financial markets businesses mainly include the international businesses, interbank businesses, treasury businesses, asset management businesses and custody businesses, among others."
225,601555.SS,"Soochow Securities Co Ltd is a China-based company principally engaged in security related businesses. The Company mainly operates through six segments. Brokerage and Wealth Management segment provides brokerage services for securities, funds and bonds, research services and investment consulting services. Investment Banking segment provides underwriting and recommend, acquisition and reorganization and financial innovation services. Investment and Dealing segment is engaged in the investment trading of securities, derivatives and other financial products. Asset Management and Fund Management segment is engaged in the development of asset management products and fund products according to customers' requirements, as well as the provision of related management services. Credit Trading segment is mainly engaged in security margin financing business and repurchasing business. Headquarters and Other segment is engaged in the other businesses."
226,300433.SZ,"Lens Technology Co., Ltd. is a China-based company principally engaged in the research and development, production and sales of protective panels for electronic products. The products of the Company include protective panels for mobile phone displays, tablets and other products, with protective panels for mobile phone displays as its main products. The Company’s products are applied in smart phones, tablets, laptops, intelligent wearable equipment and digital cameras, among others."
227,688012.SS,"Advanced Micro-Fabrication Equipment Inc. China is a China-based company principally engaged in the research and development, production and sales of high-end semiconductor equipment. The Company's main products are capacitive plasma etching equipment, inductive plasma etching equipment, deep silicon etching equipment and metal-organic chemical vapor deposition (MOCVD) equipment. The Company's products are mainly used in the manufacture of semiconductor products such as integrated circuits, micro-electro-mechanical system (MEMS) and light-emitting diode (LED) chip manufacturing. The Company mainly conducts its business in mainland China and Taiwan."
228,002558.SZ,"Giant Network Group Co Ltd is a China-based company engaged in the research and development (R&D) and operation of Internet games. The Company's business includes computer online games, mobile online games, Internet community tools and other game related businesses. The Company's two main product lines are Journey series and Ball Battle."
229,601236.SS,"Hongta Securities Co., Ltd. is a China-based company mainly engaged in securities business. The Company is principally engaged in securities brokerage, securities investment and credit transactions. The securities brokerage business is principally engaged in the agency trading of securities business. The securities investment business is mainly engaged in the business of buying and selling securities in its own name and capital. The credit transaction business mainly includes the margin financing and securities lending business, the stock pledged repo business and the agreed repurchase securities trading business. The Company is also engaged in investment banking, asset management and other businesses. The Company mainly conducts its businesses in domestic market."
230,600299.SS,"Bluestar Adisseo Co is a China-based company principally engaged in the research, design, production and distribution of additives for animal nutrition. The Company’s products include functional products, special products and others. Its functional products include methionine, vitamins, ammonia sulfates, as well as sodium sulfates, among others. Its special products include enzyme preparations, organic selenium additives and others. The Company also provides carbon disulfide, sulfuric acid and preparation services. The Company operates its business in domestic and overseas markets."
231,002008.SZ,"Han’s Laser Technology Industry Group Co., Ltd. is a China-based company principally engaged in the research and development, manufacture and sales of laser and automatic auxiliary equipment. The Company's products include laser marking, laser cutting and laser welding devices, printed circuit board (PCB) dedicated devices, robots, light emitting diode (LED) equipment and products, automatic equipment and related auxiliary solutions. Its products are applied in the fields of consumer electronics, machinery and hardware, aviation, power battery and railway transportation, among others. The Company mainly operates its businesses in domestic markets."
232,601398.SS,"Industrial and Commercial Bank of China Ltd is a China-based company principally engaged in the provision of banking and related financial services. The Bank mainly operates three segments, including Corporate Banking segment, Personal Banking segment and Treasury segment. The Corporate Banking segment provides loan, trade financing, deposit, corporate finance, custody and other related financial products and services to enterprises, government agencies and financial institutions. The Personal Banking segment provides loan, deposit, bank card, personal finance and other related financial products and services to individual customers. Treasury segment includes money markets business, securities investment business, self and valet foreign exchange trading and derivative financial instruments business. The Company conducts its businesses within domestic and overseas markets."
233,600061.SS,"SDIC Capital Co., Ltd, formerly SDIC Essence (Holdings) Co., Ltd, is a China-based company principally engaged in the securities business. The Company operates through five segments. The Brokerage segment manily includes brokerage business of securities and futures and the agent sales of financial products. Entrusted Asset Management segment mainly includes the pooled asset management, directional asset management and specific asset management. Proprietary Business segment mainly invests the Company’s funds in equity securities, fixed income securities and derivatives and is involved in the market making business in the new over-the-counter (OTC) market. Investment Banking segment includes stock financing, bond financing, mergers and acquisitions and financial advisory services. Margin Trading segment includes margin trading, stock pledged repo and agreed-to-repurchase securities."
234,002241.SZ,"Goertek Inc is a China-based company, principally engaged in the manufacture and distribution of electronic components. The Company's main products are electro-acoustic devices and components, including micro electro-acoustic components and consuming electro-acoustic products, such as Bluetooth earphones and speakers. The Company also provides electronic accessories, including related raw materials, tools and molds. The Company's products are mainly applied in mobile phones, laptops and televisions. The Company distributes its products within domestic market and to overseas markets."
235,000651.SZ,"GREE ELECTRIC APPLIANCES, INC. OF ZHUHAI is a China-based company principally engaged in the manufacture and sale of household appliances. The Company's main products include household air conditioners, central air conditioning systems, air water heaters, small household appliances, industrial products and mobile phones, among others. The Company distributes its products under the brands of Gree and TOSOT. The Company distributes its products in domestic market and to overseas markets."
236,601108.SS,"CAITONG SECURITIES CO.,LTD. is a China-based securities company. The Company is principally engaged in securities brokerage business, investment banking business, asset management business, securities proprietary business, securities credit business and research business. Through its subsidiaries, the Company is also involved in securities asset management, private equity fund management, alternative investment, overseas securities brokerage, futures brokerage, financial futures brokerage, futures investment consulting, asset management and fund management businesses."
