,Instrument,Business Description
0,STAN.L,"Standard Chartered PLC is an international banking company. The Banks's segments include Corporate & Institutional Banking, Retail Banking, Commercial Banking and Private Banking. Its Corporate & Institutional Banking segment allows companies and financial institutions to operate and trade globally, and its Private Banking segment supports high net worth individuals with their banking needs across borders and offers access to global investment opportunities. Its Retail Banking segment offers clients, as well as small businesses a range of banking support solutions, and its Commercial Banking segment provides mid-sized companies with financial solutions and services. Its personal banking offerings include investments and employee banking. Its business banking capabilities include transaction banking, Islamic banking and global research. Its private banking offerings include online services."
1,CRDA.L,"Croda International Plc is a United Kingdom-based specialty chemical company. Its marketing and research activities are organized into four global market sectors: Personal Care, Life Sciences, Performance Technologies and Industrial Chemicals. Personal Care sector focuses on ingredients for skin, hair, sun protection and color cosmetic products. Life Sciences sector comprises three businesses, Health Care, Crop Protection and Seed Enhancement. Performance Technologies sector targets technologies in Smart Materials and Energy Technologies and develops in Home Care & Water. Industrial Chemicals sector focuses on developing applications, selling co-streams and undertaking toll processing. It manufactures fragrances and flavours. Its products and markets include adhesives, agrochemicals, beauty and personal care, dietary supplements, food ingredients, furniture and wood, lubricants, oleochemicals, paints and coatings, pharmaceuticals, polymers and additives, skin health and water treatment"
2,ANTO.L,"Antofagasta plc is a copper mining company. The Company operates four copper mines in Chile, two of which produce by-products. In addition to mining, the Company has a transport division providing rail and road cargo services in northern Chile predominantly to mining customers, which include the Company’s own operations. The Company’s segments include Los Pelambres, Centinela, Antucoya, Zaldivar, Exploration and evaluation, Corporate and other items, and Transport division. Los Pelambres produces primarily copper concentrate and molybdenum as a by-product. Centinela produces copper concentrate containing gold as a by-product, molybdenum concentrates and copper cathodes. Antucoya and Zaldivar produce copper cathodes. The transport division provides rail cargo and road cargo transport together with its ancillary services."
3,MRW.L,"Wm Morrison Supermarkets PLC is engaged in the operation of retail supermarket stores under the Morrisons brand and associated activities. The Company’s brands include Naturally Wonky, Free From, Nutmeg, Home Cook, V Taste and Little Kitchen. It has food manufacturing capabilities in meat, fish, bakery, fruit and veg, deli and flowers. Its Morrisons branded beef, lamb, pork, chicken, milk and eggs are sourced in the United Kingdom. The Company serves customers across the United Kingdom through approximately 497 stores and an online home delivery service. The Company operates over seven regional distribution centers and one national distribution center. Its subsidiaries include Bos Brothers Fruit and Vegetables B.V., Chippindale Foods Limited, Safeway Stores Limited, Erith Pier Company Limited, Firsdell Limited, Kiddicare Properties Limited, Neerock Farming Limited, Neerock Limited and Rathbone Kear Limited."
4,BNZL.L,"Bunzl plc is an international distribution and services company. The Company’s segments include North America, Continental Europe, UK & Ireland, Rest of the World, and Corporate. The Company supplies a range of consumable products such as food packaging, disposable tableware and catering equipment, cleaning and hygiene supplies, guest amenities, personal protection equipment, packaging and healthcare consumables to various customer markets including grocery, foodservice, cleaning and hygiene, safety, non-food retail and healthcare. The Company also supplies goods not for resale to grocery stores, supermarkets, retail chains, convenience stores, food wholesalers, ethnic grocers and organic food outlets, amongst others. The Company supplies a range of disposable healthcare consumables to the healthcare sector including hospitals, retirement and nursing homes and doctors' surgeries and clinics. It is also engaged in the distribution of gloves, eye protection and workwear."
5,SGE.L,"Sage Group plc is a United Kingdom-based company, which provides accounting and business management software. The Company’s segments include Northern Europe, Central and Southern Europe and North America. The Company offers software and services for small or medium business, people and payroll, business management, payments and banking, and accountants and partners. Its accounting, finance and payroll solutions include Accounting, Sage 50cloud Accounting, Sage Timeslips, Sage HR, Sage X3 and Sage Intacct. Its construction and real estate solutions include Sage Intacct Construction, Sage 100 Contractor and Sage 300 CRE. Its business management solutions include Sage X3, Sage 100cloud, Sage 300cloud and Sage Fixed Assets. Its human resources and customer relationship management (CRM) solutions include Sage HRMS, Sage People and Sage CRM."
6,SVT.L,"Severn Trent Plc treats and provides water and removes wastewater in the United Kingdom and internationally. It provides solutions through two businesses: Regulated Water and Waste Water, and Severn Trent Business Services. The Company’s Regulated Water and Waste Water business includes the wholesale water and waste water activities. Its regulated water and waste water business focuses on wholesale operations and engineering, and household customer services. Its Severn Trent Business Services focuses on bioresources, green power, operating services and property development. Bioresources includes the sludge treatment and related renewable energy generating activities within Severn Trent Water. Business Services, through Severn Trent Green Power, generates renewable energy from anaerobic digestion, crop, hydropower, wind turbines and solar technology."
7,MGGT.L,"Meggitt PLC is an engineering company. The Company designs and manufactures high performance components and sub-systems for aerospace, defense and other specialist markets, including energy, medical, industrial, test and automotive. The Company's segments are Meggitt Aircraft Braking Systems (MABS), Meggitt Control Systems (MCS), Meggitt Polymers & Composites (MPC), Meggitt Sensing Systems (MSS) and the Meggitt Equipment Group (MEG). Its MABS supplies aircraft wheels, brakes and brake control systems. Its MCS supplies pneumatic, fluid control, thermal management and electro-mechanical equipment and sub-systems. Its MPC specializes in fuel containment and systems, sealing solutions and advanced composites. Its MSS provides sensing, monitoring, power and motion systems, which specializes in products designed to operate in demanding conditions across a range of applications. Its MEG enables a set of technologically distinct businesses to market their offerings to specialist customers."
8,BLND.L,"The British Land Company PLC is a United Kingdom-based real estate company that owns and manages commercial property. The Company is engaged in London Campuses and Retail & Fulfilment assets throughout the United Kingdom. The Company’s segments include Offices, Retail and Canada Water. The Retail sector includes leisure, as this is often incorporated into Retail schemes. The Other/unallocated sector includes residential properties. The Company portfolio includes Campuses and Retail & Fulfilment. The Company's Campuses at Broadgate, Paddington Central and Regent’s Place offer sustainable space in London. The Company is also delivering campus at Canada Water, including residential, commercial, retail and community space over 53 acres."
9,ICAG.L,"International Consolidated Airlines Group, S.A. is an airline company that holds the interests in airline and ancillary operations. Its segments include British Airways, Iberia, Vueling, Aer Lingus and Other Group companies. It combines the airlines in the United Kingdom, Spain and Ireland. It has approximately 573 aircrafts to over 268 destinations. The Company operates various aircraft fleet services, including Airbus A318, Airbus A319, Airbus A340-600, Boeing 787-800, Embraer E190 and Boeing 777-200, among others. The Company, through its subsidiaries, is engaged in providing airline marketing, airline operations, insurance, aircraft maintenance, storage and custody services, air freight operations and cargo transport services. The Company offers its services in cities, including London, Madrid, Barcelona, Rome and Dublin. The Company's brands include British Airways, Iberia, LEVEL, Vueling, Aer Lingus, IAG Cargo and Avios."
10,REL.L,"RELX PLC is a holding company of RELX Group plc. RELX Group is a global provider of information and analytics for professional and business customers across industries. The Company operates in four segments: Scientific, Technical & Medical; Risk & Business Analytics; Legal, and Exhibitions. The Company's Scientific, Technical & Medical segment provides information and analytics that help institutions and professionals progress science and advance healthcare. The Risk & Business Analytics segment provides solutions and decision tools that combine public and industry-specific content with technology and analytics. The Legal segment is a provider of information and analytics to professionals in legal, corporate, and government organizations. Its Exhibitions segment consists of Reed Exhibitions, which is an exhibitions business, with events in over 30 countries."
11,SMIN.L,"Smiths Group plc is a technology company. The Company operates in five divisions: John Crane, Smiths Detection, Flex-Tek, Smiths Interconnect and Smiths Medical. John Crane provides mission-critical solutions such as mechanical seals, seal support systems, power transmission couplings and filtration systems for global energy and process industries. Smiths Detection produces detection and screening technologies for the identification of safety and security threats. Flex-Tek provides engineered components that heat and move fluids and gases for aerospace, consumer products, construction, medical and industrial applications. Smiths Interconnect provides electronic components, subsystems, microwave and radio frequency products that provide secure connectivity of critical applications in the defense, aerospace, communications and industrial markets. Smiths Medical offers medical devices and consumables in the select segments of the infusion systems, vascular access and vital care markets."
12,AZN.L,"AstraZeneca PLC is a biopharmaceutical company. It focuses on discovery and development of products, which are then manufactured, marketed and sold. It focuses on three main therapy areas: Oncology, Cardiovascular, Renal & Metabolic (CVRM) and Respiratory, while selectively pursuing therapies in Autoimmunity, Infection and Neuroscience. In CVRM, it is expanding its portfolio into the cardiovascular-renal area with roxadustat, as well as investing to explore the benefits of its SGLT2 and GLP-1 franchises in chronic kidney disease (CKD) and heart failure (HF). It has approximately 38 projects in Phase I, including 26 new molecular entities (NMEs), and 12 oncology combination projects. It has approximately 43 projects in Phase II, including 25 NMEs; six additional indications for projects that have reached phase II, and 12 oncology combination projects. It has approximately 22 projects in late-stage development, either in Phase III/pivotal Phase II studies or under regulatory review."
13,HSBA.L,"HSBC Holdings plc (HSBC) is a banking and financial services company. The Company manages its products and services through three businesses: Wealth and Personal Banking (WPB), Commercial Banking (CMB), and Global Banking and Markets (GBM). It operates across various geographical regions, which include Europe, Asia, Middle East and North Africa, North America, and Latin America. WPB business offers Retail Banking, Wealth Management, Asset Management and Insurance. CMB products and services to serve the needs of commercial customers, including small and medium-sized enterprises, mid-market enterprises and corporates. It includes credit and lending, international trade and receivables finance, treasury management and liquidity solutions, commercial insurance and investments. GBM supports government, corporate and institutional clients, and private investors across the world."
14,WPP.L,"WPP plc (WPP) is a holding company engaged in providing communications services. The Company comprises companies in a range of disciplines, which include advertising, media investment management; data investment management; public relations and public affairs; branding and identity; healthcare communications; direct, digital, promotion and relationship marketing, and specialist communications. The Company operates through four segments: Advertising and Media Investment Management; Data Investment Management; Public Relations & Public Affairs; Branding consulting, Health and wellness and Specialist Communications. The Company has operations in over 112 countries. The Company offers global, national and specialist advertising services from a range of international and specialist agencies, which include Bates CHI&Partners, Grey, JWT, Ogilvy & Mather Advertising and Y&R."
15,FRES.L,"Fresnillo plc is a holding company. Through its subsidiaries, the Company is engaged in the mining and beneficiation of non-ferrous minerals, and the sale of related production. The primary contents of this production include silver, gold, lead and zinc. The Company has seven operating mines: Fresnillo, located in the State of Zacatecas, which is primary silver mine; Saucito, located in the State of Zacatecas, an underground silver mine; Cienega, located in the State of Durango, an underground gold mine, including the San Ramon satellite mine; Herradura, located in the State of Sonora, a surface gold mine; Soledad-Dipolos mine, located in the State of Sonora, a surface gold mine; Noche Buena, located in State of Sonora, a surface gold mine, and San Julian, an underground gold and silver miner. The Company owns a number of subsidiaries in South and North America."
16,SGRO.L,"SEGRO plc is a United Kingdom-based real estate investment trust. The Company owns, develops and manages warehouse properties in the United Kingdom and Continental Europe. Its segments include Greater London, Thames Valley and National Logistics, Northern Europe (principally Germany), Southern Europe (principally France) and Central Europe (principally Poland). The portfolio includes warehouses and light industrial buildings, including warehouses used as data centers and for logistics operations. These are concentrated in the United Kingdom, France, Germany and Poland. The remainder of the portfolio is located across other European countries including Spain, the Netherlands and the Czech Republic. Its properties are used by various sectors, including retail, transport and logistics, post and parcel delivery, services and utilities, retail, and technology, media and telecoms."
17,SJP.L,"St. James's Place plc is a United Kingdom-based financial services company that provides wealth management services to business and individuals across the United Kingdom. The Company offers personalized advice that covers financial, investment and tax planning, designed specifically for their lifestyle goals and stage of life. The Company’s segment includes wealth management business. The wealth management business is a vertically integrated business providing support to its clients through the provision of financial advice and assistance through its partner network, and financial solutions including (but not limited to) wealth management products manufactured in the Group, such as insurance bonds, pensions, unit trust and Investment Savings Accounts (ISAs) investments, and a Discretionary Fund Manager (DFM) service."
18,TW.L,"Taylor Wimpey plc is a residential developer. The Company operates at a local level from 24 regional businesses across the United Kingdom, and it has operations in Spain. Its segments include Housing United Kingdom and Housing Spain. The Housing United Kingdom segment includes North, Central and South West, and London and South East (including Central London) divisions. The North division covers its East and West Scotland, North East, North Yorkshire, Yorkshire, North West, Manchester, North Midlands, Midlands and West Midlands regional businesses. The Central and South West Division covers its East Midlands, South Midlands, East Anglia, Oxfordshire, South Wales, Bristol, Southern Counties and Exeter regional businesses. The London and South East Division includes Central London and covers its East London, North Thames, South East, South Thames and West London regional businesses."
19,AHT.L,"Ashtead Group PLC is a United Kingdom-based equipment rental company that is trading under the Sunbelt Rentals brand with networks in the United States, Canada and the United Kingdom. The Company rents a range of construction, industrial and general equipment across a variety of applications to a diverse customer base. The Company’s business units include Sunbelt US, Sunbelt UK and Sunbelt Canada. It operates approximately 861 stores in the United States, 77 stores in Canada and approximately 188 stores in the United Kingdom. The Company's equipment can be used to lift, power, generate, move, dig, compact, drill, support, scrub, pump, direct, heat and ventilate. It purchases a range of equipment from manufacturers and rents it on a short-term basis to a range of customers. It also sells the old equipment in the second-hand market. The Company's rental fleet ranges from small hand-held tools to a range of construction equipment."
20,HLMA.L,"Halma plc is a United Kingdom-based life-saving technology company. The Company operates through four segments: Process Safety, Infrastructure Safety, Environmental & Analysis and Medical. The Process Safety segment offers products, such as specialized interlocks that control critical processes safely; instruments that detect flammable and hazardous gases; and explosion protection and corrosion monitoring systems. The Infrastructure Safety segment offers products, such as fire detection systems, specialist fire suppression systems, elevator safety systems and people and vehicle flow technologies. The Environmental & Analysis segment offers products, such as opto-electronic technology and sensors, flow gap measurement instruments and gas conditioning products, and solutions for environmental data recording, water quality testing and ultraviolet (UV) water treatment. The Medical segment offers products, such as critical fluidic components, laboratory devices and systems."
21,III.L,"3i Group PLC is a United Kingdom-based investment company. The Company has two complementary businesses: Private Equity and Infrastructure, specializing in core investment markets in northern Europe and North America. Its Private Equity business includes investment and asset management to generate capital returns, and is focused on consumer, industrial and business services sectors. Its Infrastructure business includes investment and asset management to generate capital returns and cash income and focuses on the United Kingdom and Europe. It also offers software solutions to unify fragmented data and provide actionable insight. Its subsidiaries include 3i Investments plc, 3i BIFM Investments Ltd, 3i Europe plc and 3i Nordic plc. 3i Investments PLC is the investment manager of the Company."
22,HIK.L,"Hikma Pharmaceuticals Plc is a pharmaceutical company. The Company is focused on developing, manufacturing and marketing a range of both branded and non-branded generic and in-licensed products. The Company's segments include Branded, Injectables, Generics and Others. It sells branded generics and in-licensed patented products across the Middle East and North Africa (MENA) region and other markets. The Company sells specialized generic injectable products across the globe. It also sells non-injectable generic products in the United States, supplying over 300 products in different dosage strengths and forms. The Company's other businesses comprise Arab Medical Containers, a manufacturer of plastic specialized medicinal sterile containers, International Pharmaceuticals Research Centre, which conducts bio-equivalency studies, and the active pharmaceutical ingredient (API) manufacturing division of Hikma Pharmaceuticals Limited Jordan."
23,EVRE.L,"EVRAZ plc is a United Kingdom-based steel, mining and vanadium business with operations in the Russian Federation, the United States, Canada, the Czech Republic and Kazakhstan. The Company's principal activities include manufacturing steel and steel products; iron ore mining and enrichment; coal mining; manufacturing vanadium products, and trading operations and logistics. Its segments include Steel, Steel North America, and Coal. The Steel segment is engaged in the production of steel and related products, which it sells for domestic infrastructure and construction projects. Its vanadium business is based on processing vanadium slag from steelmaking operations. The Coal segment provides raw materials for the Company’s steel mills, supplies coking coal to domestic coke and steel producers. The Steel North America segment focuses on the markets in the Western United States and Canada, offering products including infrastructure steel, rails, large-diameter pipes and oil tubular goods."
24,MNG.L,"M&G PLC is a United Kingdom-based savings and investment company. The Company manages investments for both individuals and for institutional investors, such as pension funds. The Company’s asset management and customer solutions are supported by its two brands: Prudential and M&G Investments. In the United Kingdom and continental Europe, the Company provides a range of long-term savings and investment solutions, including PruFund. In the Americas, Africa, Asia and Australia, the Company also provides asset management solutions. The Company operates across two operating segments: Savings & Asset Management, and Heritage. The Savings & Asset Management Segment comprises its retail savings (including PruFund) and asset management business, as well as its institutional asset management business. The Heritage Segment comprises its annuities and corporate pensions businesses."
25,BKGH.L,"The Berkeley Group Holdings plc is a United Kingdom-based holding company. The Company, along with its subsidiaries, is engaged in residential-led property development focusing on regeneration and mixed-use property developments. The Company's portfolio consists of 250 City Road, Islington, 9 Millbank, Westminster, Battersea Reach, Beaufort Park, Hendon, Camden Goods Yard, Chelsea Creek, Clarendon, Haringey, Dickens Yard, Ealing, Grand Union Place, Brent, Kidbrooke Village, Greenwich, Poplar Riverside, Poplar, Prince of Wales Drive, Battersea, Royal Arsenal Riverside, Woolwich, Royal Exchange, Kingston, Silk Park, Barnet, South Quay Plaza, Docklands, Sovereign Court, Hammersmith, The Dumont, Albert Embankment and TwelveTrees Park, Newham. The Company’s brand includes Berkeley, St George, St James, St Edward, St William and St Joseph."
26,SMDS.L,"DS Smith Plc is a United Kingdom-based sustainable paper-based packaging company. The Company's operating segments include Northern Europe, Southern Europe, Eastern Europe, and North America. The Company provides packaging services, recycling services and paper products. Its packaging product portfolio includes packaging for consumer products, electronic commerce, promotion, transit and industrial packaging. Through its paper business, it manufactures corrugated case material (CCM), which is the paper used for conversion into corrugated board. Its paper business also manufactures paper grades such as plasterboard liner. Its recycling business provides integrated recycling and waste management services, ranging from recycling collections through to recycling and waste management solutions. It collects paper and cardboard for recycling from a range of sectors, including retailers, manufacturers, local authorities, and other recycling and waste management companies."
27,NG.L,"National Grid PLC is an energy transmission and distribution company. The Company operates through three segments: UK Electricity Transmission, UK Gas Transmission and US Regulated. The UK Electricity Transmission segment includes the high-voltage electricity transmission networks in England and Wales and Great Britain system operator. This segment also includes the independent Electricity System Operator (ESO). The UK Gas Transmission segment includes the high-pressure gas transmission networks in Great Britain and system operator in Great Britain. The US Regulated segment includes gas distribution networks, electricity distribution networks and high-voltage electricity transmission networks in New York and New England and electricity generation facilities in New York. The Company's transmission and distribution services include provision of electricity transmission and distribution services to customers and operation of electricity transmission facilities."
