,Instrument,Business Description
82,000333.SZ,"Midea Group Co., Ltd. is a China-based company principally engaged in the manufacture and distribution of household electronics. The Company's products are categorized into three types, including consumer appliances, heating ventilating and air conditioning (HAVC) and robot and automation systems. The Company’s products mainly consist of central air conditioning systems, heating and ventilation systems, kitchen appliances, refrigerators, washing machines and other small home appliances, such as water dispensers, water purifying devices, air purifiers, electric kettles, dust collectors and humidifiers. The Company is also involved in the production of motors, as well as logistics business. The Company distributes its products within domestic market and to overseas markets."
83,603087.SS,"Gan & Lee Pharmaceuticals Co Ltd is a company engaged in research and development, production and sales of insulin and related products. The Company's main products are insulin preparations and insulin dry powder, including Changxiulin recombinant insulin glargine injection and Suxiulin recombinant insulin lispro injection. It is also involved in the development and sales of a type of insulin pen called Xiulin Pen and the components. The Company provides early-stage franchising services by authorizing other companies to sell its insulin injections. The Company sells its products to both domestic and international markets, including Mexico and the Middle East."
84,603899.SS,"SHANGHAI M&G STATIONERY INC. is a China-based company mainly engaged in the research and development, design, manufacture and sales of writing instruments, student stationery and office stationery. The Company is also involved in the development of fine stationery experience centers, the provision of one-stop office service platforms, as well as the Internet and e-commerce platforms. The Company's writing instruments mainly include gel pens, ball-point pens, mechanical pencils, water-based pens, functional pens and brushes."
85,002594.SZ,"BYD COMPANY LIMITED is a China-based company principally engaged in the manufacture and sales of transportation equipment. The Company is also engaged in the manufacture and sales of electronic parts and components and electronic devices for daily use. The Company's products include rechargeable batteries and photovoltaic products, mobile phone parts and assembly, and automobiles and related products. The Company mainly conducts its businesses in China, the United States and Europe."
86,600036.SS,"China Merchants Bank Co., Ltd. (the Bank) is a China-based commercial bank. The Bank operates its businesses through three segments, which are Wholesale Finance segment, Retail Finance segment and Other segment. Wholesale Finance segment consists of savings and loans; settlement and cash management services; trade finance and offshore business; investment banking; interbank lending, buyback and other interbank business; asset custody business; financial market business and other businesses. Retail Finance segment includes savings and loans, bank card services, wealth management, private banking and other services. Other segment consists of investment real estates and the operations of the Company’s subsidiaries, affiliated companies and joint venture companies. The Company operates its business in domestic market and to overseas markets, with China as its main market."
87,600745.SS,"WINGTECH TECHNOLOGY CO., LTD, formerly JOIN-IN (HOLDING) CO.,LTD., is a China-based company principally engaged in the research, development and manufacture of mobile terminals and smart hardware products. The Company operates three business segments. The Electronic Equipment Manufacturing Business segment is mainly engaged in the research and manufacturing of mobile internet equipment products mainly based on smart phones. The Real Estate and Hotel Supporting Business segment is principally engaged in real estate development and operation, property management, hotel investment and hotel management. The Investment Management Business segment is principally engaged in investment management business. The Company's main products include mobile communication products and mobile communication equipment and commercial housing. The Company operates its businesses within the domestic market and to overseas markets."
88,000001.SZ,"Ping An Bank Co., Ltd. is a commercial bank offering financial services to both corporate and individual clients throughout China. The Company operates in five divisions: corporate banking, retail banking, interbank fund, investment banking and small business financing. It provides deposits, loans, settlement and exchange of local currency, acceptance and discount of local currency notes, trust, issuance and trading of local securities, trade/non-trade settlement business, issuance and acting issuance of foreign securities, deposit, remittance and trading business of foreign exchange, credit investigation, spot transaction, purchase and leasing of gold, as well as other services."
89,600352.SS,"Zhejiang Longsheng Group Co., Ltd is a China-based company, principally engaged in the research and development, manufacture and distribution of dye products. The Company's product portfolio consists of specialty chemical products and basic chemicals, including dye, addition agents, chemical intermediates, water reducing agents, as well as inorganic products and others. In addition, the Company is also engaged in the real estate business, as well as the provision of auto parts and development solutions. The Company distributes its products within domestic market and to overseas markets."
90,603806.SS,"Hangzhou First Applied Material Co., Ltd., formerly Hangzhou First PV Material Co., Ltd., is a China-based company principally engaged in the research, development, manufacture and distribution of photovoltaic packaging materials. The Company’s main products consist of ethylene/vinyl acetate (EVA) adhesive films, hot melt adhesive films, back panels, olefin films, solar power generation systems and hot melt films. The Company is also engaged in the photovoltaic power generation business, as well as providing textile materials and electronic materials. The Company distributes its products within domestic market and to overseas markets."
91,002027.SZ,"Focus Media Information Technology Co., Ltd. is a China-based company principally engaged in the development and operation of life circle media. The Company’s main products include building media, such as building video media and framework media, cinema screen advertising media and retail terminal video media, among others. The Company mainly operates its business in the domestic market."
92,603833.SS,"Oppein Home Group Inc is a China-based company principally engaged in the design, research, development, manufacture, sales and installation of customized home products. The Company's principal products include the complete kitchen cabinets, overall wardrobes, bathroom vanities and customized wood doors. The Company is also engaged in the retail of furniture, the wholesale of home appliances and the interior design businesses."
93,000069.SZ,"Shenzhen Overseas Chinese Town Co.,Ltd. is a China-based company principally engaged in integrated tourism business, real estate business and paper packaging business. The Company operates its integrated tourism business through the operation of scenic areas, hotel management and Internet tourism, among others. The Company operates its real estate business through the development and operation of residential housings and commercial properties, as well as property management. The Company operates its business in domestic market, with South China and East China as its main markets."
94,002821.SZ,"Asymchem Laboratories (Tian Jin) Co., Ltd. is a China-based company principally engaged in the provision of pharmaceutical outsourcing services. The Company provides pharmaceutical research and development services to their clients. Its products mainly include the medicines for hepatitis C virus, cystic fibrosis, prostatic cancer, myeloma, soft tissue sarcoma, leukemia, rare disease, as well as, cefotaxime , among others. The Company distributes its products within domestic market and to overseas markets, including North America, Europe, as well as Asia (except China Mainland)."
95,601618.SS,"Metallurgical Corporation of China Ltd. is a China-based company principally engaged in the engineering construction related businesses. The Company’s businesses mainly include the engineering contracting, real estate development, resources development and equipment manufacturing. The Company's engineering contracting businesses mainly include the metallurgical engineering, municipal engineering, transportation facilities and urban infrastructure construction, among others. Its real estate development businesses mainly include the development and construction of commercial and residential real estates. Its resource development businesses mainly include the mining and processing of iron, copper, nickel, lead and zinc, among others. Its equipment manufacturing businesses mainly include the manufacturing of metallurgical equipments and steel structures."
96,600588.SS,"Yonyou Network Technology Co., Ltd., formerly Yonyou Software Co., Ltd, is principally engaged in the development and distribution of software and related products. The Company provides enterprise resources planning (ERP) software, human resources management (HRM) software, office automation (OA) software, customer relationship management (CRM) software, product lifecycle management (PLM) software, product data management (PDM) software, collaborative product development (CPD) software, unified application platform (UAP) and enterprise asset management (EAM) products, among others. The Company is also involved in the provision of technical support and training services, as well as the distribution of software related products."
97,600926.SS,"BANK OF HANGZHOU CO., LTD. is a China-based regional commercial bank. The bank is principally engaged in the provision of banking and related financial services. The Bank is mainly operates through three segments. Its corporate banking business provides deposit and lending services, wealth management services, as well as settlement services, among others to enterprises. Its retail banking business provides loan, deposit, investment and financing, as well as bank card business to individuals. Its small and micro business includes mortgage, micro credit, as well as cash management. The Bank is also involved in the provision of credit card issuing, electronic banking, Internet banking, mobile phone banking and telephone banking services."
98,601077.SS,"Chongqing Rural Commercial Bank is engaged in the provision of banking services and related financial services in China. The Company operates its businesses through three segments. The Corporate Banking segment is engaged in the provision of financial products and services to corporations, government agencies and financial institutions. The Personal Banking segment is engaged in the provision of financial products and services to individual customers. The Financial Market Operations segment is engaged in the money market, repurchase transactions and debt instruments investment for its own account or on behalf of customers."
99,601658.SS,"POSTAL SAVINGS BANK OF CHINA CO., LTD. is involved in the provision of banking and related financial services in China. The Bank mainly operates four business segments. Personal Banking Business segment provides a wide range of products and services to individual customers, including Renminbi and foreign currency deposits, loans, bank cards and fee- and commission-based products and services. Corporate Banking Business segment provides diversified financial products and services for corporate banking customers, including corporate loans, discounted bills, corporate deposits, and fee- and commission-based products and services such as settlement, investment banking, custodian, corporate asset management and international trade finance. Treasury Business segment consists primarily of financial market business, including trading, investment, interbank financing and interbank bill rediscounting, as well as asset management business. The Bank also operates Other Business segment."
100,603517.SS,"Juewei Food Co Ltd is a China-based company principally engaged in the research, development, production and sales of marinating snack foods. The Company operates through three main segments. The Marinating Snack Foods segment is mainly engaged in the production and sales of marinating foods. The products can be divided into two categories, including marinating meat snack foods which are made from raw materials, such as duck meat, chicken and pork, as well as marinating vegan snack foods which are made from green soy beans, carrots and peanuts. The Franchisee Management segment is mainly engaged in the enterprise management and the provision of consulting services. The Others segment is primarily engaged in the container cleaning and provision of product packages, among others."
101,601238.SS,"Guangzhou Automobile Group Company Limited is an investment holding company principally engaged in vehicles and related businesses. The Company operates through five segments. The Research and Development (R&D) segment is engaged in the development of new products and new technology, as well as the implementation of R&D projects. The Manufacture segment is engaged in the manufacture of passenger vehicles and motorcycles. The Commercial Services segment is engaged in vehicle sales, logistics, international trading, second-hand vehicles, disassembling, resources recycling, as well as the provision of supporting services. The Parts and Components segment provides engines, gearboxes, car seats, auto lamps, automation accessories, redirectors, shock absorbers and accessories. The Financial segment provides financial investment, insurance, insurance broker, financial lease, automobile credit and other related services."
102,601318.SS,"Ping An Insurance (Group) Company of China, Ltd. is a personal financial services provider. The Company provides insurance, banking, investment, and Internet finance products and services. The Company operates its businesses through four segments. The Insurance segment provides life insurance and property insurance, including term, whole-life, endowment, annuity, automobile and health insurance. The Banking segment is engaged in loan and intermediary businesses with corporate customers and retail business. The Assets management segment is engaged in security, trust and other assets management businesses, including investment, brokerage, trading and asset management services. The Internet Financing segment is engaged in the provision of Internet finance products and services."
103,002602.SZ,"ZHEJIANG CENTURY HUATONG GROUP CO., LTD is a China-based company principally engaged in the development and operation of Internet games. The Company is also engaged in the research, development, manufacturing and sales of various types of automobile parts and related molds. The Company also provides copper rod processing parts. The Company distributes its products within domestic market."
104,000876.SZ,"NEW HOPE LIUHE CO.,LTD. is a China-based company principally engaged in the manufacture and distribution of feed and meat products, as well as the breeding, slaughtering and processing of livestock. The Company's main products include meat poultry feed, egg poultry feed, pig feed, aquatic feed, ruminant feed, piglets, chicks and ducklings, among others. The Company distributes its products in domestic market and to overseas markets."
105,002049.SZ,"Unigroup Guoxin Microelectronics Co., Ltd., formerly Unigroup Guoxin Co., Ltd., is a China-based company, principally engaged in the design and distribution of integrated circuits (ICs). The Company's IC products consist of smart card chips, special IC products and memory chips. In addition, the Company also engages in the development, manufacture and distribution of quartz crystal components. The Company distributes its products within domestic market and to overseas markets."
106,603019.SS,"Dawning Information Industry Co., Ltd. is a China-based company mainly engaged in the provision of information technology services. The Company's primary businesses include the research, development and manufacturing of high-performance computers, storage and related equipments, among others. The Company is also involved in the provision of software development, system integration and technical services."
107,600104.SS,"SAIC Motor Corporation Limited is a China-based company principally engaged in the research and development, manufacturing and distribution of whole vehicles and auto parts. The Company's main products include passenger cars, commercial vehicles, engines, gearboxes, power trains, chassis, interiors and exteriors, and automotive electronics, among others. The Company also involves in automobile services and trading and financial investment businesses. The Company operates it business in domestic markets and overseas markets."
108,600795.SS,"GD POWER DEVELOPMENT CO., LTD is a China-based company principally engaged in power generation and related businesses. The Company’s businesses include thermal power generation, hydroelectric generation, wind power generation and solar power generation, among others. The Company also sells thermal products, chemical products and coal products, among others. The Company mainly operates businesses in domestic market."
109,601933.SS,"YONGHUI SUPERSTORES CO., LTD. is a China-based company, principally engaged in the operation of regular chain supermarkets. The Company primarily engages in the dealing of fresh meat products, agricultural products, processed foods, daily necessities, clothing, household appliances, electronic products and imported goods, among others. The Company operates its businesses principally through the operation of general merchandise stores, superstores and supermarkets, among others. The Company is also engaged in the provision of related services. The Company mainly conducts its businesses within domestic markets."
110,002044.SZ,"Meinian Onehealth Healthcare Holdings Co.,Ltd, formerly JIANGSU SANYOU GROUP CO., LTD., is a China-based company principally engaged in the provision of physical examination and medical services. The Company mainly provides physical examination, health consultation, health assessment and medical services. The physical examination services of the Company include routine medical examination, early detection and screening for cancers and physical examination report interpretation. The Company mainly operates its businesses in domestic market."
111,600048.SS,"Poly Developments and Holdings Group Co Ltd, formerly POLY REAL ESTATE GROUP CO LTD, is a China-based company principally engaged in property development and distribution. The Company mainly develops and distributes commercial residential. The properties that the Company develops consist of residential buildings, office buildings, hotels, shopping malls, exhibition halls and leisure properties, among others. The Company is also involved in building design, engineering construction, agency sales, property management, business operations, exhibition services, health care, real estate finance and other industries. The Company operates its business mainly in domestic market."
112,600989.SS,"Ningxia Baofeng Energy Group Co Ltd is a China-based company mainly engaged in the production and sales of modern coal chemical products. The Company's main products include olefin products, coking products and fine chemical products. Olefin products mainly include polyethylene, polypropylene and olefin by-products. Coking products mainly include coke and coal coking by-products. Fine chemical products mainly include pure benzene, modified asphalt, industrial naphthalene, eucalyptus oil and MTBE. The Company mainly conducts its businesses in domestic market."
113,002945.SZ,"ChinaLin Securities Co., Ltd. is a China-based company which is mainly engaged in securities business. The Company's main business includes securities brokerage, securities investment consulting, financial advisors related to securities trading, securities investment, securities underwriting and sponsorship, self-operation of securities, securities investment fund agency, securities asset management, agency sales financial products, and margin financing and securities lending business. The Company mainly conducts business in China's domestic market."
114,600999.SS,"CHINA MERCHANTS SECURITIES CO., LTD is a China-based company, principally engaged in security businesses. The Company operates its businesses through brokerage and wealth management business, including stocks, funds, bonds and financial products trading; investment banking business, including equity financing, debt financing and structured financing; investment management business, including collective asset management, targeted asset management and special asset management, as well as investment and trading business, including equity securities and fixed income securities transactions. The Company is principally engaged in its businesses in Guangdong Province, Shanghai, Beijing and Hong Kong."
115,600050.SS,"China United Network Communications Limited is a China-based company principally engaged in the telecommunication industry. The Company operates business through Mobile Communication segment and Fixed Network segment. Mobile Communication segment provides global system for mobile communications (GSM) services and 3rd-generation (3G) services, among others. Fixed Network segment provides fixed network broadband and data communication services, traditional fixed network services and other services. The Company is also engaged in broadband and convergence businesses. The Company operates its business in domestic markets."
116,000963.SZ,"HUADONG MEDICINE CO., LTD is a China-based comprehensive pharmaceutical company. The Company is mainly engaged in the research and development of pharmaceuticals, the production and sales of chemical drugs, bulk drugs and preparations of traditional Chinese medicine, the distribution and retails of pharmaceuticals, medicine modern logistics, health industry, and the manufacturing and sales of medical beauty products. The Company's products principally include Chinese patent drugs, immunosuppressive agents, endocrine drugs, digestive system drugs, antineoplastic drugs, cardiovascular drugs and antibiotic drugs. The Company distributes its products in domestic market and to overseas markets."
117,600118.SS,"China Spacesat Co.,Ltd. is a China-based company principally engaged in the research, manufacture and application of satellites. The Company operates through two segments: Satellite Research and Manufacture and Satellite Application. Satellite Research and Manufacture segment mainly develops and produces minisatellites and microsatellites. Satellite Application segment is mainly engaged in the provision of satellite ground application system integration, equipment manufacture and satellite operation services. The Company operates its business in North China, northwest of China and South China."
118,601989.SS,"China Shipbuilding Industry Company Limited is a China-based company, principally engaged in the research and development, design and manufacture of ships. The Company is engaged in the manufacturing, repairing and refitting of ships. The Company also operates its businesses through ship equipment business, which offers low-speed diesel engines, high-power medium-speed diesel engines, propellers and deck machinery; ocean engineering, which provides drilling platform, energy and transportation equipment business, which provides railway trucks and wind power gearboxes, as well as scientific and technological industry business. The Company distributes its products within domestic market and to overseas markets."
119,600660.SS,"FUYAO GLASS INDUSTRY GROUP CO., LTD. is a China-based company, principally engaged in the manufacture and distribution of float glasses and automobile glasses. The Company's products portfolio consist of automobile glasses, such as coating glasses and others, which are applied in passenger cars, buses, limousines and others, and float glasses. The Company distributes its products within domestic markets and to overseas markets."
120,601985.SS,"China National Nuclear Power Co.,Ltd is principally engaged in the development, investment, construction, operation and management of nuclear power projects. The Company's main product is nuclear power. The Company also involves in the research of technology for nuclear power operation safely, as well as related technical services and consultation business. The Company operates its business in Zhejiang, Jiangsu, Fujian, Hainan and Liaoning provinces, China."
121,600025.SS,"Huaneng Lancang River Hydropower Inc. is a China-based company principally engaged in the development, investment, construction, operation and management of hydropower projects. The Company's main product is electrical energy. The Company operates its business in domestic market."
