,Instrument,Business Description
85,RMG.L,"Royal Mail plc provides postal services. The Company's segments include UK Parcels, International & Letters (UKPIL), General Logistics Systems (GLS) and Other. UKPIL operates in the United Kingdom collecting and delivering parcels and letters through approximately two main networks, the Royal Mail Core Network and Parcelforce Worldwide. UKPIL provides letter and parcel services to and from countries around the world under reciprocal arrangements with other overseas postal administrations. It is also responsible for the design and production of the United Kingdom's stamps and philatelic products. Parcelforce Worldwide is an express parcels business. The Company operates across a network of approximately 50 depots throughout the United Kingdom. GLS operates in continental Europe and the Republic of Ireland and has a ground-based deferred parcel delivery network in Europe. GLS provides parcel and express services, as well as logistics solutions."
86,BDEV.L,"Barratt Developments PLC is a holding company. The Company is principally engaged in acquiring and developing land, planning, designing and constructing residential property developments and selling the homes, which it builds throughout Britain. The Company operates in two segments: Housebuilding and Commercial developments. The Company’s brands include Barratt Homes, David Wilson Homes and Barratt London. Barratt Homes focuses on providing homes for first time buyers and families, offering a range of energy efficient properties across England, Scotland and Wales. Wilson Bowden Developments is the Company’s commercial development arm focused on retail, leisure, office, industrial and mixed-use schemes. The projects of Wilson Bowden Developments range from single sites to industrial developments, office parks and major town center regeneration project."
87,GLEN.L,"Glencore PLC is a Switzerland-based diversified natural resource company that produces and markets commodities. It operates through two business segments: Industrial segment, which is engaged in copper, zinc/lead, nickel, ferroalloys, alumina/aluminum, iron ore and silver production, as well as the Company has interests in industrial assets that include mining, smelting, refining and warehousing operations. This segment also includes coal mining and oil production operations and investments in strategic handling, storage and freight equipment and facilities; Marketing segment which is engaged in promotion and sale of produced goods worldwide."
88,VOD.L,"Vodafone Group Plc is a telecommunications company in Europe and Africa. The Company provides a range of mobile services, enabling customers to reliably call, text and access data. Its fixed-line services include broadband, television (TV) and voice. It operates mobile and fixed network in Europe and aslo provides Internet of Things (IoT) connectivity as well as security and insurance products. The Company's M-Pesa is an African payment platform that offers money transfer service. It also provides a range of financial services, as well as business and merchant payment services. It operates mobile and fixed networks in approximately 21 countries and partners with mobile networks in over 49 countries. The Company serves private and public sector customers, including automotive, health, banking finance, manufacturing, retail, transportation and utility. It offers a range of connectivity services, supported by its dedicated global network."
89,AVV.L,"AVEVA Group plc is a United Kingdom-based holding company, which provides operational industrial software, with engineering software. The Company operates through three segments: Americas; Asia Pacific; and Europe, Middle East and Africa (EMEA). Its Operations software orchestrates control, maintenance and production planning to produce finished goods or provide infrastructure for services such as power or water. Its Engineering software is used to design elements of process simulation, plant design and construction management. Its products include AVEVA Asset Information Management, AVEVA Engineering, AVEVA E3D Design, AVEVA Enterprise Resource Management, AVEVA Point Cloud Manager and AVEVA Process Simulation. It serves various industries, including chemicals, energy, food and beverage, infrastructure, manufacturing, power and utility, marine, mining, and water and wastewater."
90,BARC.L,"Barclays PLC is a holding company. The Company, through its subsidiaries, is a transatlantic consumer and wholesale bank with global reach offering products and services across personal, corporate and investment banking, credit cards and wealth management, anchored in the Company’s two home markets of the United Kingdom and the United States. The Company is organized into two business divisions: the Barclays UK division (Barclays UK) and the Barclays International division (Barclays International). Barclays UK offers everyday products and services to retail customers and small- to medium-sized enterprises based in the United Kingdom. Barclays UK is the ring-fenced bank for the United Kingdom, providing transactional, lending and investment products and services to Wealth and Business Banking customers and clients. Barclays International includes the corporate and Investment Bank, and Consumer, Cards and Payments."
91,RDSa.L,"The Royal Dutch Shell plc is a company based in the Netherlands that explores for crude oil and natural gas around the world, both in conventional fields and from sources, such as tight rock, shale and coal formations. Its segments include Integrated Gas, Upstream, Downstream and Corporate. The Integrated Gas segment is engaged in the liquefaction and transportation of gas and the conversion of natural gas to liquids to provide fuels and other products, as well as projects with an integrated activity, ranging from producing to commercializing gas. The Upstream segment includes the operations of Upstream, which is engaged in the exploration for and extraction of crude oil, natural gas and natural gas liquids, and the marketing and transportation of oil and gas, and Oil Sands, which is engaged in the extraction of bitumen from mined oil sands and conversion into synthetic crude oil. The Downstream segment is engaged in oil products and chemicals manufacturing, and marketing activities."
92,FERG.L,"Ferguson PLC is a distributor of plumbing and heating products to professional contractors. The Company's segments include USA and Canada. It serves the repair, maintenance and improvement (RMI) markets, and construction market. The Company's USA business units include Residential Showrooms, eBusiness, Heating, Ventilation and Air Conditioning (HVAC), Fire and Fabrication, Waterworks and Industrial. The Canada segment operates as a wholesale distributor of plumbing, heating, ventilation and air conditioning, refrigeration, waterworks, fire protection, pipes, valves and fittings and industrial products."
93,ICP.L,"Intermediate Capital Group PLC (ICG) is a United Kingdom-based global alternative asset manager. The Company is managing approximately 47.2 billion euros of assets in private debt, credit and equity, principally in closed-end funds. ICG operates across four asset classes: corporate, capital markets, real assets and secondary investments. The Company is organized into the Fund Management Company (FMC) and the Investment Company (IC) segments. Its subsidiaries include Intermediate Capital Investments Limited, Intermediate Finance II PLC, JOG Partners Limited1, Intermediate Investments Jersey Limited, ICG FMC Limited, Intermediate Capital Limited, ICG ASFL Limited, ICG-Longbow Development (Brighton) Limited, ICG Carbon Funding Limited, Intermediate Capital Hong Kong Limited, ICG Japan (Funding 2) Limited, LREC Partners Investments No.2 Limited, ICG Financing (Ireland) Limited, ICG Global Investment UK Limited and ICG-Longbow Richmond Limited."
94,BAES.L,"BAE Systems plc is a defense, aerospace and security company. The Company operates through five segments. The Electronic Systems segment consists of the Company's United States and United Kingdom-based electronics activities. The Cyber & Intelligence segment consists of its United States-based Intelligence & Security business and United Kingdom-based Applied Intelligence business, and covers the Company's cyber, secure government, and commercial and financial security activities. The Platforms & Services (US) segment, with operations in the United States, United Kingdom and Sweden, produces combat vehicles, weapons and munitions. Air segment comprises the Company’s United Kingdom-based air activities for European and international markets, and United States programmes, and its businesses in Saudi Arabia and Australia, together with its interest in the MBDA Holdings SAS (MBDA) joint venture. Maritime segment comprises the Company’s United Kingdom-based maritime and land activities."
95,DCC.L,"DCC PLC is an Ireland-based international sales, marketing and support service company. The Company is operating in approximately 20 countries, supplying products and services that are used every day. The Company operates through four segments: DCC LPG, DCC Retail & Oil, DCC Healthcare and DCC Technology. DCC LPG is engaged in liquefied petroleum gas (LPG) sales and marketing business with operations in Europe, Asia and the United States (US), and a business in the retailing of natural gas and electricity in Europe. DCC Retail & Oil is engaged in sales, marketing and retailing of transport and commercial fuels, heating oils and related products and services in Europe. DCC Healthcare division is focused on healthcare business, providing products and services to healthcare providers and health and beauty brand owners. DCC Technology is a route-to-market and supply chain partner for global technology brands."
96,ULVR.L,"Unilever PLC is a fast-moving consumer goods (FMCG) company. The Company's segments include Personal Care, which primarily includes sales of skin care and hair care products, deodorants and oral care products; Foods, which primarily includes sales of soups, bouillons, sauces, snacks, mayonnaise, salad dressings and margarines; Home Care, which primarily includes sales of home care products, such as powders, liquids and capsules, soap bars and a range of cleaning products, and Refreshment, which primarily includes sales of ice cream and tea-based beverages. The Company's geographical segments include Asia/AMET/RUB, The Americas and Europe. Its brands include Axe, Dirt is Good (Omo), Dove, Hellmann's, Knorr, Lipton, Lux, Magnum, Rexona, Sunsilk and Surf. The Company operates in more than 100 countries, selling its products in more than 190 countries. The Company operates approximately 310 factories in over 70 countries."
97,OCDO.L,"Ocado Group plc is a United Kingdom-based online grocery retailer. The Company's principal activities are grocery retailing and the development and monetization of Intellectual Property (IP) and technology used for the online retailing, logistics and distribution of grocery and consumer goods, derived from the United Kingdom. The Company offers end-to-end operating solution for online grocery retail based on technology and IP, suitable for operating its own retail business and those of its commercial partners. The Company's brands include Ocado, Ocado Smart Platform, Sizzle, Fetch and Fabled. Sizzle is a kitchen and dining store. The Company's Ocado Smart Platform is a solution for operating online retail businesses. The Company's Ocado Smart Platform combines its end-to-end software and technology systems with its physical fulfilment asset solution."
98,LSEG.L,"London Stock Exchange Group PLC (LSEG) is a global financial markets infrastructure provider. LSEG operates across three divisions. Data & Analytics division provides customers with information and data products, and includes real-time and non-real-time data, pricing and reference services and indices, delivered via various distribution channels, including data feeds and desktop solutions. Data & Analytics consists of Trading & Banking Solutions, Investment Solutions, Wealth Solutions, Customer and 3rd Party Risk Solutions, and Enterprise Data Solutions. FTSE Russell is a global multi-asset class provider of indices, analytics and data solutions. Capital Markets division provides access to capital for domestic and international businesses and electronic platforms for secondary market trading of equities, fixed income and FX. Post Trade division provides clearing, settlement and regulatory reporting services to support clients’ risk and balance sheet management and regulatory reporting."
99,TSCO.L,"Tesco PLC (Tesco) is a retail company. The Company is engaged in the business of Retailing and associated activities (Retail) and Retail banking and insurance services. The Company's segments include UK & ROI, which includes the United Kingdom and Republic of Ireland; Central Europe, which includes Czech Republic, Hungary, Slovakia, and Tesco Bank, which includes retail banking and insurance services through Tesco Bank in the United Kingdom. The Company's businesses include Tesco UK, Tesco Czech Republic, Tesco Hungary, Tesco Ireland, Tesco Slovakia, Tesco Bank and dunnhumby. The Company offers a range of personal banking products and services that include credit card receivables, personal current accounts and personal loans."
100,LGEN.L,"Legal & General Group Plc is a holding company. The Company, together with its subsidiaries, transacts life assurance and long-term savings business, investment management and general insurance and health business. The Company’s segments include: Legal & General Retirement (LGR), Legal & General Investment Management (LGIM), Legal & General Capital (LGC), Legal & General Insurance (LGI) and Savings. The Company operates its businesses in the United Kingdom, the United States and other countries across the world through its subsidiaries and associates. The Company offers products, including annuity contracts; longevity insurance contracts; lifetime mortgages; index fund management; active fixed income and liquidity management; solutions and liability driven investment (LDI); active equity; investment strategy and implementation; direct investments and structuring; pensions (individual and corporate); endowment policies, and participating contracts."
