,Instrument,Business Description
28,RKT.L,"Reckitt Benckiser Group plc is a manufacturer and marketer of health, hygiene, post-natal and home products. The Company's segments include ENA and DvM. The ENA segment consists of Europe, Russia/Commonwealth of Independent States (CIS), Israel, North America, Australia and New Zealand. The DvM segment consists of North Africa, Middle East (excluding Israel) and Turkey, Africa, South Asia, North Asia, Latin America, Japan, Korea and the Association of Southeast Asian Nations (ASEAN). Health, Hygiene, Home and Portfolio Brands categories are split across the geographical segments of ENA and DVM. Its range of hygiene products includes disinfectant cleaners, automatic dishwashing detergents, pest control, depilatory products and acne treatments. The Company's portfolio of brands includes Durex, Mucinex, Scholl, Strepsils, Cillit Bang, Clearasil, Dettol, Harpic, Lysol, Mortein, Veet, Air Wick, Calgon, Queen V, Vanish and Woolite."
29,SKG.L,"Smurfit Kappa Group plc is a provider of paper-based packaging products. The Company manufactures, distributes and sells containerboard, corrugated containers and other paper-based packaging products. It operates through two segments: Europe and the Americas. The Europe segment includes a system of mills and plants that produces a line of containerboard that is converted into corrugates containers. In addition, to other types of paper-based packaging and bag-in-box operations. The Americas segment, which includes forestry and other types of paper, such as boxboard, sack paper and graphic paper, and paper-based packaging, such as folding cartons and paper sacks."
30,MRON.L,"Melrose Industries PLC is a United Kingdom-based company focused on acquiring manufacturing businesses. Its segments include Aerospace, a multi-technology supplier of both civil and defense air frame and engine structures; Automotive, which designs, develops, manufactures and integrates a range of driveline technologies, including electric vehicle components; Powder Metallurgy, which provides precision powder metal parts for the automotive and industrial sectors, as well as the production of powder metal, and Other Industrial, includes Nortek Control and Ergotron. Its Nortek Control is a developer and manufacturer of security, home automation, access control, health and artificial intelligence technologies for the residential and commercial markets, principally in North America. Its Ergotron is a designer, manufacturer and distributor of ergonomic products for use in a range of working, learning and healthcare environments."
31,BHPB.L,"BHP Group PLC, formerly BHP Billiton Plc, is a global resources company. The Company is a producer of various commodities, including iron ore, metallurgical coal, copper and uranium. Its segments include Petroleum, Copper, Iron Ore and Coal. The Petroleum segment is engaged in the exploration, development and production of oil and gas. The Copper segment is engaged in mining of copper, silver, lead, zinc, molybdenum, uranium and gold. The Iron Ore segment is engaged in mining of iron ore. The Coal segment is engaged in mining of metallurgical coal and thermal (energy) coal. Its businesses include Minerals Australia, Minerals Americas, Petroleum and Marketing. It extracts and processes minerals, oil and gas from its production operations located primarily in Australia and the Americas. It manages product distribution through its global logistics chain, including freight and pipeline transportation."
32,CPG.L,"Compass Group PLC provides food and support services. The Company's segments include North America, Europe, Rest of World and Central activities. The Europe segment includes Turkey and Russia. The Rest of World segment includes Japan. The Company delivers services in sectors, including business and industry; healthcare and seniors; education; defense, offshore and remote, and sports and leisure. The Company offers its services to customers in the workplace, schools and colleges, hospitals, at leisure and in remote environments. It provides breakfasts, lunches and dinners, and also offers hospitality services. The Company offers a range of support services, including cleaning, building operations and maintenance, business and office services, logistics and transport, outdoor, project management and security. Its foodservice offerings under healthcare and seniors sector include patient feeding, retail food courts, hospitality catering, vending, retail shops and staff restaurants."
33,AUTOA.L,"Auto Trader Group PLC is a United Kingdom-based company that offers a digital automotive marketplace. The Company’s platform offers consumers a selection of new and used car listings, enabling them to search from the marketplace. It also offers free car valuations and a variety of motoring services and advice to consumers. It offers a finance search tool, which allows consumers to search by monthly budget. The Company offers a range of products and services to its retailer customers. It offers data intelligence solutions, such as Retail Accelerator and Retail Check, enabling retailers to buy the right stock, at the right price. Its platform enables manufacturers to advertise to the car buying audience. The Company uses its data management platform (DMP) to develop targeted audience segments for advertising and give manufacturers a proposition to reach new car buyers."
34,AV.L,"Aviva plc is a United Kingdom-based holding company. The Company provides savings, retirement and insurance products and services. The Company's products and services comprises of long-term business, general insurance and health, fund management. The Company's segments include UK & Ireland Life, UK & Ireland General Insurance, Canada General Insurance, and Aviva Investors. The UK & Ireland Life segment's principal activities are life insurance, long-term health and accident insurance, savings, pensions and annuity business. The UK & Ireland General Insurance segment is principally engaged in providing insurance cover to individuals and businesses. The Canada General Insurance segment provides personal and commercial insurance products. The Aviva Investors manages policyholders' and shareholders' invested funds, provides investment management services for institutional pension fund mandates and manages a range of retail investment products."
35,ENT.L,"Entain plc, formerly GVC Holdings PLC, is a United Kingdom-based sports betting and gaming company. The Company offer sports betting, casino, poker and bingo gaming solutions via its technology platform. The Company operates in five operating segments: Online, UK Retail, European Retail, Corporate and Other segment. Its Online segment comprises betting and gaming activities from online and mobile operations. Its sports brands include bwin, Coral, Crystalbet, Eurobet, Ladbrokes and Sportingbet; and gaming brands include CasinoClub, Foxy Bingo, Gala, Gioco Digitale, partypoker and PartyCasino. Its UK Retail segment comprises betting activities in the shop estate in Great Britain, Northern Ireland and Jersey; European Retail segment comprises of all retail activities connected with the Republic of Ireland, Belgium, Italy and Spain shop estates; Other segments: includes activities primarily related to telephone betting, Stadia, Betdaq, on course pitches and Intertrader."
36,DGE.L,"Diageo PLC is an alcoholic beverage company. The Company operates in various categories, including spirits and beer. Its geographic segments include North America; Europe, Russia and Turkey; Africa; Latin America and Caribbean, and Asia Pacific. Its principal products include Scotch whisky, Gin, Vodka, Rum, Beer, Irish Cream Liqueur, Wine, Raki, Tequila, Canadian Whisky, American Whiskey, Progressive Adult Beverages, Cachaca, Brandy and Ready to Drink. It manages its operations from various locations, including the United Kingdom; Ireland; Italy; Turkey; the United States; Canada; Brazil; Mexico; Australia; Singapore; India; Nigeria; South Africa; East Africa, and Africa Regional Markets. It also produces a range of ready to drink products mainly in the United Kingdom, Italy, South Africa, Australia, the United States and Canada."
37,INF.L,"Informa PLC is an international event, intelligence and scholarly research company. The Company operates through five divisions: Informa Connect, Informa Intelligence, Informa Markets, Informa Tech, and Taylor & Francis. Informa Connect is the Company’s content and connectivity business, organizing content-driven events, training and programs that provide a platform for professional communities to meet, network and share knowledge. Informa Intelligence provides specialist data, intelligence and insight to businesses. Informa Markets create platforms for industries and specialist markets. Informa Tech informs, educates and connects specialist technology communities around the world. Taylor & Francis publishes peer-reviewed scholarly research and specialist reference-led academic content across subjects within humanities & social sciences and science, technology and medicine."
38,UU.L,"United Utilities Group PLC is a water and wastewater company. The Company, through its subsidiary, United Utilities Water Limited (United Utilities Water), manages the regulated water and wastewater network in the North West of England, providing services to around seven million people and businesses. It owns over 56,000 hectares of land around its reservoirs. It collects water from the environment, clean and distributes it to its customers before collecting it, treating it, and then returning it back to the environment. The Company has produced approximately 173 Gigawatt hours (GWh) of renewable energy through sludge treatment centers and solar installations. It delivers approximately 1,700 million liters of clean drinking water to its customers every day through over 42,000 kilometers of water pipes. United Utilities Water holds licenses to provide water and wastewater services in the North West of England."
39,PSHP.L,"Pershing Square Holdings, Ltd is a Guernsey-based investment holding company structured as a closed-ended fund. The Company seeks to achieve its investment objective through long and occasionally short investment positions in equity or debt securities of United States (U.S.) and non-U.S. issuers, including securities convertible into equity debt securities, derivative instruments and any other financial instruments. Pershing Square Capital Management, L.P is the Company's investment manager."
40,WTB.L,"Whitbread PLC is a United Kingdom-based company, which owns and operates hotels and restaurants. The Company is organized into a single business segment, Premier Inn. Premier Inn provides services in relation to accommodation and food both in the United Kingdom and internationally. The Company's restaurant brands include Beefeater, Brewers Fayre, Table Table, Cookhouse & Pub, Bar + Block, Premier Inn, hub and Thyme. The Company operates over 800 Premier Inn hotels and over 80,000 rooms across the United Kingdom. Its subsidiaries include Whitbread Group PLC, Premier Inn Hotels Limited, Premier Inn Kier Limited, Silk Street Hotels Limited, Elm Hotel Holdings Limited, Brickwoods Limited, Duttons Brewery Limited, and Silk Street Hotels Limited."
41,PRU.L,"Prudential Public Limited Company (Prudential) is an international financial services company. The Company provides life and health insurance and asset management, with a focus on Asia and Africa. It protects people’s wealth, help them grow their assets, and allow them to save for their goals. The Company’s business has life customers in Asia and Africa. It supports communities through investment in business and infrastructure, tax revenues and community support activities. It creates financial benefits for its investors and deliver economic and social benefits for its customers, employees and the societies in which it operates. It operates its businesses across Asia, Africa and United States. In Asia, it serves the protection and investment needs of the middle class in Asia. In Africa, it provides savings, health and protection solutions to customers. In United States, the Company provides asset accumulation and retirement income products to United States retirees."
42,IMB.L,"Imperial Brands PLC is a fast-moving consumer goods company. It offers a range of cigarettes, fine cut and smokeless tobaccos and papers. The Tobacco & NGP business comprises the manufacture, marketing, and sale of Tobacco & NGP and Tobacco & NGP-related products, including sales to the Distribution business. The Distribution business comprises the distribution of Tobacco & NGP products for Tobacco & NGP product manufacturers, including Imperial Brands, as well as a range of non-Tobacco & NGP products and services. Its reportable segments are Europe, the Americas, Africa, Asia & Australasia (AAA) and Distribution. Its Europe segment, it covers markets including the United Kingdom, Germany, Spain, France, Italy, Greece, Sweden, Norway, Belgium, Netherlands, Ukraine, and Poland. Americas segment includes the United States and Canada. Its AAA segment includes Australia, Japan, Russia, Saudi Arabia, Taiwan and its African markets including Algeria and Morocco."
43,EXPN.L,"Experian PLC is a Jersey-based global information services company. The Company provides business-to-business data, decision and consumer services. It builds and manages comprehensive databases containing the credit activity and repayment histories of millions of consumers and businesses. Organizations analyze and use this information to make decisions about lending and the terms on which to lend. It creates credit information databases and other information, including clients’ own data, to develop predictive tools, sophisticated software and platforms. It also provides credit education and identity monitoring services to its consumers including free access to their credit report and score, and useful online educational tools. The Company's online recovery portal, allows consumers see all their own past-due debts in one place, and negotiate more achievable repayment plans with lenders."
44,BRBY.L,"Burberry Group plc (Burberry) is a global luxury goods manufacturer, retailer and wholesaler. The Company also licenses third parties to manufacture and distribute products using the Burberry trademarks. The Company's segments include retail/wholesale and licensing. The Retail/wholesale segment is engaged in the sale of luxury goods through Burberry mainline stores, concessions, outlets and digital commerce as well as Burberry franchisees, department stores globally and multi-brand specialty accounts. The flow of global product between retail and wholesale channels and across its regions is monitored and optimized at a corporate level and implemented via the Company's inventory hubs situated in Europe and the United States. The Licensing segment generates revenue through the receipt of royalties from global licensees of beauty products, eyewear and from licenses relating to the use of non-Burberry trademarks in Japan."
45,ABDN.L,"abrdn plc, formerly Standard Life Aberdeen plc, is a United Kingdom-based global investment company. The Company operates in three segments, which includes Investments, Advisor and Personal segments. The Company’s Investment segment provides solutions across markets, asset classes and investment strategies through working with the clients. Its Advisor segment offer platform technology and tools that enable wealth managers and financial advisers to look after the needs of their clients. The Company’s personal segment offers financial planning, digital direct-to-consumer services and discretionary fund management services, which helps people to plan for their financial future."
46,GSK.L,"GlaxoSmithKline PLC is a global healthcare company. The Company operates through two segments: Pharmaceuticals and Vaccines. The Company focuses on its research across six areas: Respiratory diseases, human immunodeficiency virus (HIV)/infectious diseases, Vaccines, Immuno-inflammation, Oncology and Rare diseases. The Company makes a range of prescription medicines and vaccines products. The Pharmaceuticals business discovers, develops and commercializes medicines to treat a range of acute and chronic diseases. The Vaccines business provides vaccines for people of all ages from babies and adolescents to adults and older people. It has a portfolio of medicines in respiratory and HIV. Its Pharmaceuticals business includes Respiratory, HIV, Specialty products, and Classic and Established products. Its Vaccines business has a portfolio of over 40 pediatric, adolescent, adult, older people and travel vaccines."
47,LAND.L,"Land Securities Group PLC is a holding company that buys, sells and manages commercial properties. The Company’s segments include Central London, Regional retail, Urban opportunities and Subscale sectors. The Central London segment includes all assets geographically located within central London. Regional retail includes all regional shopping centers and shops outside London and its outlets. The Urban opportunities segment engaged in capital investment business. The Subscale sectors consist of leisure and hotel assets and retail parks. The Company’s property types include leisure, retail, retail parks, shopping centers and workspace. The Company’s properties include Brighton Marina, Brighton; Cardinal Place, London SW1; Bluewater, Greenhithe and 123 Victoria Street, London SW1."
48,BP.L,"BP p.l.c. is engaged in the global energy business with operations in Europe, North and South America, Australasia, Asia and Africa. The Company provides customers with fuel for transport, energy for heat and light, power for industry, and the petrochemicals products used to make everyday items such as paints, clothes and packaging. The Company's segments include Upstream, Downstream, Rosneft, and Other businesses and corporate. The Upstream segment is responsible for its activities in oil and natural gas exploration, field development and production. The Downstream segment has global marketing and manufacturing operations, and include the fuels, lubricants and petrochemicals business of the Company. Rosneft is the Company's Russian refining business that owns and operates approximately 13 refineries in Russia, and holds stakes in three refineries in Germany, one in India and one in Belarus."
49,JD.L,"JD Sports Fashion Plc is a United Kingdom-based sports fashion and multichannel retailer of branded sports and casual wear, combining global brands such as Nike, adidas, Puma and The North Face, with own brand labels such as Pink Soda and Supply & Demand. Its segments are Sports Fashion and Outdoor. The Company's sports fashion brands include JD, Size?, Footpatrol, Finish Line, Shorpalaca, DTLR Villa, Livestock, Sprinter, Sports Zone, Chausport, Sizeer, JD Gyms, Tessuti, Scotts and Mainline. Its outdoor brands include Blacks, Millets, Ultimate Outdoors, Tiso, Go Outdoors, Go Fishing and Naylors. Chausport operates throughout France retailing international footwear brands, such as Adidas, Nike, and Timberland. Sprinter is a sports retailer in Spain selling footwear, apparel, accessories, and equipment for a range of sports, as well as lifestyle casual wear and childrenswear. Blacks is a retailer of specialist outdoor apparel, footwear and equipment."
50,ABF.L,"Associated British Foods plc is an international food, ingredients and retail company. Its segments include grocery, sugar, agriculture, ingredients and retail. The grocery segment manufactures products, including hot beverages, sugar and sweeteners, vegetable oils, balsamic vinegars, bread and baked goods, cereals, ethnic foods, and meat products, which are sold to retail, wholesale and foodservice businesses. The sugar segment is engaged in growing and processing of sugar beet and sugar cane for sale to industrial users and to Silver Spoon, which is included in the Grocery segment. The agriculture segment manufactures of animal feeds and the provision of other products and services for the agriculture sector. The ingredients segment is manufactures of bakers’ yeast, bakery ingredients, enzymes, lipids, yeast extracts and cereal specialties. The retail segment is engaged in buying and merchandising value clothing and accessories through the Primark and Penney's retail chains."
51,AAL.L,"Anglo American PLC is a United Kingdom-based mining company. The Company has a portfolio of mining operations and undeveloped resources with a focus on diamonds, copper, platinum group metals (PGMs), iron ore, nickel and manganese. The Company's segments include De Beers, Platinum Group Metals, Copper, Iron Ore, Nickel and Manganese, Crop Nutrients and Corporate and other. De Beers segment is engaged in the diamond business, which offers rough and polished diamonds. Its Platinum Group Metals products include platinum, palladium, rhodium, iridium, ruthenium and osmium. PGMs projects are located in the Bushveld Complex in South Africa. It holds interests in two copper mines: Los Bronces and Collahuasi in Chile and is developing the Quellaveco mine in Peru. Its iron ore operations provide customers with iron content ore through assets in Brazil and South Africa."
52,ADML.L,"Admiral Group plc is a United Kingdom-based financial services company. The Company is engaged in offering motor insurance, household insurance, travel insurance and lending products. The Company has four segments: UK Insurance, International Insurance, Admiral Loans and other. The UK Insurance segment consists of the underwriting of car insurance, van insurance, household insurance, travel insurance and other products that supplement insurance policy within the United Kingdom. The International Insurance segment consists of the underwriting of car and home insurance and the generation of revenue from additional products, and fees from underwriting car insurance outside of the United Kingdom. The Admiral Loans segment provides unsecured personal loans and car finance products in the United Kingdom. The Other segment includes compare.com, the US comparison business, and Admiral Pioneer."
53,RTO.L,"Rentokil Initial plc is a commercial pest control company. The Company is engaged in the provision of route-based services, which protect people and enhance lives. The Company's segments include Europe, UK & Rest of World, Asia, North America, Pacific, and Central and regional. The Company's business categories include Pest Control, Hygiene, Workwear and Other. The Company offers a range of pest control services from rodents to flying and crawling insects, to other forms of wildlife management. Initial Hygiene is the Company's hygiene services business. Workwear provides workwear in Europe. The Company also provides a range of other specialist services, including plants, medical services, property care and specialist hygiene. The Company is engaged in the supply and maintenance of garments, such as workwear and personal protective equipment, throughout Europe. The Company also offers a specialist cleanroom service for the pharmaceutical and healthcare sectors."
54,RMV.L,"Rightmove plc (Rightmove) is a United Kingdom-based company, which operates as a property portal. The Company's principal business is the operation of the rightmove.co.uk Website. The Company's segments include Agency, New Homes and Other. The Agency segment provides resale and lettings property advertising services on Rightmove’s platforms. The New Homes segment provides property advertising services to new home developers and housing associations on Rightmove’s platforms. The Other segment consists of overseas and commercial property advertising services and non-property advertising services, which include its third-party and consumer services, as well as data and valuation services. The Company offers its services through estate agents, lettings agents, new homes developers and overseas homes agents offering properties outside the United Kingdom but interested in advertising to the United Kingdom-based home hunters."
55,SBRY.L,"J Sainsbury PLC is a United Kingdom-based merchandise retailer company. The Company operates through two segments includes: Retail and Financial Services. The Retail segment is engaged in the operation of supermarkets and convenience. The Financial services segment includes the operations of Sainsbury's Bank plc (Sainsbury's Bank). The Company’s brands include Sainsbury’s groceries, Argos, Tu, Sainsbury’s Home, Sainsbury’s Bank and Habitat. The Company offers range of locally tailored products and services across food, beauty, clothing, seasonal and general merchandise. It also offers groceries under various categories, such as fruit and veg, meat and fish, dairy, chilled, bakery, frozen, food cupboard, drinks, health and beauty, baby, household, pet, and home. The Company has over 600 supermarkets and over 800 convenience stores."
