,Instrument,Business Description
151,6098.T,"Recruit Holdings Co., Ltd. is a Japan-based holding company engaged in the provision of recruitment advertising, sales promotion and staffing services. The Company operates in three business segments. The Human Resources (HR) Technology segment consists of the online job information specialized search Website Indeed, the online job advertisement and corporate information Website Glassdoor and supports the user's job search and recruitment activities. The Media & Solutions segment consists of sales promotion area and human resources area. In the sales promotion area, the Company provides services and improve management and business efficiency in the housing, marriage, travel, food and drink, as well as beauty fields. In the area of human resources, the Company provides services that support user job search activities and client recruiting activities using the Company's media. The Staffing segment consists of the domestic dispatching area and the overseas dispatching area."
152,8308.T,"Resona Holdings, Inc. is a Japan-based company mainly engaged in the provision of financial service. The Company operates in four business segments. The Individual segment focuses on the provision of consulting service related to personal loans, asset management and asset succession. The Corporate segment focuses on loans for corporate, asset management utilizing trust, real estate business, corporate pension, business succession, and support of business growth. The Market segment is engaged in the procurement and operation of funds, foreign exchange, bonds and derivatives through financial markets. The Kansai Mirai Financial Group segment engages in banking business, including deposit business and lending business in the Kansai region."
153,7752.T,"RICOH COMPANY,LTD. is engaged in development, production and sale of office printers, commercial printers and other devices. The Company operates in six business segments. The Office Printing segment provides maintenance services and related consumables for multifunction devices, copiers, printers, and other devices. The Office Service segment provides personal computers, servers, network-related equipment, related services and support. The Commercial Printing segment provides customers with products and services related to digital printing. The Industrial Printing segment is engaged in manufacture and sale of inkjet heads, imaging systems, industrial printers, and others. The Thermal segment is engaged in manufacture and sale of thermal paper and thermal transfer ribbons. The Others segment is engaged in providing industrial optical parts modules, electrical equipment units and digital cameras."
154,2501.T,"SAPPORO HOLDINGS LIMITED is a Japan-based company mainly engaged in the liquor business, the food and beverages business, the restaurants business and the real estate business. The Company operates in five segments. The Domestic Liquor segment is engaged in the manufacture and sale of beer, low-malt beer, wine and other alcoholic beverages in domestic market. The Overseas segment is engaged in the manufacture and sale of alcoholic beverages and soft drinks in overseas markets. The Food and Beverage segment is engaged in the manufacture and sale of drinking water and food products. The Restaurants segment is engaged in the operation of various restaurants. The Real Estate segment is engaged in the real estate leasing business. The Company is also engaged in the manufacture and sale of food."
155,7735.T,"SCREEN Holdings Co.,Ltd. is a Japan-based company mainly engaged in the manufacture and sale of semiconductor manufacturing equipment. The Company has four business segments. The Semiconductor Manufacturing Equipment (SE) segment is engaged in the development, manufacture, sale and maintenance of semiconductor manufacturing equipment. The Graphics and Arts Equipment (GA) segment is engaged in the development, manufacture, sale and maintenance of printing related equipment. The Display Manufacturing Equipment and Film Forming Equipment (FT) segment is engaged in the development, manufacture, sale and maintenance of display manufacturing equipment and film forming equipment. The Printed Circuit Board related Equipment (PE) segment is engaged in the development, manufacture, sale and maintenance of printed circuit board related equipment. The Company is also engaged in the provision of life science equipment, in-vehicle component inspection equipment, software and printed products."
156,9735.T,"SECOM CO., LTD. is a Japan-based company mainly engaged in the provision of security services. The Company has six business segments. The Security Service segment is engaged in the provision of comprehensive security services for business offices and homes. The Disaster Prevention segment is engaged in the provision of disaster prevention systems such as automatic fire alarm equipment and fire extinguishing equipment. The Medical Service segment is engaged in the provision of home medical services, and the sale of medical devices. The Insurance segment is engaged in the development and sale of insurance products. The Geographical Information Service segment is engaged in the provision of geospatial information services. The Business Process Outsourcing (BPO) and Information and Communications Technology (ICT) segment is engaged in the provision of information security services, BPO services and other services. The Company is also engaged in the real estate business."
157,6724.T,"SEIKO EPSON CORPORATION is a Japan-based company engaged in the printing solutions business, visual communication business, as well as wearable and industrial products business. The Company has three business segments. The Printing Solutions segment is engaged in the provision of printer products such as inkjet printers, page printers and color image scanners, as well as professional printing products such as industrial inkjet printers and label printers. The Visual Communication segment is engaged in the provision of liquid crystal projectors, high temperature polysilicon thin-film-transistor (TFT) liquid crystal panels and smart glasses. The Wearable and Industrial Products segment is engaged in the provision of wearable devices such as watches and sensing devices, robotics solutions products such as industrial robots and integrated circuit (IC) handlers, as well as microdevices such as crystal devices and semiconductors. The Company is also engaged in the group services business."
158,1928.T,"Sekisui House Ltd is a Japan-based company engaged in the design, construction and contracting of industrialized housing and related business. It operates through eight business segments. The Real Estate Fee segment performs subleasing, management, operation and brokerage of real estate. The Rental Housing segment designs, constructs and contracts rental housing and medical and nursing facilities. The Detached House segment designs, constructs and contracts detached houses. The International segment sells detached houses, condominiums and residential land, as well as develops and sells condominiums and commercial facilities. The Urban Redevelopment segment develops office buildings and commercial facilities and manages and operates owned real estate. The Condominium Housing segment is engaged in the design, construction and contracting of houses. The Renovation segment expands and renovates houses. The Condominium segment sells condominiums. It also operates the exterior business."
159,3382.T,"Seven & i Holdings Co Ltd is a Japan-based company mainly engaged in the distribution business. The Company operates in seven business segments. The Domestic Convenience Store segment is engaged in the convenience store business based on direct management and franchise systems, such as the operation of 7-Eleven stores in Japan. The Overseas Convenience Store segment is engaged in the operation of convenience stores, such as 7-Eleven overseas. The Superstore segment is a retail business that provides food, daily necessities and other items necessary for daily life. The Department Store segment is engaged in the retail business. The Finance-Related segment is involved in the banking, credit card business and leasing business. The Specialty Store segment is engaged in the retail business that provides specialized and distinctive products and services. The Others segment is involved in the real estate business."
160,6753.T,"Sharp Corp is a Japan-based company mainly engaged in the manufacture and sale of telecommunications equipment, electrical equipment and components. It operates through three business segments. The 8K Ecosystem segment provides Blu-ray disc recorders, audio, display modules, in-vehicle cameras, digital multifunction machines, information displays, business projectors, point-of-sale (POS) system equipment, factory automation (FA) equipment. The Smart Life segment provides refrigerators, superheated steam ovens, microwave ovens, small cooking equipment, air conditioners, washing machines, vacuum cleaners, air purifiers, electric fans, dehumidifiers, humidifiers, electric heating equipment, plasma cluster ion generators, electronic dictionaries, calculators, telephones, network control units, solar cells, storage batteries, camera modules, sensor modules, proximity sensors. The Information and Communication Technology (ICT) segment provides mobile phones, personal computers and others."
161,1803.T,"SHIMIZU CORPORATION is a Japan-based company mainly engaged in the construction business. The Company operates in two business segments: Construction segment and Investment Development segment. The Company is involved in architecture, civil engineering, overseas construction, real estate development, engineering, life cycle valuation (LCV), and frontier business. The Company is also involved in the sale and leasing of construction materials and equipment, as well as the construction, maintenance, management of public facilities."
162,4063.T,"Shin-Etsu Chemical Co., Ltd. is a Japan-based company primarily engaged in chemical business. The Company operates in six business segments. The Poly Vinyl Chloride and Chemicals segment manufactures and sells vinyl chloride, caustic soda products, chloromethane and methanol. The Silicone segment manufactures and sells Silicone products. The Functional Chemicals segment manufactures and sells cellulose derivatives, metal silicon, poval and synthetic sex pheromone. The Semiconductor Silicon segment manufactures and sells semiconductor silicon products. The Electronic and Functional Materials segment manufactures and sells rare earth magnet, packaging materials for Light Emitting Diode (LED), photoresists, mask blanks, synthetic quartz products, liquid fluoroelastomer and pellicle. The Process, Commercial and Technology Service segment provides resin processed products, exports technology and plant and others."
163,8303.T,"Shinsei Bank, Limited is a Japan-based bank, mainly engaged in the provision of financial products and services. The Company operates in four business segments. The Corporate segment provides various financial products and services to businesses and public companies, credit trading-related financial products and services, asset backed investment, and advisory service, among others. The Financial Market segment provides financial products and services to financial companies, and foreign exchange, derivatives, equity-related and other capital market businesses, as well as alternative investment, wealth management. The Personal segment provides personal financial trading business and service, consumer loan, special credit purchase mediation, credit card, credit guarantee, financing, collection agency services and consumer financing. The Other segment is engaged in asset liability management (ALM) business and financial arrangement business."
164,4507.T,"Shionogi & Co., Ltd. is a Japan-based pharmaceutical company mainly engaged in the research, development, purchase, manufacture and sale of pharmaceuticals, as well as pharmaceutical-related businesses. The prescription drug business is engaged in the development of eight new drugs including hypercholesterolemia treatment drugs Crestor, antihypertensive drugs Ilbetan Family (Irbetan, Aimix, Iltra) and antidepressant drugs Sinbalta. The Company is engaged in the provision of information to contribute to medical care by maximizing its products. The over-the-counter (OTC) pharmaceutical business handles products tailored to customers' lifestyles. The in-vitro diagnostics business is engaged in the sale of products, as well as the provision of information on infectious diseases, cardiovascular diseases and allergic diseases. The Company mainly provides its products and services in Japan, Europe and North America markets."
165,4911.T,"Shiseido Co Ltd is a Japan-based company engaged in the manufacture and sale of cosmetics, toiletries, personal care products, barber and beauty products. The Company operates in seven business segments. Japan segment sells of cosmetics, toiletries, personal care products, beauty food and over-the-counter drugs in Japan. China segment and Asia Pacific segment manufacture and sell cosmetics, toiletries and personal care products respectively in China and Asia-Oceania region excluding Japan and China. Americas and Europe segment manufacture and sell cosmetics and toiletries respectively in the Americas, as well as Europe & the Middle East & Africa. Travel Retail segment sells cosmetics and toiletries in duty free shops around the world except Japan. Professional segment sells barber and beauty products. The Company also conducts the frontier science business of cosmetic raw materials and medical drugs, as well as the food and beverage business and personal care product sales business."
166,8355.T,"THE SHIZUOKA BANK, LTD. is a Japan-based regional bank mainly engaged in the banking, leasing and financial services business. The Bank is mainly engaged in the banking business, worker dispatching and finance related business, real estate appraisement and research business, as well as the integrated processing of foreign exchange transmission and expense collection. The Bank is also engaged in the leasing and financial instruments exchange business, management consulting business, payment collection business, computer related business, calculation contracting business, credit guarantee business, credit card business, public offering support business, small and medium sized enterprise revitalization support business, investment management business, investment trust sales business, and the acquisition of monetary claims."
167,4004.T,"Showa Denko K.K. is a Japan-based comprehensive chemical company. The Company operates in six business segments. The Petrochemical segment is engaged in the manufacture and sale of olefins, organic chemicals and synthetic resins. The Chemicals segment is engaged in the manufacture and sale of functional chemicals, industrial gases, basic chemicals and information electronics chemicals. The Electronics segment is engaged in the manufacture and sale of hard disks, compound semiconductors, rare earth magnet alloys, lithium-ion battery materials. The Inorganic Materials segment is engaged in the manufacture and sale of graphite electrodes, ceramics and fine ceramics. The Aluminum segment is engaged in the manufacture and sale of high-purity foils for condensers, cylinders for laser beam printers, extruded products, forged products, heat exchangers, beverage cans. The Others segment is engaged in the manufacture and wholesale of construction materials."
168,8316.T,"Sumitomo Mitsui Financial Group, Inc. is a Japan-based company engaged in the commercial banking, leasing, securities and consumer finance business. The Company has five business segments. The Wholesale segment is engaged in the banking, leasing and securities business, as well as the venture capital business and management consulting services business for domestic large companies. The Retail segment is engaged in the banking, securities, credit cards and consumer finance business, as well as pension management business for domestic individuals and small corporate customers. The International segment is engaged in the banking, leasing and securities business, as well as swap-related business for overseas Japanese and non-Japanese companies. The Market segment is engaged in the banking, securities and other financial markets related businesses. The Head Office Management segment is engaged in the system development, information processing, investment management and other businesses."
169,8309.T,"Sumitomo Mitsui Trust Holdings Inc is a Japan-based company mainly engaged in the financial-related business. The Company operates through seven business segments. The Personal Total Solution segment provides services to individual customers. The Corporate Business (corporate total solution business and corporate asset management business) segment provides services to corporate customers. The Securities Agency segment provides securities agency services. The Real Estate segment provides real estate service. The Contract segment manages and operates pensions and assets. The Market segment is engaged in marketing business, market making business, investment business, and financial management business. The Other segment include research business, consulting business, and real estate leasing and management business."
170,9434.T,"SoftBank Corp. is a Japan-based company mainly engaged in the communication business. The Company has three business segments. The Consumer segment is engaged in the provision of mobile communication services under brands SoftBank, Y! mobile and LINE mobile, as well as broadband services for individual customers. The Corporate segment is engaged in the provision of mobile communication services, landline telephone services, telecommunications consulting and construction services, equipment rental and maintenance services, data center services for corporate customers. The Distribution segment is engaged in the provision of hardware, software and services that support cloud and Internet of Things (IoT) solutions for corporate customers, and the provision of accessories for individual customers. The Company is also engaged in the payment agency business, public cloud services business, online business, as well as digital medias and contents business."
171,9984.T,"SoftBank Group Corp. is a Japan-based company principally engaged in the communication and Internet related business. The Company operates in six business segments. Softbank segment is involved in the sale of mobile terminals, the provision of mobile communication services and fixed communication services in Japan. The Segment also sells mobile terminal accessories, PC software and peripherals. Sprint segment is involved in the provision of mobile communication services and others in the US. Yahoo segment conducts advertising business on the Internet, e-commerce business and membership service business. ARM segment is involved in the design of IP and related technologies for microprocessors, and the sale of software tools. Softbank Vision Fund and Delta Fund segment conducts investment activities in the technology area. Bright Star segment conducts distribution of mobile terminals overseas. The Company is also involved in Fortress and Fukuoka Softbank Hawks related business."
172,2768.T,"Sojitz Corp is a Japan-based company mainly engaged in trading business, investment and financial activities. It has nine business segments. Automobile segment exports and sells automobile. Aviation and Transportation Project segment engages in the aviation, transportation social infrastructure, and ship operations business. Machinery and Medical Infrastructure segment engages in the industrial machinery business, medical business and others. Energy Social Infrastructure segment engages in environmental infrastructure business, power related business, and others. Metals and Resources segment provides coal, aluminum, precious metal. Chemicals segment provides organic and inorganic chemicals, fine chemicals. Food and Agribusiness segment provides grains, wheat flour, fats and oil. Retail and Life Material segment provides textiles, clothes, frozen food. Industrial Infrastructure and Urban Development segment engages in real estate business. It also develops green chemicals and biofuels."
173,8630.T,"Sompo Holdings, Inc. is a Japan-based company mainly engaged in the non-life insurance business, life insurance business and other business. The Company operates in four business segments. The Domestic Non-life Insurance segment is mainly engaged in the non-life insurance business, the asset management business and related business in Japan. The Overseas Insurance segment is mainly engaged in the insurance business and the asset management business in the United States, United Kingdom, Turkey, Singapore, Malaysia, Indonesia, China, Brazil, India and other markets. The Domestic Life Insurance segment is mainly engaged in the life insurance business and the asset management business in Japan. The Nursing Care and Health Care segment is mainly engaged in the provision of nursing care services and health care services. The Company is also engaged in the asset management business, risk management business, defined contribution pension business and others."
174,6758.T,"Sony Group Corp is engaged in the games & network services (G&NS), music, movies, electronics products & solutions (EP&S), imaging & sensing solutions (I&SS), finance and other businesses. The G&NS field is involved in the network service business, the manufacture and sale of home video game consoles and software. The music field mainly includes music production, music publishing and video media platform businesses. The film field mainly includes film production, television program production and media network businesses. The EP&S field mainly includes the TV business, audio, video business, still image, video camera business, smartphone business and Internet-related service business. The I&SS field mainly includes the image sensor business. The financial field is involved in the insurance business, which mainly focuses on personal life insurance and non-life insurance, as well as the banking business. The Other fields consist of activities such as disc manufacturing business."
175,7270.T,"SUBARU CORPORATION is a Japan-based company engaged in the manufacture of Subaru automobiles. The Company operates through two business segments. The Automobile segment is engaged in the manufacture, sale and repairing of mini cars, small cars, ordinary cars and their parts. The Aerospace segment is engaged in the manufacture, sale and repairing of aircraft, space-related equipment and parts. The Company is also engaged in real estate leasing business, the manufacture and sale of houses, as well as the provision of repair services of houses."
176,3436.T,"SUMCO CORPORATION is a Japan-based company principally engaged in the manufacture and sale of high-purity silicon. The Company operates High-purity Silicon segment, which is mainly involved in the manufacture and sale of various silicon wafers for semiconductors, including polished wafers, epitaxial wafers and other semiconductors applied in the manufacture of memory products and micro processing units (MPUs). The Company manufactures polished wafers of diameters and epitaxial wafers with special processing on the surface at domestic and overseas manufacturing bases."
177,4005.T,"SUMITOMO CHEMICAL COMPANY, LIMITED is a Japan-based company engaged in the comprehensive chemical business. The Company operates in five business segments. Petrochemicals segment provides petrochemicals, inorganic chemicals, and synthetic resin processed products. Energy & Functional Materials segment provides alumina products, additives, and battery components. Information Electronics segment provides optical products, color filters, and semiconductor process materials. Health & Agriculture-Related segment provides agricultural chemicals, fertilizers, pesticides, tropical infectious disease control materials. Pharmaceuticals segment provides prescription drugs, radiodiagnostics, and other products. The Company is also involved in the supply of electricity and steam, the design and construction supervision of chemical industry facilities, the transportation and warehousing business, as well as the physical property analysis and environmental analysis business."
178,8053.T,"Sumitomo Corp is an integrated trading company. It operates through six business segments: Metal Products, which includes various metal products, such as steel products and non-ferrous metal products; Transportation & Construction Systems, which is engaged in transactions involving ships, aircrafts, transportation systems, motor vehicles, construction equipment, and related components and parts; Infrastructure, which is engaged in a range of overseas infrastructure development projects, such as power generation, renewable energy business and others; Media and Digital, which is engaged in cable television (TV) operations and movie business, among others; Life and Real Estate, which includes food supermarkets, healthcare-related businesses, facility and fund management, real estate business and others, and Mineral Resources and Chemical, which is engaged in the development and trading of mineral and energy resources and commodity derivative transactions."
